data_captura,hora_captura,codigo_fundo,nome_fundo,cnpj,administrador,segmento,tipo,mandato,prazo_duracao,gestao,data_encerramento,cotistas,patrimonio_liquido
2026-06-01,20:52:24,ADSH11,AD SHOPPING FUNDO DE INVESTIMENTO IMOBILIÁRIO RESPONSABILIDADE LIMITADA,,,,,,,,,,
2026-06-01,20:52:24,AFHI11,AF INVEST CRI FUNDO DE INVESTIMENTO IMOBILIÁRIO RECEBÍVEIS IMOBILIÁRIOS RESPONSABILIDADE LIMITADA,,,,,,,,,,
2026-06-01,20:52:24,AFHF11,AF INVEST REAL ESTATE MULTIESTRATÉGIA FUNDO DE INVESTIMENTO IMOBILIÁRIO - RESPONSABILIDADE LIMITADA,,,,,,,,,,
2026-06-01,20:52:24,ATWN11,AIRPORT TOWN FUNDO DE INVESTIMENTO IMOBILIARIO - FII,,,,,,,,,,
2026-06-01,20:52:24,AJFI11,AJ MALLS FUNDO DE INVESTIMENTO IMOBILIÁRIO RESPONSABILIDADE LIMITADA,,,,,,,,,,
2026-06-01,20:52:24,ALZC11,ALIANZA CRÉDITO IMOBILIÁRIO FUNDO DE INVESTIMENTO IMOBILIÁRIO RESPONSABILIDADE LIMITADA,,,,,,,,,,
2026-06-01,20:52:24,MTOF11,ALIANZA MULTIOFFICES - FUNDO DE INVESTIMENTO IMOBILIÁRIO - RESPONSABILIDADE LIMITADA,,,,,,,,,,
2026-06-01,20:52:24,ALZR11,ALIANZA TRUST RENDA IMOBILIÁRIA - FUNDO DE INVESTIMENTO IMOBILIÁRIO RESPONSABILIDADE LIMITADA,,,,,,,,,,
2026-06-01,20:52:24,AURB11,ALIANZA URBAN HUB RENDA FUNDO DE INVESTIMENTO IMOBILIÁRIO RESPONSABILIDADE LIMITADA,,,,,,,,,,
2026-06-01,20:52:24,APXM11,APEX MALLS FUNDO DE INVESTIMENTO IMOBILIÁRIO RESPONSABILIDADE LIMITADA,,,,,,,,,,
2026-06-01,20:52:24,APXU11,APEX URB FUNDO DE INVESTIMENTO IMOBILIÁRIO RESPONSABILIDADE LIMITADA,,,,,,,,,,
2026-06-01,20:52:24,AIEC11,ARCH EDIFÍCIOS CORPORATIVOS FUNDO DE INVESTIMENTO IMOBILIÁRIO - RESPONSABILIDADE LIMITADA,,,,,,,,,,
2026-06-01,20:52:24,AVUR11,ARCH VANGUARDA UNIDADES RESIDENCIAIS FUNDO DE INVESTIMENTO IMOBILIÁRIO RESPONSABILIDADE LIMITADA,,,,,,,,,,
2026-06-01,20:52:24,AROA11,AROEIRA 333 RENDA LOGÍSTICA FUNDO DE INVESTIMENTO IMOBILIÁRIO RESPONSABILIDADE LIMITADA,,,,,,,,,,
2026-06-01,20:52:24,EIRA11,AROEIRA FUNDO DE INVESTIMENTO IMOBILIÁRIO - RESPONSABILIDADE LIMITADA,,,,,,,,,,
2026-06-01,20:52:24,ARTE11,ÁRTEMIS FUNDO DE INVESTIMENTO IMOBILIÁRIO RESPONSABILIDADE LIMITADA,,,,,,,,,,
2026-06-01,20:52:24,ARXD11,ARX DOVER RECEBÍVEIS FUNDO DE INVESTIMENTO IMOBILIÁRIO DE RESPONSABILIDADE LIMITADA,,,,,,,,,,
2026-06-01,20:52:24,AZPE11,AZ QUEST PANORAMA CRÉDITO ESTRUTURADO FUNDO DE INVESTIMENTO IMOBILIÁRIO DE RESPONSABILIDADE LIMITADA,,,,,,,,,,
2026-06-01,20:52:24,AZPL11,AZ QUEST PANORAMA LOGÍSTICA FUNDO DE INVESTIMENTO IMOBILIÁRIO - RESPONSABILIDADE LIMITADA,,,,,,,,,,
2026-06-01,20:52:24,AZSG11,AZ SOLARGRID RENDA  SOLAR FUNDO DE INVESTIMENTO IMOBILIÁRIO RESPONSABILIDADE  LIMITADA,,,,,,,,,,
2026-06-01,20:52:24,CEBB11,BALTIMORE FUNDO DE INVESTIMENTO IMOBILIÁRIO DE RESPONSABILIDADE LIMITADA,,,,,,,,,,
2026-06-01,20:52:24,BCRI11,BANESTES RECEBÍVEIS  IMOBILIÁRIOS FUNDO DE INVESTIMENTO IMOBILIÁRIO - FII - RESPONSABILIDADE LIMITAD,,,,,,,,,,
2026-06-01,20:52:24,BNFS11,BANRISUL NOVAS FRONTEIRAS FUNDO DE INVESTIMENTO IMOBILIARIO - RESPONSABILIDADE LIMITADA,,,,,,,,,,
2026-06-01,20:52:24,BTML11,BARRA MALLS FUNDO DE INVESTIMENTO IMOBILIÁRIO,,,,,,,,,,
2026-06-01,20:52:24,BZEL11,BARZEL CD1 FUNDO DE INVESTIMENTO IMOBILIARIO RESPONSABILIDADE LIMITADA,,,,,,,,,,
2026-06-01,20:52:24,BPDR11,BASÍLICA PARTNERS GDR FUNDO DE INVESTIMENTO IMOBILIÁRIO FII RESPONSABILIDADE LIMITADA,,,,,,,,,,
2026-06-01,20:52:24,BPLC11,BASÍLICA PARTNERS LED CORPORATE FUNDO DE INVESTIMENTO IMOBILIÁRIO FII,,,,,,,,,,
2026-06-01,20:52:24,BPMW11,BASÍLICA PARTNERS MEDWELL FUNDO DE INVESTIMENTO IMOBILIÁRIO FII RESPONSABILIDADE LIMITADA,,,,,,,,,,
2026-06-01,20:52:24,BBFO11,BB FUNDO DE FUNDOS - FUNDO DE INVESTIMENTO IMOBILIÁRIO RESPONSABILIDADE LIMITADA,,,,,,,,,,
2026-06-01,20:52:24,BBIG11,BB PREMIUM MALLS FUNDO DE INVESTIMENTO IMOBILIÁRIO DE RESPONSABILIDADE LIMITADA,,,,,,,,,,
2026-06-01,20:52:24,BBRC11,BB RENDA CORPORATIVA FUNDO DE INVESTIMENTO IMOBILIÁRIO RESPONSABILIDADE LIMITADA,,,,,,,,,,
2026-06-01,20:52:24,BINR11,BE IN RIO FUNDO DE INVESTIMENTO IMOBILIÁRIO - RESPONSABILIDADE LIMITADA,,,,,,,,,,
2026-06-01,20:52:24,BFCC11,BFC FUNDO DE INVESTIMENTO IMOBILIÁRIO,,,,,,,,,,
2026-06-01,20:52:24,BGRB11,BGR B32 FUNDO DE INVESTIMENTO IMOBILIÁRIO,,,,,,,,,,
2026-06-01,20:52:24,BGRJ11,BGR CIDADE JARDIM FUNDO DE INVESTIMENTO IMOBILIÁRIO - RESPONSABILIDADE LIMITADA,,,,,,,,,,
2026-06-01,20:52:24,BLOG11,BLUECAP LOG FUNDO DE INVESTIMENTO IMOBILIÁRIO,,,,,,,,,,
2026-06-01,20:52:24,BLMG11,BLUEMACAW FUNDO DE INVESTIMENTO IMOBILIÁRIO RESPONSABILIDADE LIMITADA,,,,,,,,,,
2026-06-01,20:52:24,BMLC11,BM BRASCAN LAJES CORPORATIVAS FUNDO DE INVESTIMENTO IMOBILIÁRIO RESPONSABILIDADE LIMITADA,,,,,,,,,,
2026-06-01,20:52:24,BRSE11,BR7 SENADO FUNDO DE INVESTIMENTO IMOBILIÁRIO,,,,,,,,,,
2026-06-01,20:52:24,BCIA11,BRADESCO CARTEIRA IMOBILIÁRIA ATIVA - FUNDO DE FUNDOS DE INVESTIMENTO IMOBILIÁRIO - FII,,,,,,,,,,
2026-06-01,20:52:24,BVAR11,BRASIL VAREJO FUNDO DE INVESTIMENTO IMOBILIÁRIO RESPONSABILIDADE LIMITADA,,,,,,,,,,
2026-06-01,20:52:24,CARE11,BRAZILIAN GRAVEYARD AND DEATH CARE SERVICES FUNDO DE INVESTIMENTO IMOBILIÁRIO - FII RESP LIMITADA,,,,,,,,,,
2026-06-01,20:52:24,FATN11,BRC RENDA CORPORATIVA FUNDO DE INVESTIMENTO IMOBILIÁRIO - RESPONSABILIDADE LIMITADA,,,,,,,,,,
2026-06-01,20:52:24,RTEL11,BRC-II FUNDO DE INVESTIMENTO IMOBILIÁRIO - RESPONSABILIDADE LIMITADA,,,,,,,,,,
2026-06-01,20:52:24,BRCT11,BRC-III DESENVOLVIMENTO FUNDO DE INVESTIMENTO IMOBILIÁRIO - RESPONSABILIDADE LIMITADA,,,,,,,,,,
2026-06-01,20:52:24,BRCD11,BRESCO DESENVOLVIMENTO FUNDO DE INVESTIMENTO IMOBILIÁRIO RESPONSABILIDADE LIMITADA,,,,,,,,,,
2026-06-01,20:52:24,BRCO11,BRESCO LOGÍSTICA FUNDO DE INVESTIMENTO IMOBILIÁRIO RESPONSABILIDADE LIMITADA,,,,,,,,,,
2026-06-01,20:52:24,BICE11,BRIO CRÉDITO ESTRUTURADO - FUNDO DE INVESTIMENTO IMOBILIÁRIO - RESPONSABILIDADE LIMITADA,,,,,,,,,,
2026-06-01,20:52:24,BIME11,BRIO MULTIESTRATÉGIA - FUNDO DE INVESTIMENTO IMOBILIÁRIO RESPONSABILIDADE LIMITADA,,,,,,,,,,
2026-06-01,20:52:24,BRIM11,BRIO REAL ESTATE II - FUNDO DE INVESTIMENTO IMOBILIÁRIO - RESPONSABILIDADE LIMITADA,,,,,,,,,,
2026-06-01,20:52:24,BRIP11,BRIO REAL ESTATE III - FUNDO DE INVESTIMENTO IMOBILIÁRIO - RESPONSABILIDADE LIMITADA,,,,,,,,,,
2026-06-01,20:52:24,BIPD11,BRIO REAL ESTATE IV - FUNDO DE INVESTIMENTO IMOBILIÁRIO - RESPONSABILIDADE LIMITADA,,,,,,,,,,
2026-06-01,20:52:24,BIPE11,BRIO REAL ESTATE V - FUNDO DE INVESTIMENTO IMOBILIÁRIO - RESPONSABILIDADE LIMITADA,,,,,,,,,,
2026-06-01,20:52:24,MCMV11,BRM MINHA CASA MINHA VIDA III FUNDO DE INVESTIMENTO IMOBILIÁRIO RESPONSABILIDADE LIMITADA,,,,,,,,,,
2026-06-01,20:52:24,BROF11,BRPR CORPORATE OFFICES FUNDO DE INVESTIMENTO IMOBILIÁRIO RESPONSABILIDADE LIMITADA,,,,,,,,,,
2026-06-01,20:52:24,BETW11,BRPR E-TOWER FUNDO DE INVESTIMENTO IMOBILIÁRIO,,,,,,,,,,
2026-06-01,20:52:24,LLAO11,BS2 ALLINVESTMENTS FUNDO DE INVESTIMENTO IMOBILIÁRIO,,,,,,,,,,
2026-06-01,20:52:24,BTHR11,BTG HOSPITALIDADE RETORNO TOTAL FUNDO DE INVESTIMENTO IMOBILIÁRIO  RESPONSABILIDADE LIMITADA,,,,,,,,,,
2026-06-01,20:52:24,BTHI11,BTG HOTÉIS FUNDO DE INVESTIMENTO IMOBILIÁRIO RESPONSABILIDADE LIMITADA,,,,,,,,,,
2026-06-01,20:52:24,BRCR11,BTG PACTUAL CORPORATE OFFICE FUND - FUNDO DE INVESTIMENTO IMOBILIÁRIO RESPONSABILIDADE LIMITADA,,,,,,,,,,
2026-06-01,20:52:24,BTCI11,BTG PACTUAL CRÉDITO IMOBILIÁRIO - FUNDO DE CRI - FI IMOBILIÁRIO RESPONSABILIDADE LIMITADA,,,,,,,,,,
2026-06-01,20:52:24,BTLG11,BTG PACTUAL LOGÍSTICA FUNDO DE INVESTIMENTO IMOBILIÁRIO RESPONSABILIDADE LIMITADA,,,,,,,,,,
2026-06-01,20:52:24,BTHF11,BTG PACTUAL REAL ESTATE HEDGE FUND FII - FUNDO DE INVESTIMENTO IMOBILIÁRIO RESPONSABILIDADE LIMITADA,,,,,,,,,,
2026-06-01,20:52:24,BPML11,BTG PACTUAL SHOPPINGS FUNDO DE INVESTIMENTO IMOBILIÁRIO RESPONSABILIDADE LIMITADA,,,,,,,,,,
2026-06-01,20:52:24,BTYU11,BTG PACTUAL YOU INC. DESENVOLVIMENTO IMOBILIÁRIO - FUNDO DE INVESTIMENTO IMOBILIÁRIO RESPONSABILIDAD,,,,,,,,,,
2026-06-01,20:52:24,BTWR11,BTOWERS FUNDO DE INVESTIMENTO IMOBILIÁRIO RESPONSABILIDADE LIMITADA,,,,,,,,,,
2026-06-01,20:52:24,BTSI11,BTSP II FUNDO DE INVESTIMENTO IMOBILIÁRIO FII RESPONSABILIDADE LIMITADA,,,,,,,,,,
2026-06-01,20:52:24,CXCO11,CAIXA IMÓVEIS CORPORATIVOS FUNDO DE INVESTIMENTO IMOBILIÁRIO - RESPONSABILIDADE LIMITADA,,,,,,,,,,
2026-06-01,20:52:24,CRFF11,CAIXA RIO BRAVO FUNDO DE FUNDOS DE INVESTIMENTO IMOBILIÁRIO II RESPONSABILIDADE LIMITADA,,,,,,,,,,
2026-06-01,20:52:24,CXRI11,CAIXA RIO BRAVO FUNDO DE FUNDOS DE INVESTIMENTO IMOBILIARIO RESPONSABILIDADE LIMITADA,,,,,,,,,,
2026-06-01,20:52:24,CCME11,CANUMA CAPITAL MULTIESTRATÉGIA FUNDO DE INVESTIMENTO IMOBILIÁRIO RESPONSABILIDADE LIMITADA,,,,,,,,,,
2026-06-01,20:52:24,CCVA11,CANUMA CAPITAL RENDA VAREJO FUNDO DE INVESTIMENTO IMOBILIÁRIO RESPONSABILIDADE LIMITADA,,,,,,,,,,
2026-06-01,20:52:24,KONG11,CAPITANIA ARTON JARDIM PAULISTANO FUNDO DE INVESTIMENTO IMOBILIÁRIO RESPONSABILIDADE LIMITADA,,,,,,,,,,
2026-06-01,20:52:24,CPUR11,CAPITÂNIA HBC RENDA URBANA FUNDO DE INVESTIMENTO IMOBILIÁRIO RESPONSABILIDADE  LIMITADA,,,,,,,,,,
2026-06-01,20:52:24,CPLG11,CAPITÂNIA LOGÍSTICA FUNDO DE INVESTIMENTO IMOBILIÁRIO - RESPONSABILIDADE LIMITADA,,,,,,,,,,
2026-06-01,20:52:24,CPOF11,CAPITÂNIA OFFICE FII - FUNDO DE INVESTIMENTO IMOBILIÁRIO,,,,,,,,,,
2026-06-01,20:52:24,CPTS11,CAPITÂNIA SECURITIES II FUNDO DE INVESTIMENTO IMOBILIÁRIO RESPONSABILIDADE LIMITADA,,,,,,,,,,
2026-06-01,20:52:24,CPSH11,CAPITÂNIA SHOPPINGS FUNDO DE INVESTIMENTO IMOBILIÁRIO - RESPONSABILIDADE LIMITADA,,,,,,,,,,
2026-06-01,20:52:24,CACR11,CARTESIA RECEBÍVEIS IMOBILIÁRIOS - FUNDO DE INVESTIMENTO IMOBILIÁRIO DE RESPONSABILIDADE LIMITADA,,,,,,,,,,
2026-06-01,20:52:24,CBOP11,CASTELLO BRANCO OFFICE PARK - FUNDO DE INVESTIMENTO IMOBILIÁRIO - RESPONSABILIDADE LIMITADA,,,,,,,,,,
2026-06-01,20:52:24,BLCA11,CATUAÍ VBI TRIPLE A FUNDO DE INVESTIMENTO IMOBILIÁRIO - RESPONSABILIDADE LIMITADA,,,,,,,,,,
2026-06-01,20:52:24,CVFL11,CATUAÍ VISTA FL FUNDO DE INVESTIMENTO IMOBILIÁRIO DE RESPONSABILIDADE LIMITADA,,,,,,,,,,
2026-06-01,20:52:24,CNES11,CENESP FUNDO DE INVESTIMENTO IMOBILIÁRIO RESPONSABILIDADE LIMITADA,,,,,,,,,,
2026-06-01,20:52:24,CDHY11,CENTRAL REAL ESTATE HIGH YIELD DEBT FUNDO DE INVESTIMENTO IMOBILIÁRIO RESPONSABILIDADE LIMITADA,,,,,,,,,,
2026-06-01,20:52:24,CTXT11,CENTRO TÊXTIL INTERNACIONAL FUNDO DE INVESTIMENTO IMOBILIÁRIO DE RESPONSABILIDADE LIMITADA,,,,,,,,,,
2026-06-01,20:52:24,CENU11,CENU - FUNDO DE INVESTIMENTO IMOBILIÁRIO RESPONSABILIDADE LIMITADA,,,,,,,,,,
2026-06-01,20:52:24,CFII11,CF3  FUNDO DE INVESTIMENTO IMOBILIÁRIO,,,,,,,,,,
2026-06-01,20:52:24,CFHF11,CF4 FUNDO DE INVESTIMENTO IMOBILIÁRIO DE RESPONSABILIDADE LIMITADA,,,,,,,,,,
2026-06-01,20:52:24,CJCT11,CIDADE JARDIM CONTINENTAL TOWER FUNDO DE INVESTIMENTO IMOBILIÁRIO DE RESPONSABILIDADE LIMITADA,,,,,,,,,,
2026-06-01,20:52:24,CLSM11,CITLOG SUL DE MINAS FUNDO DE INVESTIMENTO IMOBILIÁRIO DE RESPONSABILIDADE LIMITADA,,,,,,,,,,
2026-06-01,20:52:24,CIXM11,CIX MUIRAQUITAN FUNDO DE INVESTIMENTO IMOBILIÁRIO RESPONSABILIDADE LIMITADA,,,,,,,,,,
2026-06-01,20:52:24,CIXF11,CIX RETROFIT FUNDO DE INVESTIMENTO IMOBILIÁRIO RESPONSABILIDADE LIMITADA,,,,,,,,,,
2026-06-01,20:52:24,PDBM11,CLASSE A DE COTAS DO SINAL RJDI - BRASIL MALLS FUNDO DE INVESTIMENTO IMOBILIÁRIO RESP LIMITADA,,,,,,,,,,
2026-06-01,20:52:24,CLIN11,CLAVE ÍNDICES DE PREÇOS FUNDO DE INVESTIMENTO IMOBILIÁRIO RESPONSABILIDADE LIMITADA,,,,,,,,,,
2026-06-01,20:52:24,CSMC11,COSMIC FUNDO DE INVESTIMENTO IMOBILIÁRIO DE RESPONSABILIDADE LIMITADA,,,,,,,,,,
2026-06-01,20:52:24,RENV11,CPV ENERGIA FUNDO DE INVESTIMENTO IMOBILIÁRIO RESPONSABILIDADE LIMITADA,,,,,,,,,,
2026-06-01,20:52:24,IBCR11,CRI INTEGRAL BREI FUNDO DE INVESTIMENTO IMOBILIÁRIO RESPONSABILIDADE LIMITADA,,,,,,,,,,
2026-06-01,20:52:24,CVPR11,CVPAR FUNDO DE INVESTIMENTO IMOBILIÁRIO DE CRI RESPONSABILIDADE LIMITADA,,,,,,,,,,
2026-06-01,20:52:24,CYCR11,CYRELA CRÉDITO - FUNDO DE INVESTIMENTO IMOBILIÁRIO - RESPONSABILIDADE LIMITADA,,,,,,,,,,
2026-06-01,20:52:24,CYLD11,CYRELA DESENVOLVIMENTO LOGÍSTICO FUNDO DE INVESTIMENTO IMOBILIÁRIO RESPONSABILIDADE LIMITADA,,,,,,,,,,
2026-06-01,20:52:24,DAMA11,DAMA FUNDO DE INVESTIMENTO IMOBILIÁRIO RESPONSABILIDADE LIMITADA,,,,,,,,,,
2026-06-01,20:52:24,DAYM11,DAYCOVAL REAL ESTATE MULTIESTRATÉGIA FUNDO DE INVESTIMENTO IMOBILIÁRIO DE RESPONSABILIDADE LIMITADA,,,,,,,,,,
2026-06-01,20:52:24,ASRF11,DAYCOVAL RETROFITS I FUNDO DE INVESTIMENTO IMOBILIÁRIO RESPONSABILIDADE LIMITADA,,,,,,,,,,
2026-06-01,20:52:24,DLMT11,DEL MONTE AJAX FUNDO DE INVESTIMENTO IMOBILIÁRIO - FII DE RESPONSABILIDADE LIMITADA,,,,,,,,,,
2026-06-01,20:52:24,DPRO11,DEVANT PROPERTIES FUNDO DE INVESTIMENTO IMOBILIÁRIO DE RESPONSABILIDADE LIMITADA,,,,,,,,,,
2026-06-01,20:52:24,DEVA11,DEVANT RECEBÍVEIS IMOBILIÁRIOS FUNDO DE INVESTIMENTO IMOBILIÁRIO RESPONSABILIDADE LIMITADA,,,,,,,,,,
2026-06-01,20:52:24,DAMT11,DIAMANTE FUNDO DE INVESTIMENTO IMOBILIÁRIO RESPONSABILIDADE LIMITADA,,,,,,,,,,
2026-06-01,20:52:24,DOVL11,DOVEL FUNDO DE INVESTIMENTO IMOBILIÁRIO - RESPONSABILIDADE LIMITADA,,,,,,,,,,
2026-06-01,20:52:24,EDGE11,EDGE FUNDO DE INVESTIMENTO IMOBILIÁRIO DE RESPONSABILIDADE LIMITADA,,,,,,,,,,
2026-06-01,20:52:24,EMET11,EMET MULTIESTRATÉGIA FUNDO DE INVESTIMENTO I MOBILIÁRIO RESPONSABILIDADE LIMITADA,,,,,,,,,,
2026-06-01,20:52:24,EGYR11,ENERGY RESORT FUNDO DE INVESTIMENTO IMOBILIÁRIO,,,,,,,,,,
2026-06-01,20:52:24,EQIR11,EQI RECEBÍVEIS IMOBILIÁRIOS FUNDO DE INVESTIMENTO IMOBILIÁRIO RESPONSABILIDADE LIMITADA,,,,,,,,,,
2026-06-01,20:52:24,ERCR11,ESTOQUE RESIDENCIAL E COMERCIAL RIO DE JANEIRO FUNDO DE INVESTIMENTO IMOBILIÁRIO - RESP LIMITADA,,,,,,,,,,
2026-06-01,20:52:24,ERPA11,EUROPA 105  FUNDO DE INVESTIMENTO IMOBILIÁRIO - RESPONSABILIDADE LIMITADA,,,,,,,,,,
2026-06-01,20:52:24,KEVE11,EVEN II KINEA FUNDO DE INVESTIMENTO IMOBILIÁRIO RESPONSABILIDADE LIMITADA,,,,,,,,,,
2026-06-01,20:52:24,EXES11,EXES FUNDO DE INVESTIMENTO IMOBILIÁRIO RESPONSABILIDADE LIMITADA,,,,,,,,,,
2026-06-01,20:52:24,FLCR11,FARIA LIMA CAPITAL RECEBÍVEIS IMOBILIÁRIOS I - FUNDO DE INVESTIMENTO IMOBILIÁRIO RESPONSABILIDADE LI,,,,,,,,,,
2026-06-01,20:52:24,FTRR11,FATOR RECEBÍVEIS IMOBILIÁRIOS FUNDO DE INVESTIMENTO IMOBILIÁRIO DE RESPONSABILIDADE LIMITADA,,,,,,,,,,
2026-06-01,20:52:24,VRTA11,FATOR VERITA FUNDO DE INVESTIMENTO IMOBILIARIO,,,,,,,,,,
2026-06-01,20:52:24,VRTM11,FATOR VERITÀ MULTIESTRATÉGIA FUNDO DE INVESTIMENTO IMOBILIÁRIO,,,,,,,,,,
2026-06-01,20:52:24,FTRE11,FIGTREE RENDA EDUCACIONAL FUNDO DE INVESTIMENTO IMOBILIÁRIO,,,,,,,,,,
2026-06-01,20:52:24,FLMA11,FII CONTINENTAL SQUARE FARIA LIMA - RESPONSABILIDADE LIMITADA,,,,,,,,,,
2026-06-01,20:52:24,EGDB11,FII DE DESENVOLVIMENTO DE ESCRITÓRIOS BOUTIQUE RESPONSABILIDADE LIMITADA,,,,,,,,,,
2026-06-01,20:52:24,ELDO11,FII ELDORADO FUNDO DE INVESTIMENTO IMOBILIÁRIO - RESPONSABILIDADE LIMITADA,,,,,,,,,,
2026-06-01,20:52:24,EURO11,FII EUROPAR RESPONSABILIDADE LIMITADA,,,,,,,,,,
2026-06-01,20:52:24,HYPI11,FII HIRE PROPERTIES I - FUNDO DE INVESTIMENTO IMOBILIÁRIO,,,,,,,,,,
2026-06-01,20:52:24,HRES11,FII HIRE RESIDENCIAL I - FUNDO DE INVESTIMENTO IMOBILIÁRIO,,,,,,,,,,
2026-06-01,20:52:24,FIIB11,FII INDUSTRIAL DO BRASIL RESPONSABILIDADE LIMITADA,,,,,,,,,,
2026-06-01,20:52:24,FMOF11,FII MEMORIAL OFFICE RESPONSABILIDADE LIMITADA,,,,,,,,,,
2026-06-01,20:52:24,OPTM11,FII PATRIMONIAL IV,,,,,,,,,,
2026-06-01,20:52:24,FRBC11,FII RBC II FUNDO DE FUNDOS - RESPONSABILIDADE LIMITADA,,,,,,,,,,
2026-06-01,20:52:24,ALMI11,FII TORRE ALMIRANTE,,,,,,,,,,
2026-06-01,20:52:24,FLNR11,FLORIANO FUNDO DE INVESTIMENTO IMOBILIÁRIO,,,,,,,,,,
2026-06-01,20:52:24,HLMB11,FRAM CAPITAL HELMER MULTIATIVOS RENDA PREFERENCIAL FUNDO DE INVESTIMENTO IMOBILIÁRIO,,,,,,,,,,
2026-06-01,20:52:24,KFOF11,FUNDO DE FUNDOS DE INVESTIMENTO IMOBILIÁRIO KINEA FII RESPONSABILIDADE LIMITADA,,,,,,,,,,
2026-06-01,20:52:24,DVFF11,FUNDO DE INVESTIMENTO IMOBILIÁRIO - DEVANT FUNDO DE FUNDOS IMOBILIÁRIOS DE RESPONSABILIDADE LIMITADA,,,,,,,,,,
2026-06-01,20:52:24,ANCR11,FUNDO DE INVESTIMENTO IMOBILIÁRIO - FII ANCAR IC - RESPONSABILIDADE LIMITADA,,,,,,,,,,
2026-06-01,20:52:24,FAED11,FUNDO DE INVESTIMENTO IMOBILIÁRIO - FII ANHANGUERA EDUCACIONAL RESPONSABILIDADE LIMITADA,,,,,,,,,,
2026-06-01,20:52:24,FCFL11,FUNDO DE INVESTIMENTO IMOBILIÁRIO - FII CAMPUS FARIA LIMA RESPONSABILIDADE LIMITADA,,,,,,,,,,
2026-06-01,20:52:24,CEOC11,FUNDO DE INVESTIMENTO IMOBILIÁRIO - FII CEO CYRELA COMMERCIAL PROPERTIES RESPONSABILIDADE LIMITADA,,,,,,,,,,
2026-06-01,20:52:24,FAMB11,FUNDO DE INVESTIMENTO IMOBILIÁRIO - FII EDIFÍCIO ALMIRANTE BARROSO RESPONSABILIDADE LIMITADA,,,,,,,,,,
2026-06-01,20:52:24,EDGA11,FUNDO DE INVESTIMENTO IMOBILIÁRIO - FII EDIFÍCIO GALERIA RESPONSABILIADADE LIMITADA,,,,,,,,,,
2026-06-01,20:52:24,FYTO11,FUNDO DE INVESTIMENTO IMOBILIÁRIO - FII FYTO RECEBÍVEIS IMOBILIÁRIOS RESPONSABILIDADE LIMITADA,,,,,,,,,,
2026-06-01,20:52:24,HCRI11,FUNDO DE INVESTIMENTO IMOBILIÁRIO - FII HOSPITAL DA CRIANÇA RESPONSABILIDADE LIMITADA,,,,,,,,,,
2026-06-01,20:52:24,NSLU11,FUNDO DE INVESTIMENTO IMOBILIÁRIO - FII HOSPITAL NOSSA SENHORA DE LOURDES RESPONSABILIDADE LIMITADA,,,,,,,,,,
2026-06-01,20:52:24,MAXR11,FUNDO DE INVESTIMENTO IMOBILIÁRIO - FII MAX RETAIL RESPONSABILIDADE LIMITADA,,,,,,,,,,
2026-06-01,20:52:24,PQDP11,FUNDO DE INVESTIMENTO IMOBILIÁRIO - FII PARQUE DOM PEDRO SHOPPING CENTER RESPONSABILIDADE LIMITADA,,,,,,,,,,
2026-06-01,20:52:24,RBRI11,FUNDO DE INVESTIMENTO IMOBILIÁRIO - FII RBR DESENVOLVIMENTO III RESPONSABILIDADE LIMITADA,,,,,,,,,,
2026-06-01,20:52:24,RDIV11,FUNDO DE INVESTIMENTO IMOBILIÁRIO - FII RBR DESENVOLVIMENTO IV RESPONSABILIDADE LIMITADA,,,,,,,,,,
2026-06-01,20:52:24,RBRR11,FUNDO DE INVESTIMENTO IMOBILIARIO - FII RBR RENDIMENTO HIGH GRADE RESPONSABILIDADE LIMITADA,,,,,,,,,,
2026-06-01,20:52:24,RECR11,FUNDO DE INVESTIMENTO IMOBILIÁRIO - FII REC RECEBÍVEIS IMOBILIÁRIOS - RESPONSABILIDADE LIMITADA,,,,,,,,,,
2026-06-01,20:52:24,RECT11,FUNDO DE INVESTIMENTO IMOBILIÁRIO - FII REC RENDA IMOBILIÁRIA - RESPONSABILIDADE LIMITADA,,,,,,,,,,
2026-06-01,20:52:24,SHDP11,FUNDO DE INVESTIMENTO IMOBILIÁRIO - FII SHOPPING PARQUE D. PEDRO RESPONSABILIDADE LIMITADA,,,,,,,,,,
2026-06-01,20:52:24,TRNT11,FUNDO DE INVESTIMENTO IMOBILIÁRIO - FII TORRE NORTE,,,,,,,,,,
2026-06-01,20:52:24,APXR11,FUNDO DE INVESTIMENTO IMOBILIÁRIO APEX REALTY - FII,,,,,,,,,,
2026-06-01,20:52:24,BRHT11,FUNDO DE INVESTIMENTO IMOBILIÁRIO BR HOTÉIS,,,,,,,,,,
2026-06-01,20:52:24,BRCQ11,FUNDO DE INVESTIMENTO IMOBILIÁRIO BRC-IV DESENVOLVIMENTO RESPONSABILIDADE LIMITADA,,,,,,,,,,
2026-06-01,20:52:24,CXAG11,FUNDO DE INVESTIMENTO IMOBILIÁRIO CAIXA AGÊNCIAS - RESPONSABILIDADE LIMITADA,,,,,,,,,,
2026-06-01,20:52:24,CXCI11,FUNDO DE INVESTIMENTO IMOBILIÁRIO CAIXA CARTEIRA IMOBILIÁRIA RESPONSABILIDADE LIMITADA,,,,,,,,,,
2026-06-01,20:52:24,CXCE11,FUNDO DE INVESTIMENTO IMOBILIÁRIO CAIXA CEDAE RESPONSABILIDADE LIMITADA,,,,,,,,,,
2026-06-01,20:52:24,CXTL11,FUNDO DE INVESTIMENTO IMOBILIARIO CAIXA SEQ LOGISTICA RENDA RESPONSABILIDADE LIMITADA,,,,,,,,,,
2026-06-01,20:52:24,IDUA11,FUNDO DE INVESTIMENTO IMOBILIÁRIO DE UNIDADES AUTÔNOMAS IV,,,,,,,,,,
2026-06-01,20:52:24,LKDV11,FUNDO DE INVESTIMENTO IMOBILIÁRIO DEVELOPMENT V1 RESPONSABILIDADE LIMITADA,,,,,,,,,,
2026-06-01,20:52:24,EDFO11,FUNDO DE INVESTIMENTO IMOBILIÁRIO EDIFÍCIO OURINVEST - RESPONSABILIDADE LIMITADA,,,,,,,,,,
2026-06-01,20:52:24,NVHO11,FUNDO DE INVESTIMENTO IMOBILIÁRIO FII NOVO HORIZONTE - RESPONSABILIDADE LIMITADA,,,,,,,,,,
2026-06-01,20:52:24,GTWR11,FUNDO DE INVESTIMENTO IMOBILIÁRIO GREEN TOWERS RESPONSABILIDADE LIMITADA,,,,,,,,,,
2026-06-01,20:52:24,HBCR11,FUNDO DE INVESTIMENTO IMOBILIÁRIO HBC RENDA URBANA,,,,,,,,,,
2026-06-01,20:52:24,HUCG11,FUNDO DE INVESTIMENTO IMOBILIÁRIO HOSPITAL UNIMED CAMPINA GRANDE RESPONSABILIDADE LIMITADA,,,,,,,,,,
2026-06-01,20:52:24,HUSC11,FUNDO DE INVESTIMENTO IMOBILIARIO HOSPITAL UNIMED SUL CAPIXABA,,,,,,,,,,
2026-06-01,20:52:24,HOSI11,FUNDO DE INVESTIMENTO IMOBILIÁRIO HOUSI RESPONSABILIDADE LIMITADA,,,,,,,,,,
2026-06-01,20:52:24,FINF11,FUNDO DE INVESTIMENTO IMOBILIÁRIO INFRA REAL ESTATE - FII RESPONSABILIDADE LIMITADA,,,,,,,,,,
2026-06-01,20:52:24,BLUE11,FUNDO DE INVESTIMENTO IMOBILIÁRIO MACAM SHOPPING RESPONSABILIDADE LIMITADA,,,,,,,,,,
2026-06-01,20:52:24,MMPD11,FUNDO DE INVESTIMENTO IMOBILIÁRIO MAUÁ CAPITAL MPD DESENVOLVIMENTO RESIDENCIAL RESP LIMITADA,,,,,,,,,,
2026-06-01,20:52:24,MCCI11,FUNDO DE INVESTIMENTO IMOBILIÁRIO MAUÁ CAPITAL RECEBÍVEIS IMOBILIÁRIOS - FII RESPONSABILIDADE LIMITA,,,,,,,,,,
2026-06-01,20:52:24,WTSP11,FUNDO DE INVESTIMENTO IMOBILIÁRIO OURINVEST RE I - RESPONSABILIDADE LIMITADA,,,,,,,,,,
2026-06-01,20:52:24,PABY11,FUNDO DE INVESTIMENTO IMOBILIÁRIO PANAMBY,,,,,,,,,,
2026-06-01,20:52:24,RBRP11,FUNDO DE INVESTIMENTO IMOBILIÁRIO PATRIA PROPERTIES - FII RESPONSABILIDADE LIMITADA,,,,,,,,,,
2026-06-01,20:52:24,VTPA11,FUNDO DE INVESTIMENTO IMOBILIÁRIO PATRIMONIAL V RESPONSABILIDADE LIMITADA,,,,,,,,,,
2026-06-01,20:52:24,FPNG11,FUNDO DE INVESTIMENTO IMOBILIÁRIO PEDRA NEGRA RENDA IMOBILIÁRIA - RESPONSABILIDADE LIMITADA,,,,,,,,,,
2026-06-01,20:52:24,VTPL11,FUNDO DE INVESTIMENTO IMOBILIÁRIO PLUS RESPONSABILIDADE LIMITADA,,,,,,,,,,
2026-06-01,20:52:24,ESTQ11,FUNDO DE INVESTIMENTO IMOBILIARIO POLO ESTOQUE II RESPONSABILIDADE LIMITADA,,,,,,,,,,
2026-06-01,20:52:24,VPSI11,FUNDO DE INVESTIMENTO IMOBILIÁRIO POLO SHOPPING INDAIATUBA - RESPONSABILIDADE LIMITADA,,,,,,,,,,
2026-06-01,20:52:24,RBRY11,FUNDO DE INVESTIMENTO IMOBILIÁRIO RBR CRÉDITO IMOBILIÁRIO ESTRUTURADO RESPONSABILIDADE LIMITADA,,,,,,,,,,
2026-06-01,20:52:24,RELG11,FUNDO DE INVESTIMENTO IMOBILIÁRIO REC LOGÍSTICA - RESPONSABILIDADE  LIMITADA,,,,,,,,,,
2026-06-01,20:52:24,RLGX11,FUNDO DE INVESTIMENTO IMOBILIÁRIO REC LOGÍSTICA II - RESPONSABILIDADE LIMITADA,,,,,,,,,,
2026-06-01,20:52:24,RRES11,FUNDO DE INVESTIMENTO IMOBILIÁRIO RIVIERA RESIDENCIAL - RESPONSABILIDADE LIMITADA,,,,,,,,,,
2026-06-01,20:52:24,RZTR11,FUNDO DE INVESTIMENTO IMOBILIÁRIO RIZA TERRAX,,,,,,,,,,
2026-06-01,20:52:24,ROOF11,FUNDO DE INVESTIMENTO IMOBILIÁRIO ROOFTOP I RESPONSABILIDADE LIMITADA,,,,,,,,,,
2026-06-01,20:52:24,HOMS11,FUNDO DE INVESTIMENTO IMOBILIÁRIO ROOFTOP III RESPONSABILIDADE LIMITADA,,,,,,,,,,
2026-06-01,20:52:24,FISC11,FUNDO DE INVESTIMENTO IMOBILIÁRIO SC 401 - RESPONSABILIDADE LIMITADA,,,,,,,,,,
2026-06-01,20:52:24,SAIC11,FUNDO DE INVESTIMENTO IMOBILIARIO SIA CORPORATE RESPONSABILIDADE LIMITADA,,,,,,,,,,
2026-06-01,20:52:24,SMRE11,FUNDO DE INVESTIMENTO IMOBILIÁRIO SMART REAL ESTATE - FII RESPONSABILIDADE LIMITADA,,,,,,,,,,
2026-06-01,20:52:24,SOFF11,FUNDO DE INVESTIMENTO IMOBILIÁRIO SOFIA,,,,,,,,,,
2026-06-01,20:52:24,SPVJ11,FUNDO DE INVESTIMENTO IMOBILIÁRIO SUCCESPAR VAREJO RESPONSABILIDADE LIMITADA,,,,,,,,,,
2026-06-01,20:52:24,TGAR11,FUNDO DE INVESTIMENTO IMOBILIÁRIO TG ATIVO REAL,,,,,,,,,,
2026-06-01,20:52:24,TRCO11,FUNDO DE INVESTIMENTO IMOBILIÁRIO TORRE RIO CLARO OFFICES - RESPONSABILIDADE LIMITADA,,,,,,,,,,
2026-06-01,20:52:24,TRUE11,FUNDO DE INVESTIMENTO IMOBILIÁRIO TRUE MULTIESTRATÉGIA - RESPONSABILIDADE LIMITADA,,,,,,,,,,
2026-06-01,20:52:24,LVBI11,FUNDO DE INVESTIMENTO IMOBILIÁRIO VBI LOGÍSTICO - RESPONSABILIDADE LIMITADA,,,,,,,,,,
2026-06-01,20:52:24,PVBI11,FUNDO DE INVESTIMENTO IMOBILIÁRIO VBI PRIME PROPERTIES - RESPONSABILIDADE LIMITADA,,,,,,,,,,
2026-06-01,20:52:24,VERE11,FUNDO DE INVESTIMENTO IMOBILIÁRIO VEREDA - FII RESPONSABILIDADE LIMITADA,,,,,,,,,,
2026-06-01,20:52:24,FIVN11,FUNDO DE INVESTIMENTO IMOBILIÁRIO VIDA NOVA - FII - RESPONSABILIDADE LIMITADA,,,,,,,,,,
2026-06-01,20:52:24,VSHO11,FUNDO DE INVESTIMENTO IMOBILIÁRIO VOTORANTIM SHOPPING,,,,,,,,,,
2026-06-01,20:52:24,BMLT11,FUNDO DE INVESTIMENTOS  IMOBILIÁRIOS DE PERMUTA FINANCEIRA LOTE5 MEZANINO RESPONSABILIDADE  LIMITADA,,,,,,,,,,
2026-06-01,20:52:24,FIIC11,FUNDO DE INVESTIMENTOS IMOBILIÁRIO DO CAMPREV PARA SUSTENTABILIDADE PREVIDENCIÁRIA DO MUNICÍPIO,,,,,,,,,,
2026-06-01,20:52:24,BSLT11,FUNDO DE INVESTIMENTOS IMOBILIÁRIOS DE PERMUTA FINANCEIRA LOTE5 (SENIOR) RESPONSABILIDADE LIMITADA,,,,,,,,,,
2026-06-01,20:52:24,TCIN11,G5 CIDADE NOVA FUNDO DE INVESTIMENTO IMOBILIÁRIO,,,,,,,,,,
2026-06-01,20:52:24,GCDL11,GALAPAGOS DESENVOLVIMENTO LOGÍSTICO FUNDO DE INVESTIMENTO IMOBILIÁRIO RESPONSABILIDADE LIMITADA,,,,,,,,,,
2026-06-01,20:52:24,GSRF11,GALAPAGOS DESENVOLVIMENTO RESIDENCIAL FUNDO DE INVESTIMENTO IMOBILIÁRIO RESPONSABILIDADE LIMITADA,,,,,,,,,,
2026-06-01,20:52:24,GFDL11,GALAPAGOS FEEDER DESENVOLVIMENTO LOGÍSTICO FUNDO DE INVESTIMENTO IMOBILIÁRIO RESPONSABILIDADE LIMITA,,,,,,,,,,
2026-06-01,20:52:24,GLPF11,GALAPAGOS FEEDER LOGÍSTICO FUNDO DE INVESTIMENTO IMOBILIÁRIO RESPONSABILIDADE LIMITADA,,,,,,,,,,
2026-06-01,20:52:24,GLCR11,GALAPAGOS HEDGE FUND FUNDO DE INVESTIMENTO IMOBILIÁRIO RESPONSABILIDADE LIMITADA,,,,,,,,,,
2026-06-01,20:52:24,GCRI11,GALAPAGOS RECEBÍVEIS IMOBILIÁRIOS FUNDO DE INVESTIMENTO IMOBILIÁRIO RESPONSABILIDADE LIMITADA,,,,,,,,,,
2026-06-01,20:52:24,GCOI11,GALAPAGOS SPECIAL OPORTUNITIES FUNDO DE INVESTIMENTO IMOBILIÁRIO,,,,,,,,,,
2026-06-01,20:52:24,GZIT11,GAZIT MALLS FUNDO DE INVESTIMENTO IMOBILIÁRIO RESPONSABILIDADE LIMITADA,,,,,,,,,,
2026-06-01,20:52:24,FIGS11,GENERAL SHOPPING ATIVO E RENDA FUNDO DE INVESTIMENTO IMOBILIÁRIO DE RESPONSABILIDADE LIMITADA,,,,,,,,,,
2026-06-01,20:52:24,GSFI11,GENERAL SHOPPING E OUTLETS DO BRASIL FUNDO DE INVESTIMENTO IMOBILIÁRIO RESPONSABILIDADE LIMITADA,,,,,,,,,,
2026-06-01,20:52:24,VXXV11,GENESIS MULTIESTRATÉGIA FUNDO DE INVESTIMENTO IMOBILIÁRIO - FII -  RESPONSABILIDADE LIMITADA,,,,,,,,,,
2026-06-01,20:52:24,GLOG11,GENIAL LOGÍSTICA - FUNDO DE INVESTIMENTO IMOBILIÁRIO - RESPONSABILIDADE LIMITADA,,,,,,,,,,
2026-06-01,20:52:24,ABCP11,GRAND PLAZA SHOPPING FUNDO DE INVESTIMENTO IMOBILIÁRIO - RESPONSABILIDADE LIMITADA,,,,,,,,,,
2026-06-01,20:52:24,RCFA11,GRUPO RCFA FUNDO DE INVESTIMENTO IMOBILIARIO,,,,,,,,,,
