data_captura,hora_captura,codigo_fundo,nome_fundo,cnpj,administrador,segmento,tipo,mandato,prazo_duracao,gestao,data_encerramento,cotistas,patrimonio_liquido
2026-06-01,20:52:24,GAME11,GUARDIAN MULTIESTRATÉGIA IMOBILIÁRIA I FII DE RESPONSABILIDADE LIMITADA,,,,,,,,,,
2026-06-01,20:52:24,GARE11,GUARDIAN REAL ESTATE FUNDO DE INVESTIMENTO IMOBILIÁRIO DE RESPONSABILIDADE LIMITADA,,,,,,,,,,
2026-06-01,20:52:24,HABT11,HABITAT RECEBÍVEIS PULVERIZADOS FUNDO DE INVESTIMENTO IMOBILIÁRIO RESPONSABILIDADE LIMITADA,,,,,,,,,,
2026-06-01,20:52:24,ATCR11,HAZ FUNDO DE INVESTIMENTO IMOBILIÁRIO,,,,,,,,,,
2026-06-01,20:52:24,HCTB11,HCO CURITIBA I FUNDO DE INVESTIMENTO IMOBILIÁRIO DE RESPONSABILIDADE LIMITADA,,,,,,,,,,
2026-06-01,20:52:24,AERO11,HCO OPPS AERO I FII DE RESPONSABILIDADE LIMITADA,,,,,,,,,,
2026-06-01,20:52:24,HCTR11,HECTARE CE FUNDO DE INVESTIMENTO IMOBILIÁRIO RESPONSABILIDADE LIMITADA,,,,,,,,,,
2026-06-01,20:52:24,HCST11,HECTARE DESENVOLVIMENTO STUDENT HOUSING - FUNDO DE INVESTIMENTO IMOBILIÁRIO RESPONSABILIDADE LIMITAD,,,,,,,,,,
2026-06-01,20:52:24,HCHG11,HECTARE RECEBÍVEIS HIGH GRADE FUNDO DE INVESTIMENTO IMOBILIÁRIO - FII - RESP LIMITADA,,,,,,,,,,
2026-06-01,20:52:24,HAAA11,HEDGE AAA FUNDO DE INVESTIMENTO IMOBILIÁRIO DE RESPONSABILIDADE LIMITADA,,,,,,,,,,
2026-06-01,20:52:24,ATSA11,HEDGE ATRIUM SHOPPING SANTO ANDRÉ FUNDO DE INVESTIMENTO IMOBILIÁRIO DE RESPONSABILIDADE LIMITADA,,,,,,,,,,
2026-06-01,20:52:24,HGBL11,HEDGE BRASIL LOGÍSTICO INDUSTRIAL FUNDO DE INVESTIMENTO IMOBILIÁRIO DE RESPONSABILIDADE LIMITADA,,,,,,,,,,
2026-06-01,20:52:24,HGBS11,HEDGE BRASIL SHOPPING FUNDO DE INVESTIMENTO IMOBILIÁRIO DE RESPONSABILIDADE LIMITADA,,,,,,,,,,
2026-06-01,20:52:24,HDEL11,HEDGE DESENVOLVIMENTO LOGÍSTICO FUNDO DE INVESTIMENTO IMOBILIÁRIO DE RESPONSABILIDADE LIMITADA,,,,,,,,,,
2026-06-01,20:52:24,FLRP11,HEDGE FLORIPA SHOPPING FUNDO DE INVESTIMENTO IMOBILIÁRIO DE RESPONSABILIDADE LIMITADA,,,,,,,,,,
2026-06-01,20:52:24,HJCT11,HEDGE JHSF CAPITAL PRIME OFFICES FUNDO DE INVESTIMENTO IMOBILIÁRIO DE RESPONSABILIDADE LIMITADA,,,,,,,,,,
2026-06-01,20:52:24,HLOG11,HEDGE LOGÍSTICA FUNDO DE INVESTIMENTO IMOBILIÁRIO DE RESPONSABILIDADE LIMITADA,,,,,,,,,,
2026-06-01,20:52:24,HOFC11,HEDGE OFFICE INCOME FUNDO DE INVESTIMENTO IMOBILIÁRIO DE RESPONSABILIDADE LIMITADA,,,,,,,,,,
2026-06-01,20:52:24,HDOF11,HEDGE PALADIN DESIGN OFFICES FUNDO DE INVESTIMENTO IMOBILIÁRIO DE RESPONSABILIDADE LIMITADA,,,,,,,,,,
2026-06-01,20:52:24,HRDF11,HEDGE REALTY DEVELOPMENT FUNDO DE INVESTIMENTO IMOBILIÁRIO DE RESPONSABILIDADE LIMITADA,,,,,,,,,,
2026-06-01,20:52:24,HREC11,HEDGE RECEBÍVEIS IMOBILIÁRIOS FUNDO DE INVESTIMENTO IMOBILIÁRIO DE RESPONSABILIDADE LIMITADA,,,,,,,,,,
2026-06-01,20:52:24,SEED11,HEDGE SEED FUNDO DE INVESTIMENTO IMOBILIARIO DE RESPONSABILIDADE LIMITADA,,,,,,,,,,
2026-06-01,20:52:24,HPDP11,HEDGE SHOPPING PARQUE DOM PEDRO FUNDO DE INVESTIMENTO IMOBILIÁRIO DE RESPONSABILIDADE LIMITADA,,,,,,,,,,
2026-06-01,20:52:24,STRY11,HEDGE STRATEGY FUNDO DE INVESTIMENTO IMOBILIÁRIO DE RESPONSABILIDADE LIMITADA,,,,,,,,,,
2026-06-01,20:52:24,HFOF11,HEDGE TOP FOFII 3 FUNDO DE INVESTIMENTO IMOBILIÁRIO DE RESPONSABILIDADE LIMITADA,,,,,,,,,,
2026-06-01,20:52:24,YEES11,HEDGE YEES HABITAÇÕES ECONÔMICAS FUNDO DE INVESTIMENTO IMOBILIÁRIO DE RESPONSABILIDADE LIMITADA,,,,,,,,,,
2026-06-01,20:52:24,HGIC11,HGI CRÉDITOS IMOBILIÁRIOS FUNDO DE INVESTIMENTO IMOBILIÁRIO RESPONSABILIDADE LIMITADA,,,,,,,,,,
2026-06-01,20:52:24,HIRE11,HIRE FUNDO DE INVESTIMENTO IMOBILIÁRIO RESPONSABILIDADE LIMITADA,,,,,,,,,,
2026-06-01,20:52:24,HILG11,HIRE LOG I - FUNDO DE INVESTIMENTO IMOBILIÁRIO,,,,,,,,,,
2026-06-01,20:52:24,HTMX11,HOTEL MAXINVEST FUNDO DE INVESTIMENTO IMOBILIÁRIO RESPONSABILIDADE LIMITADA,,,,,,,,,,
2026-06-01,20:52:24,HSAF11,HSI ATIVOS FINANCEIROS FUNDO DE INVESTIMENTO IMOBILIÁRIO DE RESP LIMITADA,,,,,,,,,,
2026-06-01,20:52:24,HSLG11,HSI LOGÍSTICA FUNDO DE INVESTIMENTO IMOBILIÁRIO DE RESP LIMITADA,,,,,,,,,,
2026-06-01,20:52:24,HSML11,HSI MALLS FUNDO DE INVESTIMENTO IMOBILIÁRIO DE RESPONSABILIDADE LIMITADA,,,,,,,,,,
2026-06-01,20:52:24,HSRE11,HSI RENDA IMOBILIÁRIA FUNDO DE INVESTIMENTO IMOBILIÁRIO DE RESP LIMITADA,,,,,,,,,,
2026-06-01,20:52:24,HUSI11,HUSI FUNDO DE INVESTIMENTO IMOBILIÁRIO,,,,,,,,,,
2026-06-01,20:52:24,IVCI11,ICATU VANGUARDA CRÉDITO IMOBILIÁRIO FUNDO DE INVESTIMENTO IMOBILIÁRIO - RESPONSABILIDADE LIMITADA,,,,,,,,,,
2026-06-01,20:52:24,GRUL11,ICATU VANGUARDA GRU  LOGÍSTICO FUNDO DE INVESTIMENTO IMOBILIÁRIO - RESPONSABILIDADE LIMITADA,,,,,,,,,,
2026-06-01,20:52:24,ICNE11,ÍCONE - FUNDO DE INVESTIMENTO IMOBILIÁRIO RESPONSABILIDADE LIMITADA,,,,,,,,,,
2026-06-01,20:52:24,IMMB11,IMMOBINVEST FUNDO DE INVESTIMENTO IMOBILIÁRIO RESPONSABILIDADE LIMITADA,,,,,,,,,,
2026-06-01,20:52:24,INDE11,INTER DESENVOLVIMENTO FUNDO DE INVESTIMENTO IMOBILIÁRIO RESPONSABILIDADE LIMITADA,,,,,,,,,,
2026-06-01,20:52:24,INLG11,INTER LOGÍSTICO FUNDO DE INVESTIMENTO IMOBILIÁRIO FII RESPONSABILIDADE LIMITADA,,,,,,,,,,
2026-06-01,20:52:24,INRD11,INTER RESIDENCE FUNDO DE INVESTIMENTO IMOBILIÁRIO FII RESPONSABILIDADE LIMITADA,,,,,,,,,,
2026-06-01,20:52:24,ITIP11,INTER TEVA ÍNDICE DE PAPEL FUNDO DE INVESTIMENTO IMOBILIÁRIO FII RESPONSABILIDADE LIMITADA,,,,,,,,,,
2026-06-01,20:52:24,ITIT11,INTER TEVA ÍNDICE DE TIJOLO FUNDO DE INVESTIMENTO IMOBILIÁRIO FII RESPONSABILIDADE LIMITADA,,,,,,,,,,
2026-06-01,20:52:24,IBBP11,INVISTA BRAZILIAN BUSINESS PARK FUNDO DE INVESTIMENTO IMOBILIÁRIO,,,,,,,,,,
2026-06-01,20:52:24,XPIN11,INVISTA INDUSTRIAL FUNDO DE INVESTIMENTO IMOBILIÁRIO,,,,,,,,,,
2026-06-01,20:52:24,IRIM11,IRIDIUM FUNDO DE INVESTIMENTO IMOBILIÁRIO RESPONSABILIDADE LIMITADA,,,,,,,,,,
2026-06-01,20:52:24,ICDI11,ITAÚ CRÉDITO IMOBILIÁRIO CDI FUNDO DE INVESTIMENTO IMOBILIÁRIO RESPONSABILIDADE LIMITADA,,,,,,,,,,
2026-06-01,20:52:24,ICRI11,ITAÚ CRÉDITO IMOBILIÁRIO IPCA FUNDO DE INVESTIMENTO IMOBILIÁRIO RESPONSABILIDADE LIMITADA,,,,,,,,,,
2026-06-01,20:52:24,ILOG11,ITAÚ RBR DESENVOLVIMENTO LOGÍSTICO - FUNDO DE INVESTIMENTO IMOBILIÁRIO RESPONSABILIDADE LIMITADA,,,,,,,,,,
2026-06-01,20:52:24,TMPS11,ITAÚ TEMPUS FUNDO DE INVESTIMENTO IMOBILIÁRIO RESPONSABILIDADE LIMITADA,,,,,,,,,,
2026-06-01,20:52:24,ITRI11,ITAÚ TOTAL RETURN FUNDO DE INVESTIMENTO IMOBILIÁRIO RESPONSABILIDADE LIMITADA,,,,,,,,,,
2026-06-01,20:52:24,JCDB11,JACARANDÁ 02 FUNDO DE INVESTIMENTO IMOBILIÁRIO RESPONSABILIDADE LIMITADA,,,,,,,,,,
2026-06-01,20:52:24,JCDA11,JACARANDÁ I FUNDO DE INVESTIMENTO IMOBILIÁRIO - RESPONSABILIDADE LIMITADA,,,,,,,,,,
2026-06-01,20:52:24,JASC11,JASC RENDA VAREJO ESSENCIAL FUNDO DE INVESTIMENTO IMOBILIÁRIO RESPONSABILIDADE LIMITADA,,,,,,,,,,
2026-06-01,20:52:24,VJFD11,JFDCAM - FUNDO DE INVESTIMENTO IMOBILIÁRIO - FII - RESPONSABILIDADE LIMITADA,,,,,,,,,,
2026-06-01,20:52:24,JFLL11,JFL LIVING FUNDO DE INVESTIMENTO IMOBILIÁRIO RESPONSABILIDADE LIMITADA,,,,,,,,,,
2026-06-01,20:52:24,JFLR11,JFL REAL ESTATE FUNDO DE INVESTIMENTO IMOBILIÁRIO,,,,,,,,,,
2026-06-01,20:52:24,JCCJ11,JHSF CAPITAL MALLS - FUNDO DE INVESTIMENTO IMOBILIÁRIO RESPONSABILIDADE LIMITADA,,,,,,,,,,
2026-06-01,20:52:24,JPPA11,JPP CAPITAL RECEBÍVEIS IMOBILIÁRIOS FUNDO DE INVESTIMENTO IMOBILIÁRIO DE  RESPONSABILIDADE LIMITADA,,,,,,,,,,
2026-06-01,20:52:24,JSAF11,JS ATIVOS FINANCEIROS FUNDO DE INVESTIMENTO IMOBILIÁRIO - RESPONSABILIDADE LIMITADA,,,,,,,,,,
2026-06-01,20:52:24,JSRE11,JS REAL ESTATE MULTIGESTÃO FUNDO DE INVESTIMENTO IMOBILIÁRIO - RESPONSABILIDADE LIMITADA,,,,,,,,,,
2026-06-01,20:52:24,JSCR11,JS RECEBÍVEIS IMOBILIÁRIOS FUNDO DE INVESTIMENTO IMOBILIÁRIO,,,,,,,,,,
2026-06-01,20:52:24,JTPR11,JT PREV FUNDO DE INVESTIMENTO IMOBILIÁRIO D. HAB,,,,,,,,,,
2026-06-01,20:52:24,BGS1,JUBARTE BGS LOGÍSTICA DE GRÃOS DESENVOLVIMENTO FII RESPONSABILIDADE LIMITADA,,,,,,,,,,
2026-06-01,20:52:24,KISU11,KILIMA FUNDO DE INVESTIMENTO EM COTAS DE FUNDOS IMOBILIÁRIOS SUNO 30 RESPONSABILIDADE LIMITADA,,,,,,,,,,
2026-06-01,20:52:24,KIVO11,KILIMA VOLKANO RECEBÍVEIS IMOBILIÁRIOS FUNDO DE INVESTIMENTO IMOBILIÁRIO - RESPONSABILIDADE LIMITADA,,,,,,,,,,
2026-06-01,20:52:24,KRES11,KINEA AQUISIÇÕES RESIDENCIAIS FUNDO DE INVESTIMENTO IMOBILIÁRIO - RESPONSABILIDADE LIMITADA,,,,,,,,,,
2026-06-01,20:52:24,KCRE11,KINEA CREDITAS FUNDO DE INVESTIMENTO IMOBILIÁRIO RESPONSABILIDADE LIMITADA,,,,,,,,,,
2026-06-01,20:52:24,KNGR11,KINEA DESENVOLVIMENTO GUARARÁ FUNDO DE INVESTIMENTO IMOBILIÁRIO RESPONSABILIDADE LIMITADA,,,,,,,,,,
2026-06-01,20:52:24,KGUJ11,KINEA DESENVOLVIMENTO GUARARÁ JARDINS FUNDO DE INVESTIMENTO IMOBILIÁRIO RESPONSABILIDADE LIMITADA,,,,,,,,,,
2026-06-01,20:52:24,KLOG11,KINEA DESENVOLVIMENTO LOGÍSTICO FUNDO DE INVESTIMENTO IMOBILIÁRIO RESPONSABILIDADE LIMITADA,,,,,,,,,,
2026-06-01,20:52:24,KDLG11,KINEA DESENVOLVIMENTO LOGÍSTICO II FUNDO DE INVESTIMENTO IMOBILIÁRIO RESPONSABILIDADE LIMITADA,,,,,,,,,,
2026-06-01,20:52:24,KFEN11,KINEA FÊNIX FUNDO DE INVESTIMENTO IMOBILIÁRIO - RESPONSABILIDADE LIMITADA,,,,,,,,,,
2026-06-01,20:52:24,KNHF11,KINEA HEDGE FUND FUNDO DE INVESTIMENTO IMOBILIÁRIO - RESPONSABILIDADE LIMITADA,,,,,,,,,,
2026-06-01,20:52:24,KNHY11,KINEA HIGH YIELD CRI FUNDO DE INVESTIMENTO IMOBILIÁRIO  RESPONSABILIDADE LIMITADA,,,,,,,,,,
2026-06-01,20:52:24,KNRE11,KINEA II REAL ESTATE EQUITY FUNDO DE INVESTIMENTO IMOBILIÁRIO RESPONSABILIDADE LIMITADA,,,,,,,,,,
2026-06-01,20:52:24,KNIP11,KINEA ÍNDICES DE PREÇOS FUNDO DE INVESTIMENTO IMOBILIÁRIO RESPONSABILIDADE LIMITADA,,,,,,,,,,
2026-06-01,20:52:24,KOIM11,KINEA OPORTUNIDADES IMOBILIÁRIAS FUNDO DE INVESTIMENTO IMOBILIÁRIO RESPONSABILIDADE LIMITADA,,,,,,,,,,
2026-06-01,20:52:24,KORE11,KINEA OPORTUNIDADES REAL ESTATE FUNDO DE INVESTIMENTO IMOBILIÁRIO - RESPONSABILIDADE LIMITADA,,,,,,,,,,
2026-06-01,20:52:24,KNPL11,KINEA PLATAFORMA RESIDENCIAL FUNDO DE INVESTIMENTO IMOBILIÁRIO RESPONSABILIDADE LIMITADA,,,,,,,,,,
2026-06-01,20:52:24,KNPR11,KINEA PREMIUM PROPERTIES FUNDO DE INVESTIMENTO IMOBILIÁRIO - RESPONSABILIDADE LIMITADA,,,,,,,,,,
2026-06-01,20:52:24,KPMR11,KINEA PRIME RESIDENCIAL I FUNDO DE INVESTIMENTO IMOBILIÁRIO DE RESPONSABILIDADE LIMITADA,,,,,,,,,,
2026-06-01,20:52:24,KPRP11,KINEA PRIME RESIDENCIAL I PVT FUNDO DE INVESTIMENTO IMOBILIÁRIO DE RESPONSABILIDADE LIMITADA,,,,,,,,,,
2026-06-01,20:52:24,KNRI11,KINEA RENDA IMOBILIÁRIA FUNDO DE INVESTIMENTO IMOBILIÁRIO RESPONSABILIDADE LIMITADA,,,,,,,,,,
2026-06-01,20:52:24,KNCR11,KINEA RENDIMENTOS IMOBILIÁRIOS FUNDO DE INVESTIMENTO IMOBILIÁRIO RESPONSABILIDADE LIMITADA,,,,,,,,,,
2026-06-01,20:52:24,KNSC11,KINEA SECURITIES FUNDO DE INVESTIMENTO IMOBILIÁRIO RESPONSABILIDADE LIMITADA,,,,,,,,,,
2026-06-01,20:52:24,KNUQ11,KINEA UNIQUE HY CDI FUNDO DE INVESTIMENTO IMOBILIÁRIO RESPONSABILIDADE LIMITADA,,,,,,,,,,
2026-06-01,20:52:24,LMAI11,LABINA MULTI ATIVOS IMOBILIÁRIOS - FUNDO DE INVESTIMENTO IMOBILIÁRIO RESPONSABILIDADE LIMITADA,,,,,,,,,,
2026-06-01,20:52:24,LPLP11,LAGO DA PEDRA - FUNDO DE INVESTIMENTO IMOBILIÁRIO,,,,,,,,,,
2026-06-01,20:52:24,SLDZ11,LAV SLDZ DESENVOLVIMENTO IMOBILIÁRIO FUNDO DE INVESTIMENTO IMOBILIÁRIO,,,,,,,,,,
2026-06-01,20:52:24,LRED11,LCP REAL ESTATE DEVELOPMENT FUNDO DE INVESTIMENTO IMOBILIÁRIO RESPONSABILIDADE LIMITADA,,,,,,,,,,
2026-06-01,20:52:24,LSOI11,LCP SPECIAL OPPORTUNITIES I FUNDO DE INVESTIMENTO IMOBILIÁRIO RESPONSABILIDADE LIMITADA,,,,,,,,,,
2026-06-01,20:52:24,LSII11,LCP SPECIAL OPPORTUNITIES II FUNDO DE INVESTIMENTO IMOBILIÁRIO RESPONSABILIDADE LIMITADA,,,,,,,,,,
2026-06-01,20:52:24,LSOP11,LCP SPECIAL OPPORTUNITIES III FUNDO DE INVESTIMENTO IMOBILIÁRIO RESPONSABILIDADE LIMITADA,,,,,,,,,,
2026-06-01,20:52:24,LRDI11,LEBLON REALTY DESENVOLVIMENTO I FUNDO DE INVESTIMENTO IMOBILIÁRIO RESPONSABILIDADE LIMITADA,,,,,,,,,,
2026-06-01,20:52:24,LASC11,LEGATUS FUNDO DE INVESTIMENTO IMOBILIÁRIO RESPONSABILIDADE LIMITADA,,,,,,,,,,
2026-06-01,20:52:24,LIFE11,LIFE CAPITAL PARTNERS FUNDO DE INVESTIMENTOS IMOBILIÁRIOS,,,,,,,,,,
2026-06-01,20:52:24,LOFT11,LOFT I FUNDO DE INVESTIMENTO IMOBILIÁRIO RESPONSABILIDADE LIMITADA,,,,,,,,,,
2026-06-01,20:52:24,MAGM11,MAG MULT FII RESPONSABILIDADE LIMITADA,,,,,,,,,,
2026-06-01,20:52:24,MAGM11,MAG MULTIESTRATÉGIA CLASSE DE INVESTIMENTO IMOBILIÁRIO RESPONSABILIDADE LIMITADA,,,,,,,,,,
2026-06-01,20:52:24,MANA11,MANATÍ CAPITAL HEDGE FUND FUNDO DE INVESTIMENTO IMOBILIÁRIO DE RESPONSABILIDADE LIMITADA,,,,,,,,,,
2026-06-01,20:52:24,MMVE11,MARESIAS FUNDO DE INVESTIMENTO IMOBILIÁRIO,,,,,,,,,,
2026-06-01,20:52:24,MCLO11,MAUÁ CAPITAL LOGÍSTICA FUNDO DE INVESTIMENTO IMOBILIÁRIO - RESPONSABILIDADE LIMITADA,,,,,,,,,,
2026-06-01,20:52:24,MCRE11,MAUÁ CAPITAL REAL ESTATE FUNDO DE INVESTIMENTO IMOBILIÁRIO RESPONSABILIDADE LIMITADA,,,,,,,,,,
2026-06-01,20:52:24,MXRF11,MAXI RENDA FUNDO DE INVESTIMENTO IMOBILIÁRIO - FII - RESPONSABILIDADE LIMITADA,,,,,,,,,,
2026-06-01,20:52:24,MCEM11,MÉRITO CEMITÉRIOS FII - FUNDO DE INVESTIMENTO IMOBILIÁRIO RESPONSABILIDADE LIMITADA,,,,,,,,,,
2026-06-01,20:52:24,MFII11,MERITO DESENVOLVIMENTO IMOBILIARIO I FII - FUNDO DE INVESTIMENTO IMOBILIARIO,,,,,,,,,,
2026-06-01,20:52:24,MIDW11,MIDWAY MALL FUNDO DE INVESTIMENTO IMOBILIÁRIO RESPONSABILIDADE LIMITADA,,,,,,,,,,
2026-06-01,20:52:24,MGRI11,MOGNO PROPERTIES FUNDO DE INVESTIMENTO IMOBILIÁRIO RESPONSABILIDADE LIMITADA,,,,,,,,,,
2026-06-01,20:52:24,MOSO11,MOSO FUNDO DE INVESTIMENTO IMOBILIÁRIO RESPONSABILIDADE LIMITADA,,,,,,,,,,
2026-06-01,20:52:24,SHOP11,MULTI SHOPPINGS FUNDO DE INVESTIMENTO IMOBILIÁRIO RESPONSABILIDADE LIMITADA,,,,,,,,,,
2026-06-01,20:52:24,MOFF11,MULTIOFFICES 2 - FUNDO DE INVESTIMENTO IMOBILIÁRIO - RESPONSABILIDADE LIMITADA,,,,,,,,,,
2026-06-01,20:52:24,NCRI11,NAVI CRÉDITO IMOBILIÁRIO FUNDO DE INVESTIMENTO IMOBILIÁRIO - RESPONSABILIDADE LIMITADA,,,,,,,,,,
2026-06-01,20:52:24,NAVT11,NAVI IMOBILIÁRIO TOTAL RETURN FUNDO DE INVESTIMENTO IMOBILIÁRIO RESPONSABILIDADE LIMITADA,,,,,,,,,,
2026-06-01,20:52:24,APTO11,NAVI RESIDENCIAL FUNDO DE INVESTIMENTO IMOBILIÁRIO - RESPONSABILIDADE  LIMITADA,,,,,,,,,,
2026-06-01,20:52:24,EAGL11,NEST EAGLE FUNDO DE INVESTIMENTO IMOBILIÁRIO DE RESPONSABILIDADE LIMITADA,,,,,,,,,,
2026-06-01,20:52:24,NEWL11,NEWPORT LOGÍSTICA FUNDO DE INVESTIMENTO IMOBILIÁRIO RESPONSABILIDADE LIMITADA,,,,,,,,,,
2026-06-01,20:52:24,NEWU11,NEWPORT RENDA URBANA FUNDO DE INVESTIMENTO IMOBILIÁRIO RESPONSABILIDADE LIMITADA,,,,,,,,,,
2026-06-01,20:52:24,NMKS11,NM KSM LOG FUNDO DE INVESTIMENTO IMOBILIÁRIO RESPONSABILIDADE LIMITADA,,,,,,,,,,
2026-06-01,20:52:24,NVIF11,NOVA I - FUNDO DE INVESTIMENTO IMOBILIÁRIO - RESPONSABILIDADE LIMITADA,,,,,,,,,,
2026-06-01,20:52:24,OCRE11,OCTO FUNDO DE INVESTIMENTO IMOBILIÁRIO RESPONSABILIDADE LIMITADA,,,,,,,,,,
2026-06-01,20:52:24,ONDA11,ONDA INVEST MULTIESTRATÉGIA FUNDO DE INVESTIMENTO IMOBILIÁRIO RESPONSABILIDADE LIMITADA,,,,,,,,,,
2026-06-01,20:52:24,ARRI11,OPEN K ATIVOS E RECEBIVEIS IMOBILIARIOS - FUNDO DE INVESTIMENTO IMOBILIARIO,,,,,,,,,,
2026-06-01,20:52:24,OBAL11,OPPORTUNITY BALASSIANO FUNDO DE INVESTIMENTO IMOBILIÁRIO -  RESPONSABILIDADE LIMITADA,,,,,,,,,,
2026-06-01,20:52:24,FTCE11,OPPORTUNITY FUNDO DE INVESTIMENTO IMOBILIÁRIO -  RESPONSABILIDADE LIMITADA,,,,,,,,,,
2026-06-01,20:52:24,OUJP11,OURINVEST JPP FUNDO DE INVESTIMENTO IMOBILIÁRIO DE  RESPONSABILIDADE LIMITADA,,,,,,,,,,
2026-06-01,20:52:24,OXRL11,OXIGÊNIO 2 FUNDO DE INVESTIMENTO IMOBILIÁRIO - RESPONSABILIDADE LIMITADA,,,,,,,,,,
2026-06-01,20:52:24,PNDL11,PANORAMA DESENVOLVIMENTO LOGÍSTICO - FUNDO DE INVESTIMENTO IMOBILIÁRIO - RESPONSABILIDADE LIMITADA,,,,,,,,,,
2026-06-01,20:52:24,PNLM11,PANORAMA LAST MILE SBC - FUNDO DE INVESTIMENTO IMOBILIÁRIO RESPONSABILIDADE LIMITADA,,,,,,,,,,
2026-06-01,20:52:24,PNPR11,PANORAMA PROPERTIES FUNDO DE INVESTIMENTO IMOBILIÁRIO,,,,,,,,,,
2026-06-01,20:52:24,PNRC11,PANORAMA REAL ESTATE CRÉDITO FUNDO DE INVESTIMENTO IMOBILIÁRIO RESPONSABILIDADE LIMITADA,,,,,,,,,,
2026-06-01,20:52:24,PMIS11,PARAMIS HEDGE FUND FUNDO DE INVESTIMENTO IMOBILIÁRIO - FII RESPONSABILIDADE LIMITADA,,,,,,,,,,
2026-06-01,20:52:24,VTVI11,PARKING PARTNERS FUNDO DE INVESTIMENTO IMOBILIÁRIO - FII - RESP LIMITADA,,,,,,,,,,
2026-06-01,20:52:24,PQAG11,PARQUE ANHANGUERA FUNDO DE INVESTIMENTO IMOBILIÁRIO DE RESPONSABILIDADE LIMITADA,,,,,,,,,,
2026-06-01,20:52:24,PATA11,PATAGÔNIA CAPITAL MULTIESTRATÉGIA FUNDO DE INVESTIMENTO IMOBILIÁRIO,,,,,,,,,,
2026-06-01,20:52:24,PATB11,PATEO BANDEIRANTES - FUNDO DE INVESTIMENTO IMOBILIÁRIO RESPONSABILIDADE LIMITADA,,,,,,,,,,
2026-06-01,20:52:24,PCIP11,PATRIA CRÉDITO IMOBILIÁRIO ÍNDICE DE PREÇOS FII - RESPONSABILIDADE LIMITADA,,,,,,,,,,
2026-06-01,20:52:24,PATC11,PÁTRIA EDIFÍCIOS CORPORATIVOS - FUNDO DE INVESTIMENTO IMOBILIÁRIO - RESPONSABILIDADE LIMITADA,,,,,,,,,,
2026-06-01,20:52:24,HGRE11,PATRIA ESCRITÓRIOS - FUNDO DE INVESTIMENTO IMOBILIÁRIO - RESPONSABILIDADE LIMITADA,,,,,,,,,,
2026-06-01,20:52:24,HGLG11,PÁTRIA LOG - FUNDO DE INVESTIMENTO IMOBILIÁRIO - RESPONSABILIDADE LIMITADA,,,,,,,,,,
2026-06-01,20:52:24,PLAG11,PATRIA LOGÍSTICA AGRO - FUNDO DE INVESTIMENTO IMOBILIÁRIO - RESPONSABILIDADE LIMITADA,,,,,,,,,,
2026-06-01,20:52:24,PATL11,PÁTRIA LOGÍSTICA FUNDO DE INVESTIMENTO IMOBILIÁRIO,,,,,,,,,,
2026-06-01,20:52:24,RBRL11,PATRIA LOGÍSTICA II FUNDO DE INVESTIMENTO IMOBILIÁRIO,,,,,,,,,,
2026-06-01,20:52:24,PMLL11,PATRIA MALLS FUNDO DE INVESTIMENTO IMOBILIÁRIO - RESPONSABILIDADE LIMITADA,,,,,,,,,,
2026-06-01,20:52:24,RBRX11,PATRIA PLUS MULTIESTRATÉGIA REAL ESTATE FUNDO DE INVESTIMENTO IMOBILIÁRIO RESPONSABILIDADE LIMITADA,,,,,,,,,,
2026-06-01,20:52:24,HGPO11,PATRIA PRIME OFFICES - FUNDO DE INVESTIMENTO IMOBILIÁRIO - RESPONSABILIDADE LIMITADA,,,,,,,,,,
2026-06-01,20:52:24,RBRK11,PATRIA PRIME OFFICES - FUNDO DE INVESTIMENTO IMOBILIÁRIO RESPONSABILIDADE LIMITADA,,,,,,,,,,
2026-06-01,20:52:24,HGCR11,PÁTRIA RECEBÍVEIS IMOBILIÁRIOS - FUNDO DE INVESTIMENTO IMOBILIÁRIO - RESPONSABILIDADE LIMITADA,,,,,,,,,,
2026-06-01,20:52:24,VCRR11,PATRIA RENDA RESIDENCIAL FUNDO DE  INVESTIMENTO IMOBILIÁRIO - RESPONSABILIDADE LIMITADA I FII,,,,,,,,,,
2026-06-01,20:52:24,HGRU11,PÁTRIA RENDA URBANA - FUNDO DE INVESTIMENTO IMOBILIÁRIO - RESPONSABILIDADE LIMITADA,,,,,,,,,,
2026-06-01,20:52:24,PSEC11,PATRIA SECURITIES FUNDO DE INVESTIMENTO IMOBILIÁRIO - RESPONSABILIDADE  LIMITADA,,,,,,,,,,
2026-06-01,20:52:24,PEMA11,PERFORMA REAL ESTATE FUNDO DE INVESTIMENTO IMOBILIÁRIO - RESPONSABILIDADE LIMITADA,,,,,,,,,,
2026-06-01,20:52:24,PMRL11,PERMUTA RESIDENCIAL FUNDO DE INVESTIMENTO IMOBILIÁRIO RESPONSABILIDADE LIMITADA,,,,,,,,,,
2026-06-01,20:52:24,PRSN11,PERSONALE I FUNDO DE INVESTIMENTO IMOBILIÁRIO RESPONSABILIDADE LIMITADA,,,,,,,,,,
2026-06-01,20:52:24,PORD11,POLO CRÉDITO IMOBILIÁRIO - FUNDO DE INVESTIMENTO IMOBILIÁRIO - RESPONSABILIDADE LIMITADA,,,,,,,,,,
2026-06-01,20:52:24,PLRI11,POLO FII - FII RECEBÍVEIS IMOBILIÁRIOS I - RESPONSABILIDADE LIMITADA,,,,,,,,,,
2026-06-01,20:52:24,PCAS11,PRAIA DO CASTELO FUNDO DE INVESTIMENTO IMOBILIÁRIO,,,,,,,,,,
2026-06-01,20:52:24,PRSV11,PRESIDENTE VARGAS FUNDO DE INVESTIMENTO IMOBILIÁRIO DE RESPONSABILIDADE LIMITADA,,,,,,,,,,
2026-06-01,20:52:24,TSER11,PRIME OFFICES FUNDO DE  INVESTIMENTO IMOBILIÁRIO - RESPONSABILIDADE LIMITADA,,,,,,,,,,
2026-06-01,20:52:24,FPAB11,PROJETO ÁGUA BRANCA FUNDO DE INVESTIMENTO IMOBILIÁRIO RESPONSABILIDADE LIMITADA,,,,,,,,,,
2026-06-01,20:52:24,PBLV11,PROLOGIS BRAZIL LOGISTICS VENTURE FUNDO DE INVESTIMENTO IMOBILIÁRIO DE RESPONSABILIDADE LIMITADA,,,,,,,,,,
2026-06-01,20:52:24,QTZD11,QUARTZO REAL ESTATE DEVELOPMENT MULTIESTRATÉGIA FUNDO DE INVESTIMENTO IMOBILIÁRIO RESPONSABILIDADE L,,,,,,,,,,
2026-06-01,20:52:24,RZZV11,RAIZZ DESENVOLVIMENTO I FUNDO DE INVESTIMENTO IMOBILIÁRIO - FII RESPONSABILIDADE LIMITADA,,,,,,,,,,
2026-06-01,20:52:24,RZZI11,RAIZZ DESENVOLVIMENTO II FUNDO DE INVESTIMENTO IMOBILIÁRIO RESPONSABILIDADE LIMITADA,,,,,,,,,,
2026-06-01,20:52:24,RZZR11,RAIZZ RENDA LOGÍSTICA FUNDO DE INVESTIMENTO IMOBILIÁRIO RESPONSABILIDADE LIMITADA,,,,,,,,,,
2026-06-01,20:52:24,RBDS11,RB CAPITAL DESENV. RESIDENCIAL II FUNDO DE INVESTIMENTO IMOBILIARIO - RESPONSABILIDADE LIMITADA,,,,,,,,,,
2026-06-01,20:52:24,RSPD11,RB CAPITAL DESENVOLVIMENTO RESIDENCIAL III FII - RESPONSABILIDADE LIMITADA,,,,,,,,,,
2026-06-01,20:52:24,RBIR11,RB CAPITAL DESENVOLVIMENTO RESIDENCIAL IV FUNDO DE INVESTIMENTO IMOBILIÁRIO - FII - RESP. LTDA.,,,,,,,,,,
2026-06-01,20:52:24,RFOF11,RB CAPITAL I FUNDO DE FUNDOS -RESPONSABILIDADE LIMITADA,,,,,,,,,,
2026-06-01,20:52:24,RBLG11,RB CAPITAL LOGÍSTICO FUNDO DE INVESTIMENTO IMOBILIÁRIO  FII RESPONSABILIDADE LIMITADA,,,,,,,,,,
2026-06-01,20:52:24,FIIP11,RB CAPITAL RENDA I FUNDO DE INVESTIMENTO IMOBILIARIO - FII - RESPONSABILIDADE LIMITADA,,,,,,,,,,
2026-06-01,20:52:24,RBRD11,RB CAPITAL RENDA II FII DE RESP LIMITADA,,,,,,,,,,
2026-06-01,20:52:24,RBTS11,RB CAPITAL TFO SITUS FUNDO DE INVESTIMENTO IMOBILIÁRIO - FII - RESPONSABILIDADE LIMITADA,,,,,,,,,,
2026-06-01,20:52:24,DRIM11,RB DESENVOLVIMENTO RESIDENCIAL V FUNDO DE INVESTIMENTO IMOBILIÁRIO -RESPONSABILIDADE LIMITADA,,,,,,,,,,
2026-06-01,20:52:24,MTES11,RB INVESTIMENTOS MULTIESTRATÉGIA FUNDO DE INVESTIMENTO IMOBILIÁRIORESPONSABILIDADE LIMITADA,,,,,,,,,,
2026-06-01,20:52:24,REME11,RB MULTIESTRATÉGIA IMOBILIÁRIA FUNDO DE INVESTIMENTO IMOBILIÁRIO - RESPONSABILIDADE LIMITADA,,,,,,,,,,
2026-06-01,20:52:24,RCFF11,RBR DESENVOLVIMENTO COMERCIAL FEEDER FOF - FII RESPONSABILIDADE LIMITADA,,,,,,,,,,
2026-06-01,20:52:24,RDCI11,RBR DESENVOLVIMENTO COMERCIAL I - FUNDO DE INVESTIMENTO IMOBILIÁRIO RESPONSABILIDADE LIMITADA,,,,,,,,,,
2026-06-01,20:52:24,RDLI11,RBR DESENVOLVIMENTO LOGÍSTICO I - FUNDO DE INVESTIMENTO IMOBILIÁRIO RESPONSABILIDADE LIMITADA,,,,,,,,,,
2026-06-01,20:52:24,SHIP11,RBR FLAGSHIP I FUNDO DE INVESTIMENTO IMOBILIÁRIO RESPONSABILIDADE LIMITADA,,,,,,,,,,
2026-06-01,20:52:24,BOAT11,RBR FLAGSHIP II FUNDO DE INVESTIMENTO IMOBILIÁRIO RESPONSABILIDADE LIMITADA,,,,,,,,,,
2026-06-01,20:52:24,RPRI11,RBR PREMIUM RECEBÍVEIS IMOBILIÁRIOS FUNDO DE INVESTIMENTO IMOBILIÁRIO RESPONSABILIDADE LIMITADA,,,,,,,,,,
2026-06-01,20:52:24,TPOS11,RBR TESOURARIA FII CDI+ FUNDO DE INVESTIMENTO IMOBILIÁRIO RESPONSABILIDADE LIMITADA,,,,,,,,,,
2026-06-01,20:52:24,TINF11,RBR TESOURARIA FII IPCA+ FUNDO DE INVESTIMENTO IMOBILIÁRIO RESPONSABILIDADE LIMITADA,,,,,,,,,,
2026-06-01,20:52:24,TOPP11,RBR TOP OFFICES FUNDO DE INVESTIMENTO IMOBILIÁRIO RESPONSABILIDADE LIMITADA,,,,,,,,,,
2026-06-01,20:52:24,RINV11,REAL INVESTOR FUNDO DE INVESTIMENTO IMOBILIÁRIO RESPONSABILIDADE LIMITADA,,,,,,,,,,
2026-06-01,20:52:24,RCRI11,REAL INVESTOR RECEBÍVEIS IMOBILIÁRIOS FUNDO DE INVESTIMENTO IMOBILIÁRIO RESPONSABILIDADE LIMITADA,,,,,,,,,,
2026-06-01,20:52:24,RECD11,REC FUNDO DE CRI COTAS AMORTIZÁVEIS - FUNDO DE INVESTIMENTO IMOBILIÁRIO,,,,,,,,,,
2026-06-01,20:52:24,RMBS11,REC MASTER FUNDO DE CRI COTAS AMORTIZÁVEIS FII - RESPONSABILIDADE LIMITADA,,,,,,,,,,
2026-06-01,20:52:24,RECM11,REC MULTIESTRATÉGIA - FUNDO DE INVESTIMENTO IMOBILIÁRIO - RESPONSABILIDADE LIMITADA,,,,,,,,,,
2026-06-01,20:52:24,RBHG11,RIO BRAVO CRÉDITO IMOBILIÁRIO HIGH GRADE FUNDO DE INVESTIMENTO  IMOBILIÁRIO - FII RESP LIMITADA,,,,,,,,,,
2026-06-01,20:52:24,RBHY11,RIO BRAVO CRÉDITO IMOBILIÁRIO HIGH YIELD FUNDO DE INVESTIMENTO IMOBILIÁRIO - FII RESP LIMITADA,,,,,,,,,,
2026-06-01,20:52:24,RBFY11,RIO BRAVO FOR YOU FUNDO DE INVESTIMENTO IMOBILIÁRIO DE RESPONSABILIDADE LIMITADA,,,,,,,,,,
2026-06-01,20:52:24,RBFM11,RIO BRAVO MULTIESTRATÉGIA FUNDO DE INVESTIMENTO IMOBILIÁRIO DE RESPONSABILIDADE LIMITADA,,,,,,,,,,
2026-06-01,20:52:24,RBOP11,RIO BRAVO OPORTUNIDADES IMOBILIÁRIAS FUNDO DE INVESTIMENTO IMOBILIÁRIO DE RESPONSABILIDADE LIMITADA,,,,,,,,,,
2026-06-01,20:52:24,RCRB11,RIO BRAVO RENDA CORPORATIVA FUNDO DE INVESTIMENTO IMOBILIÁRIO - RESPONSABILIDADE LIMITADA,,,,,,,,,,
2026-06-01,20:52:24,RBRS11,RIO BRAVO RENDA RESIDENCIAL FUNDO DE INVESTIMENTO IMOBILIÁRIO DE RESPONSABILIDADE LIMITADA,,,,,,,,,,
2026-06-01,20:52:24,RBVA11,RIO BRAVO RENDA VAREJO FUNDO DE INVESTIMENTO IMOBILIÁRIO DE RESPONSABILIDADE LIMITADA,,,,,,,,,,
2026-06-01,20:52:24,RNGO11,RIO NEGRO FUNDO DE INVESTIMENTO IMOBILIÁRIO DE RESPONSABILIDADE LIMITADA,,,,,,,,,,
2026-06-01,20:52:24,FRRE11,RIO REAL  ESTATE FUNDO DE INVESTIMENTO IMOBILIÁRIO DE RESPONSABILIDADE LIMITADA,,,,,,,,,,
2026-06-01,20:52:24,RZAK11,RIZA AKIN FUNDO DE INVESTIMENTO IMOBILIÁRIO RESPONSABILIDADE LIMITADA,,,,,,,,,,
2026-06-01,20:52:24,RZAT11,RIZA ARCTIUM REAL ESTATE FII - FUNDO DE INVESTIMENTO IMOBILIÁRIO RESPONSABILIDADE LIMITADA,,,,,,,,,,
2026-06-01,20:52:24,RZLC11,RIZA LECCI FUNDO DE INVESTIMENTO IMOBILIÁRIO RESPONSABILIDADE LIMITADA,,,,,,,,,,
2026-06-01,20:52:24,RJDA11,RJDI FUNDO DE INVESTIMENTO IMOBILIÁRIO,,,,,,,,,,
2026-06-01,20:52:24,SAPI11,SANTANDER PAPÉIS IMOBILIÁRIOS FUNDO DE  INVESTIMENTO IMOBILIÁRIO - RESP LIMITADA,,,,,,,,,,
2026-06-01,20:52:24,FISD11,SÃO DOMINGOS - FUNDO DE INVESTIMENTO IMOBILIÁRIO - FII,,,,,,,,,,
2026-06-01,20:52:24,SCPF11,SCP FII - RESPONSABILIDADE LIMITADA,,,,,,,,,,
2026-06-01,20:52:24,SEQR11,SEQUÓIA III RENDA IMOBILIÁRIA FUNDO DE INVESTIMENTO IMOBILIÁRIO - RESPONSABILIDADE LIMITADA,,,,,,,,,,
2026-06-01,20:52:24,SHPH11,SHOPPING PÁTIO HIGIENÓPOLIS FUNDO DE INVESTIMENTO IMOBILIÁRIO DE RESPONSABILIDADE LIMITADA,,,,,,,,,,
2026-06-01,20:52:24,SHPP11,SHOPPING PÁTIO PAULISTA FUNDO DE INVESTIMENTO IMOBILIÁRIO RESPONSABILIDADE  LIMITADA,,,,,,,,,,
2026-06-01,20:52:24,WPLZ11,SHOPPING WEST PLAZA FUNDO DE INVESTIMENTO IMOBILIARIO DE RESPONSABILIDADE LIMITADA,,,,,,,,,,
2026-06-01,20:52:24,REIT11,SINGULARE FUNDO DE INVESTIMENTO IMOBILIÁRIO,,,,,,,,,,
2026-06-01,20:52:24,SJAU11,SJ AU LOGÍSTICA FUNDO DE INVESTIMENTO IMOBILIÁRIO RESPONSABILIDADE LIMITADA,,,,,,,,,,
2026-06-01,20:52:24,SOLR11,SOLARIUM FII - FUNDO DE INVESTIMENTO IMOBILIÁRIO,,,,,,,,,,
2026-06-01,20:52:24,SPTW11,SP DOWNTOWN FUNDO DE INVESTIMENTO IMOBILIÁRIO - FII,,,,,,,,,,
