data_captura,hora_captura,codigo_fundo,nome_fundo,cnpj,administrador,segmento,tipo,mandato,prazo_duracao,gestao,data_encerramento,cotistas,patrimonio_liquido
2026-06-01,23:36:51,GAME11,GUARDIAN MULTIESTRATÉGIA IMOBILIÁRIA I FII DE RESPONSABILIDADE LIMITADA,,,,,,,,,,
2026-06-01,23:36:51,GARE11,GUARDIAN REAL ESTATE FUNDO DE INVESTIMENTO IMOBILIÁRIO DE RESPONSABILIDADE LIMITADA,,,,,,,,,,
2026-06-01,23:36:51,HABT11,HABITAT RECEBÍVEIS PULVERIZADOS FUNDO DE INVESTIMENTO IMOBILIÁRIO RESPONSABILIDADE LIMITADA,,,,,,,,,,
2026-06-01,23:36:51,ATCR11,HAZ FUNDO DE INVESTIMENTO IMOBILIÁRIO,,,,,,,,,,
2026-06-01,23:36:51,HCTB11,HCO CURITIBA I FUNDO DE INVESTIMENTO IMOBILIÁRIO DE RESPONSABILIDADE LIMITADA,,,,,,,,,,
2026-06-01,23:36:51,AERO11,HCO OPPS AERO I FII DE RESPONSABILIDADE LIMITADA,,,,,,,,,,
2026-06-01,23:36:51,HCTR11,HECTARE CE FUNDO DE INVESTIMENTO IMOBILIÁRIO RESPONSABILIDADE LIMITADA,,,,,,,,,,
2026-06-01,23:36:51,HCST11,HECTARE DESENVOLVIMENTO STUDENT HOUSING - FUNDO DE INVESTIMENTO IMOBILIÁRIO RESPONSABILIDADE LIMITAD,,,,,,,,,,
2026-06-01,23:36:51,HCHG11,HECTARE RECEBÍVEIS HIGH GRADE FUNDO DE INVESTIMENTO IMOBILIÁRIO - FII - RESP LIMITADA,,,,,,,,,,
2026-06-01,23:36:51,HAAA11,HEDGE AAA FUNDO DE INVESTIMENTO IMOBILIÁRIO DE RESPONSABILIDADE LIMITADA,,,,,,,,,,
2026-06-01,23:36:51,ATSA11,HEDGE ATRIUM SHOPPING SANTO ANDRÉ FUNDO DE INVESTIMENTO IMOBILIÁRIO DE RESPONSABILIDADE LIMITADA,,,,,,,,,,
2026-06-01,23:36:51,HGBL11,HEDGE BRASIL LOGÍSTICO INDUSTRIAL FUNDO DE INVESTIMENTO IMOBILIÁRIO DE RESPONSABILIDADE LIMITADA,,,,,,,,,,
2026-06-01,23:36:51,HGBS11,HEDGE BRASIL SHOPPING FUNDO DE INVESTIMENTO IMOBILIÁRIO DE RESPONSABILIDADE LIMITADA,,,,,,,,,,
2026-06-01,23:36:51,HDEL11,HEDGE DESENVOLVIMENTO LOGÍSTICO FUNDO DE INVESTIMENTO IMOBILIÁRIO DE RESPONSABILIDADE LIMITADA,,,,,,,,,,
2026-06-01,23:36:51,FLRP11,HEDGE FLORIPA SHOPPING FUNDO DE INVESTIMENTO IMOBILIÁRIO DE RESPONSABILIDADE LIMITADA,,,,,,,,,,
2026-06-01,23:36:51,HJCT11,HEDGE JHSF CAPITAL PRIME OFFICES FUNDO DE INVESTIMENTO IMOBILIÁRIO DE RESPONSABILIDADE LIMITADA,,,,,,,,,,
2026-06-01,23:36:51,HLOG11,HEDGE LOGÍSTICA FUNDO DE INVESTIMENTO IMOBILIÁRIO DE RESPONSABILIDADE LIMITADA,,,,,,,,,,
2026-06-01,23:36:51,HOFC11,HEDGE OFFICE INCOME FUNDO DE INVESTIMENTO IMOBILIÁRIO DE RESPONSABILIDADE LIMITADA,,,,,,,,,,
2026-06-01,23:36:51,HDOF11,HEDGE PALADIN DESIGN OFFICES FUNDO DE INVESTIMENTO IMOBILIÁRIO DE RESPONSABILIDADE LIMITADA,,,,,,,,,,
2026-06-01,23:36:51,HRDF11,HEDGE REALTY DEVELOPMENT FUNDO DE INVESTIMENTO IMOBILIÁRIO DE RESPONSABILIDADE LIMITADA,,,,,,,,,,
2026-06-01,23:36:51,HREC11,HEDGE RECEBÍVEIS IMOBILIÁRIOS FUNDO DE INVESTIMENTO IMOBILIÁRIO DE RESPONSABILIDADE LIMITADA,,,,,,,,,,
2026-06-01,23:36:51,SEED11,HEDGE SEED FUNDO DE INVESTIMENTO IMOBILIARIO DE RESPONSABILIDADE LIMITADA,,,,,,,,,,
2026-06-01,23:36:51,HPDP11,HEDGE SHOPPING PARQUE DOM PEDRO FUNDO DE INVESTIMENTO IMOBILIÁRIO DE RESPONSABILIDADE LIMITADA,,,,,,,,,,
2026-06-01,23:36:51,STRY11,HEDGE STRATEGY FUNDO DE INVESTIMENTO IMOBILIÁRIO DE RESPONSABILIDADE LIMITADA,,,,,,,,,,
2026-06-01,23:36:51,HFOF11,HEDGE TOP FOFII 3 FUNDO DE INVESTIMENTO IMOBILIÁRIO DE RESPONSABILIDADE LIMITADA,,,,,,,,,,
2026-06-01,23:36:51,YEES11,HEDGE YEES HABITAÇÕES ECONÔMICAS FUNDO DE INVESTIMENTO IMOBILIÁRIO DE RESPONSABILIDADE LIMITADA,,,,,,,,,,
2026-06-01,23:36:51,HGIC11,HGI CRÉDITOS IMOBILIÁRIOS FUNDO DE INVESTIMENTO IMOBILIÁRIO RESPONSABILIDADE LIMITADA,,,,,,,,,,
2026-06-01,23:36:51,HIRE11,HIRE FUNDO DE INVESTIMENTO IMOBILIÁRIO RESPONSABILIDADE LIMITADA,,,,,,,,,,
2026-06-01,23:36:51,HILG11,HIRE LOG I - FUNDO DE INVESTIMENTO IMOBILIÁRIO,,,,,,,,,,
2026-06-01,23:36:51,HTMX11,HOTEL MAXINVEST FUNDO DE INVESTIMENTO IMOBILIÁRIO RESPONSABILIDADE LIMITADA,,,,,,,,,,
2026-06-01,23:36:51,HSAF11,HSI ATIVOS FINANCEIROS FUNDO DE INVESTIMENTO IMOBILIÁRIO DE RESP LIMITADA,,,,,,,,,,
2026-06-01,23:36:51,HSLG11,HSI LOGÍSTICA FUNDO DE INVESTIMENTO IMOBILIÁRIO DE RESP LIMITADA,,,,,,,,,,
2026-06-01,23:36:51,HSML11,HSI MALLS FUNDO DE INVESTIMENTO IMOBILIÁRIO DE RESPONSABILIDADE LIMITADA,,,,,,,,,,
2026-06-01,23:36:51,HSRE11,HSI RENDA IMOBILIÁRIA FUNDO DE INVESTIMENTO IMOBILIÁRIO DE RESP LIMITADA,,,,,,,,,,
2026-06-01,23:36:51,HUSI11,HUSI FUNDO DE INVESTIMENTO IMOBILIÁRIO,,,,,,,,,,
2026-06-01,23:36:51,IVCI11,ICATU VANGUARDA CRÉDITO IMOBILIÁRIO FUNDO DE INVESTIMENTO IMOBILIÁRIO - RESPONSABILIDADE LIMITADA,,,,,,,,,,
2026-06-01,23:36:51,GRUL11,ICATU VANGUARDA GRU  LOGÍSTICO FUNDO DE INVESTIMENTO IMOBILIÁRIO - RESPONSABILIDADE LIMITADA,,,,,,,,,,
2026-06-01,23:36:51,ICNE11,ÍCONE - FUNDO DE INVESTIMENTO IMOBILIÁRIO RESPONSABILIDADE LIMITADA,,,,,,,,,,
2026-06-01,23:36:51,IMMB11,IMMOBINVEST FUNDO DE INVESTIMENTO IMOBILIÁRIO RESPONSABILIDADE LIMITADA,,,,,,,,,,
2026-06-01,23:36:51,INDE11,INTER DESENVOLVIMENTO FUNDO DE INVESTIMENTO IMOBILIÁRIO RESPONSABILIDADE LIMITADA,,,,,,,,,,
2026-06-01,23:36:51,INLG11,INTER LOGÍSTICO FUNDO DE INVESTIMENTO IMOBILIÁRIO FII RESPONSABILIDADE LIMITADA,,,,,,,,,,
2026-06-01,23:36:51,INRD11,INTER RESIDENCE FUNDO DE INVESTIMENTO IMOBILIÁRIO FII RESPONSABILIDADE LIMITADA,,,,,,,,,,
2026-06-01,23:36:51,ITIP11,INTER TEVA ÍNDICE DE PAPEL FUNDO DE INVESTIMENTO IMOBILIÁRIO FII RESPONSABILIDADE LIMITADA,,,,,,,,,,
2026-06-01,23:36:51,ITIT11,INTER TEVA ÍNDICE DE TIJOLO FUNDO DE INVESTIMENTO IMOBILIÁRIO FII RESPONSABILIDADE LIMITADA,,,,,,,,,,
2026-06-01,23:36:51,IBBP11,INVISTA BRAZILIAN BUSINESS PARK FUNDO DE INVESTIMENTO IMOBILIÁRIO,,,,,,,,,,
2026-06-01,23:36:51,XPIN11,INVISTA INDUSTRIAL FUNDO DE INVESTIMENTO IMOBILIÁRIO,,,,,,,,,,
2026-06-01,23:36:51,IRIM11,IRIDIUM FUNDO DE INVESTIMENTO IMOBILIÁRIO RESPONSABILIDADE LIMITADA,,,,,,,,,,
2026-06-01,23:36:51,ICDI11,ITAÚ CRÉDITO IMOBILIÁRIO CDI FUNDO DE INVESTIMENTO IMOBILIÁRIO RESPONSABILIDADE LIMITADA,,,,,,,,,,
2026-06-01,23:36:51,ICRI11,ITAÚ CRÉDITO IMOBILIÁRIO IPCA FUNDO DE INVESTIMENTO IMOBILIÁRIO RESPONSABILIDADE LIMITADA,,,,,,,,,,
2026-06-01,23:36:51,ILOG11,ITAÚ RBR DESENVOLVIMENTO LOGÍSTICO - FUNDO DE INVESTIMENTO IMOBILIÁRIO RESPONSABILIDADE LIMITADA,,,,,,,,,,
2026-06-01,23:36:51,TMPS11,ITAÚ TEMPUS FUNDO DE INVESTIMENTO IMOBILIÁRIO RESPONSABILIDADE LIMITADA,,,,,,,,,,
2026-06-01,23:36:51,ITRI11,ITAÚ TOTAL RETURN FUNDO DE INVESTIMENTO IMOBILIÁRIO RESPONSABILIDADE LIMITADA,,,,,,,,,,
2026-06-01,23:36:51,JCDB11,JACARANDÁ 02 FUNDO DE INVESTIMENTO IMOBILIÁRIO RESPONSABILIDADE LIMITADA,,,,,,,,,,
2026-06-01,23:36:51,JCDA11,JACARANDÁ I FUNDO DE INVESTIMENTO IMOBILIÁRIO - RESPONSABILIDADE LIMITADA,,,,,,,,,,
2026-06-01,23:36:51,JASC11,JASC RENDA VAREJO ESSENCIAL FUNDO DE INVESTIMENTO IMOBILIÁRIO RESPONSABILIDADE LIMITADA,,,,,,,,,,
2026-06-01,23:36:51,VJFD11,JFDCAM - FUNDO DE INVESTIMENTO IMOBILIÁRIO - FII - RESPONSABILIDADE LIMITADA,,,,,,,,,,
2026-06-01,23:36:51,JFLL11,JFL LIVING FUNDO DE INVESTIMENTO IMOBILIÁRIO RESPONSABILIDADE LIMITADA,,,,,,,,,,
2026-06-01,23:36:51,JFLR11,JFL REAL ESTATE FUNDO DE INVESTIMENTO IMOBILIÁRIO,,,,,,,,,,
2026-06-01,23:36:51,JCCJ11,JHSF CAPITAL MALLS - FUNDO DE INVESTIMENTO IMOBILIÁRIO RESPONSABILIDADE LIMITADA,,,,,,,,,,
2026-06-01,23:36:51,JPPA11,JPP CAPITAL RECEBÍVEIS IMOBILIÁRIOS FUNDO DE INVESTIMENTO IMOBILIÁRIO DE  RESPONSABILIDADE LIMITADA,,,,,,,,,,
2026-06-01,23:36:51,JSAF11,JS ATIVOS FINANCEIROS FUNDO DE INVESTIMENTO IMOBILIÁRIO - RESPONSABILIDADE LIMITADA,,,,,,,,,,
2026-06-01,23:36:51,JSRE11,JS REAL ESTATE MULTIGESTÃO FUNDO DE INVESTIMENTO IMOBILIÁRIO - RESPONSABILIDADE LIMITADA,,,,,,,,,,
2026-06-01,23:36:51,JSCR11,JS RECEBÍVEIS IMOBILIÁRIOS FUNDO DE INVESTIMENTO IMOBILIÁRIO,,,,,,,,,,
2026-06-01,23:36:51,JTPR11,JT PREV FUNDO DE INVESTIMENTO IMOBILIÁRIO D. HAB,,,,,,,,,,
2026-06-01,23:36:51,BGS1,JUBARTE BGS LOGÍSTICA DE GRÃOS DESENVOLVIMENTO FII RESPONSABILIDADE LIMITADA,,,,,,,,,,
2026-06-01,23:36:51,KISU11,KILIMA FUNDO DE INVESTIMENTO EM COTAS DE FUNDOS IMOBILIÁRIOS SUNO 30 RESPONSABILIDADE LIMITADA,,,,,,,,,,
2026-06-01,23:36:51,KIVO11,KILIMA VOLKANO RECEBÍVEIS IMOBILIÁRIOS FUNDO DE INVESTIMENTO IMOBILIÁRIO - RESPONSABILIDADE LIMITADA,,,,,,,,,,
2026-06-01,23:36:51,KRES11,KINEA AQUISIÇÕES RESIDENCIAIS FUNDO DE INVESTIMENTO IMOBILIÁRIO - RESPONSABILIDADE LIMITADA,,,,,,,,,,
2026-06-01,23:36:51,KCRE11,KINEA CREDITAS FUNDO DE INVESTIMENTO IMOBILIÁRIO RESPONSABILIDADE LIMITADA,,,,,,,,,,
2026-06-01,23:36:51,KNGR11,KINEA DESENVOLVIMENTO GUARARÁ FUNDO DE INVESTIMENTO IMOBILIÁRIO RESPONSABILIDADE LIMITADA,,,,,,,,,,
2026-06-01,23:36:51,KGUJ11,KINEA DESENVOLVIMENTO GUARARÁ JARDINS FUNDO DE INVESTIMENTO IMOBILIÁRIO RESPONSABILIDADE LIMITADA,,,,,,,,,,
2026-06-01,23:36:51,KLOG11,KINEA DESENVOLVIMENTO LOGÍSTICO FUNDO DE INVESTIMENTO IMOBILIÁRIO RESPONSABILIDADE LIMITADA,,,,,,,,,,
2026-06-01,23:36:51,KDLG11,KINEA DESENVOLVIMENTO LOGÍSTICO II FUNDO DE INVESTIMENTO IMOBILIÁRIO RESPONSABILIDADE LIMITADA,,,,,,,,,,
2026-06-01,23:36:51,KFEN11,KINEA FÊNIX FUNDO DE INVESTIMENTO IMOBILIÁRIO - RESPONSABILIDADE LIMITADA,,,,,,,,,,
2026-06-01,23:36:51,KNHF11,KINEA HEDGE FUND FUNDO DE INVESTIMENTO IMOBILIÁRIO - RESPONSABILIDADE LIMITADA,,,,,,,,,,
2026-06-01,23:36:51,KNHY11,KINEA HIGH YIELD CRI FUNDO DE INVESTIMENTO IMOBILIÁRIO  RESPONSABILIDADE LIMITADA,,,,,,,,,,
2026-06-01,23:36:51,KNRE11,KINEA II REAL ESTATE EQUITY FUNDO DE INVESTIMENTO IMOBILIÁRIO RESPONSABILIDADE LIMITADA,,,,,,,,,,
2026-06-01,23:36:51,KNIP11,KINEA ÍNDICES DE PREÇOS FUNDO DE INVESTIMENTO IMOBILIÁRIO RESPONSABILIDADE LIMITADA,,,,,,,,,,
2026-06-01,23:36:51,KOIM11,KINEA OPORTUNIDADES IMOBILIÁRIAS FUNDO DE INVESTIMENTO IMOBILIÁRIO RESPONSABILIDADE LIMITADA,,,,,,,,,,
2026-06-01,23:36:51,KORE11,KINEA OPORTUNIDADES REAL ESTATE FUNDO DE INVESTIMENTO IMOBILIÁRIO - RESPONSABILIDADE LIMITADA,,,,,,,,,,
2026-06-01,23:36:51,KNPL11,KINEA PLATAFORMA RESIDENCIAL FUNDO DE INVESTIMENTO IMOBILIÁRIO RESPONSABILIDADE LIMITADA,,,,,,,,,,
2026-06-01,23:36:51,KNPR11,KINEA PREMIUM PROPERTIES FUNDO DE INVESTIMENTO IMOBILIÁRIO - RESPONSABILIDADE LIMITADA,,,,,,,,,,
2026-06-01,23:36:51,KPMR11,KINEA PRIME RESIDENCIAL I FUNDO DE INVESTIMENTO IMOBILIÁRIO DE RESPONSABILIDADE LIMITADA,,,,,,,,,,
2026-06-01,23:36:51,KPRP11,KINEA PRIME RESIDENCIAL I PVT FUNDO DE INVESTIMENTO IMOBILIÁRIO DE RESPONSABILIDADE LIMITADA,,,,,,,,,,
2026-06-01,23:36:51,KNRI11,KINEA RENDA IMOBILIÁRIA FUNDO DE INVESTIMENTO IMOBILIÁRIO RESPONSABILIDADE LIMITADA,,,,,,,,,,
2026-06-01,23:36:51,KNCR11,KINEA RENDIMENTOS IMOBILIÁRIOS FUNDO DE INVESTIMENTO IMOBILIÁRIO RESPONSABILIDADE LIMITADA,,,,,,,,,,
2026-06-01,23:36:51,KNSC11,KINEA SECURITIES FUNDO DE INVESTIMENTO IMOBILIÁRIO RESPONSABILIDADE LIMITADA,,,,,,,,,,
2026-06-01,23:36:51,KNUQ11,KINEA UNIQUE HY CDI FUNDO DE INVESTIMENTO IMOBILIÁRIO RESPONSABILIDADE LIMITADA,,,,,,,,,,
2026-06-01,23:36:51,LMAI11,LABINA MULTI ATIVOS IMOBILIÁRIOS - FUNDO DE INVESTIMENTO IMOBILIÁRIO RESPONSABILIDADE LIMITADA,,,,,,,,,,
2026-06-01,23:36:51,LPLP11,LAGO DA PEDRA - FUNDO DE INVESTIMENTO IMOBILIÁRIO,,,,,,,,,,
2026-06-01,23:36:51,SLDZ11,LAV SLDZ DESENVOLVIMENTO IMOBILIÁRIO FUNDO DE INVESTIMENTO IMOBILIÁRIO,,,,,,,,,,
2026-06-01,23:36:51,LRED11,LCP REAL ESTATE DEVELOPMENT FUNDO DE INVESTIMENTO IMOBILIÁRIO RESPONSABILIDADE LIMITADA,,,,,,,,,,
2026-06-01,23:36:51,LSOI11,LCP SPECIAL OPPORTUNITIES I FUNDO DE INVESTIMENTO IMOBILIÁRIO RESPONSABILIDADE LIMITADA,,,,,,,,,,
2026-06-01,23:36:51,LSII11,LCP SPECIAL OPPORTUNITIES II FUNDO DE INVESTIMENTO IMOBILIÁRIO RESPONSABILIDADE LIMITADA,,,,,,,,,,
2026-06-01,23:36:51,LSOP11,LCP SPECIAL OPPORTUNITIES III FUNDO DE INVESTIMENTO IMOBILIÁRIO RESPONSABILIDADE LIMITADA,,,,,,,,,,
2026-06-01,23:36:51,LRDI11,LEBLON REALTY DESENVOLVIMENTO I FUNDO DE INVESTIMENTO IMOBILIÁRIO RESPONSABILIDADE LIMITADA,,,,,,,,,,
2026-06-01,23:36:51,LASC11,LEGATUS FUNDO DE INVESTIMENTO IMOBILIÁRIO RESPONSABILIDADE LIMITADA,,,,,,,,,,
2026-06-01,23:36:51,LIFE11,LIFE CAPITAL PARTNERS FUNDO DE INVESTIMENTOS IMOBILIÁRIOS,,,,,,,,,,
2026-06-01,23:36:51,LOFT11,LOFT I FUNDO DE INVESTIMENTO IMOBILIÁRIO RESPONSABILIDADE LIMITADA,,,,,,,,,,
2026-06-01,23:36:51,MAGM11,MAG MULT FII RESPONSABILIDADE LIMITADA,,,,,,,,,,
2026-06-01,23:36:51,MAGM11,MAG MULTIESTRATÉGIA CLASSE DE INVESTIMENTO IMOBILIÁRIO RESPONSABILIDADE LIMITADA,,,,,,,,,,
2026-06-01,23:36:51,MANA11,MANATÍ CAPITAL HEDGE FUND FUNDO DE INVESTIMENTO IMOBILIÁRIO DE RESPONSABILIDADE LIMITADA,,,,,,,,,,
2026-06-01,23:36:51,MMVE11,MARESIAS FUNDO DE INVESTIMENTO IMOBILIÁRIO,,,,,,,,,,
2026-06-01,23:36:51,MCLO11,MAUÁ CAPITAL LOGÍSTICA FUNDO DE INVESTIMENTO IMOBILIÁRIO - RESPONSABILIDADE LIMITADA,,,,,,,,,,
2026-06-01,23:36:51,MCRE11,MAUÁ CAPITAL REAL ESTATE FUNDO DE INVESTIMENTO IMOBILIÁRIO RESPONSABILIDADE LIMITADA,,,,,,,,,,
2026-06-01,23:36:51,MXRF11,MAXI RENDA FUNDO DE INVESTIMENTO IMOBILIÁRIO - FII - RESPONSABILIDADE LIMITADA,,,,,,,,,,
2026-06-01,23:36:51,MCEM11,MÉRITO CEMITÉRIOS FII - FUNDO DE INVESTIMENTO IMOBILIÁRIO RESPONSABILIDADE LIMITADA,,,,,,,,,,
2026-06-01,23:36:51,MFII11,MERITO DESENVOLVIMENTO IMOBILIARIO I FII - FUNDO DE INVESTIMENTO IMOBILIARIO,,,,,,,,,,
2026-06-01,23:36:51,MIDW11,MIDWAY MALL FUNDO DE INVESTIMENTO IMOBILIÁRIO RESPONSABILIDADE LIMITADA,,,,,,,,,,
2026-06-01,23:36:51,MGRI11,MOGNO PROPERTIES FUNDO DE INVESTIMENTO IMOBILIÁRIO RESPONSABILIDADE LIMITADA,,,,,,,,,,
2026-06-01,23:36:51,MOSO11,MOSO FUNDO DE INVESTIMENTO IMOBILIÁRIO RESPONSABILIDADE LIMITADA,,,,,,,,,,
2026-06-01,23:36:51,SHOP11,MULTI SHOPPINGS FUNDO DE INVESTIMENTO IMOBILIÁRIO RESPONSABILIDADE LIMITADA,,,,,,,,,,
2026-06-01,23:36:51,MOFF11,MULTIOFFICES 2 - FUNDO DE INVESTIMENTO IMOBILIÁRIO - RESPONSABILIDADE LIMITADA,,,,,,,,,,
2026-06-01,23:36:51,NCRI11,NAVI CRÉDITO IMOBILIÁRIO FUNDO DE INVESTIMENTO IMOBILIÁRIO - RESPONSABILIDADE LIMITADA,,,,,,,,,,
2026-06-01,23:36:51,NAVT11,NAVI IMOBILIÁRIO TOTAL RETURN FUNDO DE INVESTIMENTO IMOBILIÁRIO RESPONSABILIDADE LIMITADA,,,,,,,,,,
2026-06-01,23:36:51,APTO11,NAVI RESIDENCIAL FUNDO DE INVESTIMENTO IMOBILIÁRIO - RESPONSABILIDADE  LIMITADA,,,,,,,,,,
2026-06-01,23:36:51,EAGL11,NEST EAGLE FUNDO DE INVESTIMENTO IMOBILIÁRIO DE RESPONSABILIDADE LIMITADA,,,,,,,,,,
2026-06-01,23:36:51,NEWL11,NEWPORT LOGÍSTICA FUNDO DE INVESTIMENTO IMOBILIÁRIO RESPONSABILIDADE LIMITADA,,,,,,,,,,
2026-06-01,23:36:51,NEWU11,NEWPORT RENDA URBANA FUNDO DE INVESTIMENTO IMOBILIÁRIO RESPONSABILIDADE LIMITADA,,,,,,,,,,
2026-06-01,23:36:51,NMKS11,NM KSM LOG FUNDO DE INVESTIMENTO IMOBILIÁRIO RESPONSABILIDADE LIMITADA,,,,,,,,,,
2026-06-01,23:36:51,NVIF11,NOVA I - FUNDO DE INVESTIMENTO IMOBILIÁRIO - RESPONSABILIDADE LIMITADA,,,,,,,,,,
2026-06-01,23:36:51,OCRE11,OCTO FUNDO DE INVESTIMENTO IMOBILIÁRIO RESPONSABILIDADE LIMITADA,,,,,,,,,,
2026-06-01,23:36:51,ONDA11,ONDA INVEST MULTIESTRATÉGIA FUNDO DE INVESTIMENTO IMOBILIÁRIO RESPONSABILIDADE LIMITADA,,,,,,,,,,
2026-06-01,23:36:51,ARRI11,OPEN K ATIVOS E RECEBIVEIS IMOBILIARIOS - FUNDO DE INVESTIMENTO IMOBILIARIO,,,,,,,,,,
2026-06-01,23:36:51,OBAL11,OPPORTUNITY BALASSIANO FUNDO DE INVESTIMENTO IMOBILIÁRIO -  RESPONSABILIDADE LIMITADA,,,,,,,,,,
2026-06-01,23:36:51,FTCE11,OPPORTUNITY FUNDO DE INVESTIMENTO IMOBILIÁRIO -  RESPONSABILIDADE LIMITADA,,,,,,,,,,
2026-06-01,23:36:51,OUJP11,OURINVEST JPP FUNDO DE INVESTIMENTO IMOBILIÁRIO DE  RESPONSABILIDADE LIMITADA,,,,,,,,,,
2026-06-01,23:36:51,OXRL11,OXIGÊNIO 2 FUNDO DE INVESTIMENTO IMOBILIÁRIO - RESPONSABILIDADE LIMITADA,,,,,,,,,,
2026-06-01,23:36:51,PNDL11,PANORAMA DESENVOLVIMENTO LOGÍSTICO - FUNDO DE INVESTIMENTO IMOBILIÁRIO - RESPONSABILIDADE LIMITADA,,,,,,,,,,
2026-06-01,23:36:51,PNLM11,PANORAMA LAST MILE SBC - FUNDO DE INVESTIMENTO IMOBILIÁRIO RESPONSABILIDADE LIMITADA,,,,,,,,,,
2026-06-01,23:36:51,PNPR11,PANORAMA PROPERTIES FUNDO DE INVESTIMENTO IMOBILIÁRIO,,,,,,,,,,
2026-06-01,23:36:51,PNRC11,PANORAMA REAL ESTATE CRÉDITO FUNDO DE INVESTIMENTO IMOBILIÁRIO RESPONSABILIDADE LIMITADA,,,,,,,,,,
2026-06-01,23:36:51,PMIS11,PARAMIS HEDGE FUND FUNDO DE INVESTIMENTO IMOBILIÁRIO - FII RESPONSABILIDADE LIMITADA,,,,,,,,,,
2026-06-01,23:36:51,VTVI11,PARKING PARTNERS FUNDO DE INVESTIMENTO IMOBILIÁRIO - FII - RESP LIMITADA,,,,,,,,,,
2026-06-01,23:36:51,PQAG11,PARQUE ANHANGUERA FUNDO DE INVESTIMENTO IMOBILIÁRIO DE RESPONSABILIDADE LIMITADA,,,,,,,,,,
2026-06-01,23:36:51,PATA11,PATAGÔNIA CAPITAL MULTIESTRATÉGIA FUNDO DE INVESTIMENTO IMOBILIÁRIO,,,,,,,,,,
2026-06-01,23:36:51,PATB11,PATEO BANDEIRANTES - FUNDO DE INVESTIMENTO IMOBILIÁRIO RESPONSABILIDADE LIMITADA,,,,,,,,,,
2026-06-01,23:36:51,PCIP11,PATRIA CRÉDITO IMOBILIÁRIO ÍNDICE DE PREÇOS FII - RESPONSABILIDADE LIMITADA,,,,,,,,,,
2026-06-01,23:36:51,PATC11,PÁTRIA EDIFÍCIOS CORPORATIVOS - FUNDO DE INVESTIMENTO IMOBILIÁRIO - RESPONSABILIDADE LIMITADA,,,,,,,,,,
2026-06-01,23:36:51,HGRE11,PATRIA ESCRITÓRIOS - FUNDO DE INVESTIMENTO IMOBILIÁRIO - RESPONSABILIDADE LIMITADA,,,,,,,,,,
2026-06-01,23:36:51,HGLG11,PÁTRIA LOG - FUNDO DE INVESTIMENTO IMOBILIÁRIO - RESPONSABILIDADE LIMITADA,,,,,,,,,,
2026-06-01,23:36:51,PLAG11,PATRIA LOGÍSTICA AGRO - FUNDO DE INVESTIMENTO IMOBILIÁRIO - RESPONSABILIDADE LIMITADA,,,,,,,,,,
2026-06-01,23:36:51,PATL11,PÁTRIA LOGÍSTICA FUNDO DE INVESTIMENTO IMOBILIÁRIO,,,,,,,,,,
2026-06-01,23:36:51,RBRL11,PATRIA LOGÍSTICA II FUNDO DE INVESTIMENTO IMOBILIÁRIO,,,,,,,,,,
2026-06-01,23:36:51,PMLL11,PATRIA MALLS FUNDO DE INVESTIMENTO IMOBILIÁRIO - RESPONSABILIDADE LIMITADA,,,,,,,,,,
2026-06-01,23:36:51,RBRX11,PATRIA PLUS MULTIESTRATÉGIA REAL ESTATE FUNDO DE INVESTIMENTO IMOBILIÁRIO RESPONSABILIDADE LIMITADA,,,,,,,,,,
2026-06-01,23:36:51,HGPO11,PATRIA PRIME OFFICES - FUNDO DE INVESTIMENTO IMOBILIÁRIO - RESPONSABILIDADE LIMITADA,,,,,,,,,,
2026-06-01,23:36:51,RBRK11,PATRIA PRIME OFFICES - FUNDO DE INVESTIMENTO IMOBILIÁRIO RESPONSABILIDADE LIMITADA,,,,,,,,,,
2026-06-01,23:36:51,HGCR11,PÁTRIA RECEBÍVEIS IMOBILIÁRIOS - FUNDO DE INVESTIMENTO IMOBILIÁRIO - RESPONSABILIDADE LIMITADA,,,,,,,,,,
2026-06-01,23:36:51,VCRR11,PATRIA RENDA RESIDENCIAL FUNDO DE  INVESTIMENTO IMOBILIÁRIO - RESPONSABILIDADE LIMITADA I FII,,,,,,,,,,
2026-06-01,23:36:51,HGRU11,PÁTRIA RENDA URBANA - FUNDO DE INVESTIMENTO IMOBILIÁRIO - RESPONSABILIDADE LIMITADA,,,,,,,,,,
2026-06-01,23:36:51,PSEC11,PATRIA SECURITIES FUNDO DE INVESTIMENTO IMOBILIÁRIO - RESPONSABILIDADE  LIMITADA,,,,,,,,,,
2026-06-01,23:36:51,PEMA11,PERFORMA REAL ESTATE FUNDO DE INVESTIMENTO IMOBILIÁRIO - RESPONSABILIDADE LIMITADA,,,,,,,,,,
2026-06-01,23:36:51,PMRL11,PERMUTA RESIDENCIAL FUNDO DE INVESTIMENTO IMOBILIÁRIO RESPONSABILIDADE LIMITADA,,,,,,,,,,
2026-06-01,23:36:51,PRSN11,PERSONALE I FUNDO DE INVESTIMENTO IMOBILIÁRIO RESPONSABILIDADE LIMITADA,,,,,,,,,,
2026-06-01,23:36:51,PORD11,POLO CRÉDITO IMOBILIÁRIO - FUNDO DE INVESTIMENTO IMOBILIÁRIO - RESPONSABILIDADE LIMITADA,,,,,,,,,,
2026-06-01,23:36:51,PLRI11,POLO FII - FII RECEBÍVEIS IMOBILIÁRIOS I - RESPONSABILIDADE LIMITADA,,,,,,,,,,
2026-06-01,23:36:51,PCAS11,PRAIA DO CASTELO FUNDO DE INVESTIMENTO IMOBILIÁRIO,,,,,,,,,,
2026-06-01,23:36:51,PRSV11,PRESIDENTE VARGAS FUNDO DE INVESTIMENTO IMOBILIÁRIO DE RESPONSABILIDADE LIMITADA,,,,,,,,,,
2026-06-01,23:36:51,TSER11,PRIME OFFICES FUNDO DE  INVESTIMENTO IMOBILIÁRIO - RESPONSABILIDADE LIMITADA,,,,,,,,,,
2026-06-01,23:36:51,FPAB11,PROJETO ÁGUA BRANCA FUNDO DE INVESTIMENTO IMOBILIÁRIO RESPONSABILIDADE LIMITADA,,,,,,,,,,
2026-06-01,23:36:51,PBLV11,PROLOGIS BRAZIL LOGISTICS VENTURE FUNDO DE INVESTIMENTO IMOBILIÁRIO DE RESPONSABILIDADE LIMITADA,,,,,,,,,,
2026-06-01,23:36:51,QTZD11,QUARTZO REAL ESTATE DEVELOPMENT MULTIESTRATÉGIA FUNDO DE INVESTIMENTO IMOBILIÁRIO RESPONSABILIDADE L,,,,,,,,,,
2026-06-01,23:36:51,RZZV11,RAIZZ DESENVOLVIMENTO I FUNDO DE INVESTIMENTO IMOBILIÁRIO - FII RESPONSABILIDADE LIMITADA,,,,,,,,,,
2026-06-01,23:36:51,RZZI11,RAIZZ DESENVOLVIMENTO II FUNDO DE INVESTIMENTO IMOBILIÁRIO RESPONSABILIDADE LIMITADA,,,,,,,,,,
2026-06-01,23:36:51,RZZR11,RAIZZ RENDA LOGÍSTICA FUNDO DE INVESTIMENTO IMOBILIÁRIO RESPONSABILIDADE LIMITADA,,,,,,,,,,
2026-06-01,23:36:51,RBDS11,RB CAPITAL DESENV. RESIDENCIAL II FUNDO DE INVESTIMENTO IMOBILIARIO - RESPONSABILIDADE LIMITADA,,,,,,,,,,
2026-06-01,23:36:51,RSPD11,RB CAPITAL DESENVOLVIMENTO RESIDENCIAL III FII - RESPONSABILIDADE LIMITADA,,,,,,,,,,
2026-06-01,23:36:51,RBIR11,RB CAPITAL DESENVOLVIMENTO RESIDENCIAL IV FUNDO DE INVESTIMENTO IMOBILIÁRIO - FII - RESP. LTDA.,,,,,,,,,,
2026-06-01,23:36:51,RFOF11,RB CAPITAL I FUNDO DE FUNDOS -RESPONSABILIDADE LIMITADA,,,,,,,,,,
2026-06-01,23:36:51,RBLG11,RB CAPITAL LOGÍSTICO FUNDO DE INVESTIMENTO IMOBILIÁRIO  FII RESPONSABILIDADE LIMITADA,,,,,,,,,,
2026-06-01,23:36:51,FIIP11,RB CAPITAL RENDA I FUNDO DE INVESTIMENTO IMOBILIARIO - FII - RESPONSABILIDADE LIMITADA,,,,,,,,,,
2026-06-01,23:36:51,RBRD11,RB CAPITAL RENDA II FII DE RESP LIMITADA,,,,,,,,,,
2026-06-01,23:36:51,RBTS11,RB CAPITAL TFO SITUS FUNDO DE INVESTIMENTO IMOBILIÁRIO - FII - RESPONSABILIDADE LIMITADA,,,,,,,,,,
2026-06-01,23:36:51,DRIM11,RB DESENVOLVIMENTO RESIDENCIAL V FUNDO DE INVESTIMENTO IMOBILIÁRIO -RESPONSABILIDADE LIMITADA,,,,,,,,,,
2026-06-01,23:36:51,MTES11,RB INVESTIMENTOS MULTIESTRATÉGIA FUNDO DE INVESTIMENTO IMOBILIÁRIORESPONSABILIDADE LIMITADA,,,,,,,,,,
2026-06-01,23:36:51,REME11,RB MULTIESTRATÉGIA IMOBILIÁRIA FUNDO DE INVESTIMENTO IMOBILIÁRIO - RESPONSABILIDADE LIMITADA,,,,,,,,,,
2026-06-01,23:36:51,RCFF11,RBR DESENVOLVIMENTO COMERCIAL FEEDER FOF - FII RESPONSABILIDADE LIMITADA,,,,,,,,,,
2026-06-01,23:36:51,RDCI11,RBR DESENVOLVIMENTO COMERCIAL I - FUNDO DE INVESTIMENTO IMOBILIÁRIO RESPONSABILIDADE LIMITADA,,,,,,,,,,
2026-06-01,23:36:51,RDLI11,RBR DESENVOLVIMENTO LOGÍSTICO I - FUNDO DE INVESTIMENTO IMOBILIÁRIO RESPONSABILIDADE LIMITADA,,,,,,,,,,
2026-06-01,23:36:51,SHIP11,RBR FLAGSHIP I FUNDO DE INVESTIMENTO IMOBILIÁRIO RESPONSABILIDADE LIMITADA,,,,,,,,,,
2026-06-01,23:36:51,BOAT11,RBR FLAGSHIP II FUNDO DE INVESTIMENTO IMOBILIÁRIO RESPONSABILIDADE LIMITADA,,,,,,,,,,
2026-06-01,23:36:51,RPRI11,RBR PREMIUM RECEBÍVEIS IMOBILIÁRIOS FUNDO DE INVESTIMENTO IMOBILIÁRIO RESPONSABILIDADE LIMITADA,,,,,,,,,,
2026-06-01,23:36:51,TPOS11,RBR TESOURARIA FII CDI+ FUNDO DE INVESTIMENTO IMOBILIÁRIO RESPONSABILIDADE LIMITADA,,,,,,,,,,
2026-06-01,23:36:51,TINF11,RBR TESOURARIA FII IPCA+ FUNDO DE INVESTIMENTO IMOBILIÁRIO RESPONSABILIDADE LIMITADA,,,,,,,,,,
2026-06-01,23:36:51,TOPP11,RBR TOP OFFICES FUNDO DE INVESTIMENTO IMOBILIÁRIO RESPONSABILIDADE LIMITADA,,,,,,,,,,
2026-06-01,23:36:51,RINV11,REAL INVESTOR FUNDO DE INVESTIMENTO IMOBILIÁRIO RESPONSABILIDADE LIMITADA,,,,,,,,,,
2026-06-01,23:36:51,RCRI11,REAL INVESTOR RECEBÍVEIS IMOBILIÁRIOS FUNDO DE INVESTIMENTO IMOBILIÁRIO RESPONSABILIDADE LIMITADA,,,,,,,,,,
2026-06-01,23:36:51,RECD11,REC FUNDO DE CRI COTAS AMORTIZÁVEIS - FUNDO DE INVESTIMENTO IMOBILIÁRIO,,,,,,,,,,
2026-06-01,23:36:51,RMBS11,REC MASTER FUNDO DE CRI COTAS AMORTIZÁVEIS FII - RESPONSABILIDADE LIMITADA,,,,,,,,,,
2026-06-01,23:36:51,RECM11,REC MULTIESTRATÉGIA - FUNDO DE INVESTIMENTO IMOBILIÁRIO - RESPONSABILIDADE LIMITADA,,,,,,,,,,
2026-06-01,23:36:51,RBHG11,RIO BRAVO CRÉDITO IMOBILIÁRIO HIGH GRADE FUNDO DE INVESTIMENTO  IMOBILIÁRIO - FII RESP LIMITADA,,,,,,,,,,
2026-06-01,23:36:51,RBHY11,RIO BRAVO CRÉDITO IMOBILIÁRIO HIGH YIELD FUNDO DE INVESTIMENTO IMOBILIÁRIO - FII RESP LIMITADA,,,,,,,,,,
2026-06-01,23:36:51,RBFY11,RIO BRAVO FOR YOU FUNDO DE INVESTIMENTO IMOBILIÁRIO DE RESPONSABILIDADE LIMITADA,,,,,,,,,,
2026-06-01,23:36:51,RBFM11,RIO BRAVO MULTIESTRATÉGIA FUNDO DE INVESTIMENTO IMOBILIÁRIO DE RESPONSABILIDADE LIMITADA,,,,,,,,,,
2026-06-01,23:36:51,RBOP11,RIO BRAVO OPORTUNIDADES IMOBILIÁRIAS FUNDO DE INVESTIMENTO IMOBILIÁRIO DE RESPONSABILIDADE LIMITADA,,,,,,,,,,
2026-06-01,23:36:51,RCRB11,RIO BRAVO RENDA CORPORATIVA FUNDO DE INVESTIMENTO IMOBILIÁRIO - RESPONSABILIDADE LIMITADA,,,,,,,,,,
2026-06-01,23:36:51,RBRS11,RIO BRAVO RENDA RESIDENCIAL FUNDO DE INVESTIMENTO IMOBILIÁRIO DE RESPONSABILIDADE LIMITADA,,,,,,,,,,
2026-06-01,23:36:51,RBVA11,RIO BRAVO RENDA VAREJO FUNDO DE INVESTIMENTO IMOBILIÁRIO DE RESPONSABILIDADE LIMITADA,,,,,,,,,,
2026-06-01,23:36:51,RNGO11,RIO NEGRO FUNDO DE INVESTIMENTO IMOBILIÁRIO DE RESPONSABILIDADE LIMITADA,,,,,,,,,,
2026-06-01,23:36:51,FRRE11,RIO REAL  ESTATE FUNDO DE INVESTIMENTO IMOBILIÁRIO DE RESPONSABILIDADE LIMITADA,,,,,,,,,,
2026-06-01,23:36:51,RZAK11,RIZA AKIN FUNDO DE INVESTIMENTO IMOBILIÁRIO RESPONSABILIDADE LIMITADA,,,,,,,,,,
2026-06-01,23:36:51,RZAT11,RIZA ARCTIUM REAL ESTATE FII - FUNDO DE INVESTIMENTO IMOBILIÁRIO RESPONSABILIDADE LIMITADA,,,,,,,,,,
2026-06-01,23:36:51,RZLC11,RIZA LECCI FUNDO DE INVESTIMENTO IMOBILIÁRIO RESPONSABILIDADE LIMITADA,,,,,,,,,,
2026-06-01,23:36:51,RJDA11,RJDI FUNDO DE INVESTIMENTO IMOBILIÁRIO,,,,,,,,,,
2026-06-01,23:36:51,SAPI11,SANTANDER PAPÉIS IMOBILIÁRIOS FUNDO DE  INVESTIMENTO IMOBILIÁRIO - RESP LIMITADA,,,,,,,,,,
2026-06-01,23:36:51,FISD11,SÃO DOMINGOS - FUNDO DE INVESTIMENTO IMOBILIÁRIO - FII,,,,,,,,,,
2026-06-01,23:36:51,SCPF11,SCP FII - RESPONSABILIDADE LIMITADA,,,,,,,,,,
2026-06-01,23:36:51,SEQR11,SEQUÓIA III RENDA IMOBILIÁRIA FUNDO DE INVESTIMENTO IMOBILIÁRIO - RESPONSABILIDADE LIMITADA,,,,,,,,,,
2026-06-01,23:36:51,SHPH11,SHOPPING PÁTIO HIGIENÓPOLIS FUNDO DE INVESTIMENTO IMOBILIÁRIO DE RESPONSABILIDADE LIMITADA,,,,,,,,,,
2026-06-01,23:36:51,SHPP11,SHOPPING PÁTIO PAULISTA FUNDO DE INVESTIMENTO IMOBILIÁRIO RESPONSABILIDADE  LIMITADA,,,,,,,,,,
2026-06-01,23:36:51,WPLZ11,SHOPPING WEST PLAZA FUNDO DE INVESTIMENTO IMOBILIARIO DE RESPONSABILIDADE LIMITADA,,,,,,,,,,
2026-06-01,23:36:51,REIT11,SINGULARE FUNDO DE INVESTIMENTO IMOBILIÁRIO,,,,,,,,,,
2026-06-01,23:36:51,SJAU11,SJ AU LOGÍSTICA FUNDO DE INVESTIMENTO IMOBILIÁRIO RESPONSABILIDADE LIMITADA,,,,,,,,,,
2026-06-01,23:36:51,SOLR11,SOLARIUM FII - FUNDO DE INVESTIMENTO IMOBILIÁRIO,,,,,,,,,,
2026-06-01,23:36:51,SPTW11,SP DOWNTOWN FUNDO DE INVESTIMENTO IMOBILIÁRIO - FII,,,,,,,,,,
