data_captura,hora_captura,codigo_fundo,nome_fundo,cnpj,administrador,segmento,tipo,mandato,prazo_duracao,gestao,data_encerramento,cotistas,patrimonio_liquido
2026-06-02,20:09:06,HLMB11,FRAM CAPITAL HELMER MULTIATIVOS RENDA PREFERENCIAL FUNDO DE INVESTIMENTO IMOBILIÁRIO,,,,,,,,,,
2026-06-02,20:09:06,KFOF11,FUNDO DE FUNDOS DE INVESTIMENTO IMOBILIÁRIO KINEA FII RESPONSABILIDADE LIMITADA,,,,,,,,,,
2026-06-02,20:09:06,DVFF11,FUNDO DE INVESTIMENTO IMOBILIÁRIO - DEVANT FUNDO DE FUNDOS IMOBILIÁRIOS DE RESPONSABILIDADE LIMITADA,,,,,,,,,,
2026-06-02,20:09:06,ANCR11,FUNDO DE INVESTIMENTO IMOBILIÁRIO - FII ANCAR IC - RESPONSABILIDADE LIMITADA,,,,,,,,,,
2026-06-02,20:09:06,FAED11,FUNDO DE INVESTIMENTO IMOBILIÁRIO - FII ANHANGUERA EDUCACIONAL RESPONSABILIDADE LIMITADA,,,,,,,,,,
2026-06-02,20:09:06,FCFL11,FUNDO DE INVESTIMENTO IMOBILIÁRIO - FII CAMPUS FARIA LIMA RESPONSABILIDADE LIMITADA,,,,,,,,,,
2026-06-02,20:09:06,CEOC11,FUNDO DE INVESTIMENTO IMOBILIÁRIO - FII CEO CYRELA COMMERCIAL PROPERTIES RESPONSABILIDADE LIMITADA,,,,,,,,,,
2026-06-02,20:09:06,FAMB11,FUNDO DE INVESTIMENTO IMOBILIÁRIO - FII EDIFÍCIO ALMIRANTE BARROSO RESPONSABILIDADE LIMITADA,,,,,,,,,,
2026-06-02,20:09:06,EDGA11,FUNDO DE INVESTIMENTO IMOBILIÁRIO - FII EDIFÍCIO GALERIA RESPONSABILIADADE LIMITADA,,,,,,,,,,
2026-06-02,20:09:06,FYTO11,FUNDO DE INVESTIMENTO IMOBILIÁRIO - FII FYTO RECEBÍVEIS IMOBILIÁRIOS RESPONSABILIDADE LIMITADA,,,,,,,,,,
2026-06-02,20:09:06,HCRI11,FUNDO DE INVESTIMENTO IMOBILIÁRIO - FII HOSPITAL DA CRIANÇA RESPONSABILIDADE LIMITADA,,,,,,,,,,
2026-06-02,20:09:06,NSLU11,FUNDO DE INVESTIMENTO IMOBILIÁRIO - FII HOSPITAL NOSSA SENHORA DE LOURDES RESPONSABILIDADE LIMITADA,,,,,,,,,,
2026-06-02,20:09:06,MAXR11,FUNDO DE INVESTIMENTO IMOBILIÁRIO - FII MAX RETAIL RESPONSABILIDADE LIMITADA,,,,,,,,,,
2026-06-02,20:09:06,PQDP11,FUNDO DE INVESTIMENTO IMOBILIÁRIO - FII PARQUE DOM PEDRO SHOPPING CENTER RESPONSABILIDADE LIMITADA,,,,,,,,,,
2026-06-02,20:09:06,RBRI11,FUNDO DE INVESTIMENTO IMOBILIÁRIO - FII RBR DESENVOLVIMENTO III RESPONSABILIDADE LIMITADA,,,,,,,,,,
2026-06-02,20:09:06,RDIV11,FUNDO DE INVESTIMENTO IMOBILIÁRIO - FII RBR DESENVOLVIMENTO IV RESPONSABILIDADE LIMITADA,,,,,,,,,,
2026-06-02,20:09:06,RBRR11,FUNDO DE INVESTIMENTO IMOBILIARIO - FII RBR RENDIMENTO HIGH GRADE RESPONSABILIDADE LIMITADA,,,,,,,,,,
2026-06-02,20:09:06,RECR11,FUNDO DE INVESTIMENTO IMOBILIÁRIO - FII REC RECEBÍVEIS IMOBILIÁRIOS - RESPONSABILIDADE LIMITADA,,,,,,,,,,
2026-06-02,20:09:06,RECT11,FUNDO DE INVESTIMENTO IMOBILIÁRIO - FII REC RENDA IMOBILIÁRIA - RESPONSABILIDADE LIMITADA,,,,,,,,,,
2026-06-02,20:09:06,SHDP11,FUNDO DE INVESTIMENTO IMOBILIÁRIO - FII SHOPPING PARQUE D. PEDRO RESPONSABILIDADE LIMITADA,,,,,,,,,,
2026-06-02,20:09:06,TRNT11,FUNDO DE INVESTIMENTO IMOBILIÁRIO - FII TORRE NORTE,,,,,,,,,,
2026-06-02,20:09:06,APXR11,FUNDO DE INVESTIMENTO IMOBILIÁRIO APEX REALTY - FII,,,,,,,,,,
2026-06-02,20:09:06,BRHT11,FUNDO DE INVESTIMENTO IMOBILIÁRIO BR HOTÉIS,,,,,,,,,,
2026-06-02,20:09:06,BRCQ11,FUNDO DE INVESTIMENTO IMOBILIÁRIO BRC-IV DESENVOLVIMENTO RESPONSABILIDADE LIMITADA,,,,,,,,,,
2026-06-02,20:09:06,CXAG11,FUNDO DE INVESTIMENTO IMOBILIÁRIO CAIXA AGÊNCIAS - RESPONSABILIDADE LIMITADA,,,,,,,,,,
2026-06-02,20:09:06,CXCI11,FUNDO DE INVESTIMENTO IMOBILIÁRIO CAIXA CARTEIRA IMOBILIÁRIA RESPONSABILIDADE LIMITADA,,,,,,,,,,
2026-06-02,20:09:06,CXCE11,FUNDO DE INVESTIMENTO IMOBILIÁRIO CAIXA CEDAE RESPONSABILIDADE LIMITADA,,,,,,,,,,
2026-06-02,20:09:06,CXTL11,FUNDO DE INVESTIMENTO IMOBILIARIO CAIXA SEQ LOGISTICA RENDA RESPONSABILIDADE LIMITADA,,,,,,,,,,
2026-06-02,20:09:06,IDUA11,FUNDO DE INVESTIMENTO IMOBILIÁRIO DE UNIDADES AUTÔNOMAS IV,,,,,,,,,,
2026-06-02,20:09:06,LKDV11,FUNDO DE INVESTIMENTO IMOBILIÁRIO DEVELOPMENT V1 RESPONSABILIDADE LIMITADA,,,,,,,,,,
2026-06-02,20:09:06,EDFO11,FUNDO DE INVESTIMENTO IMOBILIÁRIO EDIFÍCIO OURINVEST - RESPONSABILIDADE LIMITADA,,,,,,,,,,
2026-06-02,20:09:06,NVHO11,FUNDO DE INVESTIMENTO IMOBILIÁRIO FII NOVO HORIZONTE - RESPONSABILIDADE LIMITADA,,,,,,,,,,
2026-06-02,20:09:06,GTWR11,FUNDO DE INVESTIMENTO IMOBILIÁRIO GREEN TOWERS RESPONSABILIDADE LIMITADA,,,,,,,,,,
2026-06-02,20:09:06,HBCR11,FUNDO DE INVESTIMENTO IMOBILIÁRIO HBC RENDA URBANA,,,,,,,,,,
2026-06-02,20:09:06,HUCG11,FUNDO DE INVESTIMENTO IMOBILIÁRIO HOSPITAL UNIMED CAMPINA GRANDE RESPONSABILIDADE LIMITADA,,,,,,,,,,
2026-06-02,20:09:06,HUSC11,FUNDO DE INVESTIMENTO IMOBILIARIO HOSPITAL UNIMED SUL CAPIXABA,,,,,,,,,,
2026-06-02,20:09:06,HOSI11,FUNDO DE INVESTIMENTO IMOBILIÁRIO HOUSI RESPONSABILIDADE LIMITADA,,,,,,,,,,
2026-06-02,20:09:06,FINF11,FUNDO DE INVESTIMENTO IMOBILIÁRIO INFRA REAL ESTATE - FII RESPONSABILIDADE LIMITADA,,,,,,,,,,
2026-06-02,20:09:06,BLUE11,FUNDO DE INVESTIMENTO IMOBILIÁRIO MACAM SHOPPING RESPONSABILIDADE LIMITADA,,,,,,,,,,
2026-06-02,20:09:06,MMPD11,FUNDO DE INVESTIMENTO IMOBILIÁRIO MAUÁ CAPITAL MPD DESENVOLVIMENTO RESIDENCIAL RESP LIMITADA,,,,,,,,,,
2026-06-02,20:09:06,MCCI11,FUNDO DE INVESTIMENTO IMOBILIÁRIO MAUÁ CAPITAL RECEBÍVEIS IMOBILIÁRIOS - FII RESPONSABILIDADE LIMITA,,,,,,,,,,
2026-06-02,20:09:06,WTSP11,FUNDO DE INVESTIMENTO IMOBILIÁRIO OURINVEST RE I - RESPONSABILIDADE LIMITADA,,,,,,,,,,
2026-06-02,20:09:06,PABY11,FUNDO DE INVESTIMENTO IMOBILIÁRIO PANAMBY,,,,,,,,,,
2026-06-02,20:09:06,RBRP11,FUNDO DE INVESTIMENTO IMOBILIÁRIO PATRIA PROPERTIES - FII RESPONSABILIDADE LIMITADA,,,,,,,,,,
2026-06-02,20:09:06,VTPA11,FUNDO DE INVESTIMENTO IMOBILIÁRIO PATRIMONIAL V RESPONSABILIDADE LIMITADA,,,,,,,,,,
2026-06-02,20:09:06,FPNG11,FUNDO DE INVESTIMENTO IMOBILIÁRIO PEDRA NEGRA RENDA IMOBILIÁRIA - RESPONSABILIDADE LIMITADA,,,,,,,,,,
2026-06-02,20:09:06,VTPL11,FUNDO DE INVESTIMENTO IMOBILIÁRIO PLUS RESPONSABILIDADE LIMITADA,,,,,,,,,,
2026-06-02,20:09:06,ESTQ11,FUNDO DE INVESTIMENTO IMOBILIARIO POLO ESTOQUE II RESPONSABILIDADE LIMITADA,,,,,,,,,,
2026-06-02,20:09:06,VPSI11,FUNDO DE INVESTIMENTO IMOBILIÁRIO POLO SHOPPING INDAIATUBA - RESPONSABILIDADE LIMITADA,,,,,,,,,,
2026-06-02,20:09:06,RBRY11,FUNDO DE INVESTIMENTO IMOBILIÁRIO RBR CRÉDITO IMOBILIÁRIO ESTRUTURADO RESPONSABILIDADE LIMITADA,,,,,,,,,,
2026-06-02,20:09:06,RELG11,FUNDO DE INVESTIMENTO IMOBILIÁRIO REC LOGÍSTICA - RESPONSABILIDADE  LIMITADA,,,,,,,,,,
2026-06-02,20:09:06,RLGX11,FUNDO DE INVESTIMENTO IMOBILIÁRIO REC LOGÍSTICA II - RESPONSABILIDADE LIMITADA,,,,,,,,,,
2026-06-02,20:09:06,RRES11,FUNDO DE INVESTIMENTO IMOBILIÁRIO RIVIERA RESIDENCIAL - RESPONSABILIDADE LIMITADA,,,,,,,,,,
2026-06-02,20:09:06,RZTR11,FUNDO DE INVESTIMENTO IMOBILIÁRIO RIZA TERRAX,,,,,,,,,,
2026-06-02,20:09:06,ROOF11,FUNDO DE INVESTIMENTO IMOBILIÁRIO ROOFTOP I RESPONSABILIDADE LIMITADA,,,,,,,,,,
2026-06-02,20:09:06,HOMS11,FUNDO DE INVESTIMENTO IMOBILIÁRIO ROOFTOP III RESPONSABILIDADE LIMITADA,,,,,,,,,,
2026-06-02,20:09:06,FISC11,FUNDO DE INVESTIMENTO IMOBILIÁRIO SC 401 - RESPONSABILIDADE LIMITADA,,,,,,,,,,
2026-06-02,20:09:06,SAIC11,FUNDO DE INVESTIMENTO IMOBILIARIO SIA CORPORATE RESPONSABILIDADE LIMITADA,,,,,,,,,,
2026-06-02,20:09:06,SMRE11,FUNDO DE INVESTIMENTO IMOBILIÁRIO SMART REAL ESTATE - FII RESPONSABILIDADE LIMITADA,,,,,,,,,,
2026-06-02,20:09:06,SOFF11,FUNDO DE INVESTIMENTO IMOBILIÁRIO SOFIA,,,,,,,,,,
2026-06-02,20:09:06,SPVJ11,FUNDO DE INVESTIMENTO IMOBILIÁRIO SUCCESPAR VAREJO RESPONSABILIDADE LIMITADA,,,,,,,,,,
2026-06-02,20:09:06,TGAR11,FUNDO DE INVESTIMENTO IMOBILIÁRIO TG ATIVO REAL,,,,,,,,,,
2026-06-02,20:09:06,TRCO11,FUNDO DE INVESTIMENTO IMOBILIÁRIO TORRE RIO CLARO OFFICES - RESPONSABILIDADE LIMITADA,,,,,,,,,,
2026-06-02,20:09:06,TRUE11,FUNDO DE INVESTIMENTO IMOBILIÁRIO TRUE MULTIESTRATÉGIA - RESPONSABILIDADE LIMITADA,,,,,,,,,,
2026-06-02,20:09:06,LVBI11,FUNDO DE INVESTIMENTO IMOBILIÁRIO VBI LOGÍSTICO - RESPONSABILIDADE LIMITADA,,,,,,,,,,
2026-06-02,20:09:06,PVBI11,FUNDO DE INVESTIMENTO IMOBILIÁRIO VBI PRIME PROPERTIES - RESPONSABILIDADE LIMITADA,,,,,,,,,,
2026-06-02,20:09:06,VERE11,FUNDO DE INVESTIMENTO IMOBILIÁRIO VEREDA - FII RESPONSABILIDADE LIMITADA,,,,,,,,,,
2026-06-02,20:09:06,FIVN11,FUNDO DE INVESTIMENTO IMOBILIÁRIO VIDA NOVA - FII - RESPONSABILIDADE LIMITADA,,,,,,,,,,
2026-06-02,20:09:06,VSHO11,FUNDO DE INVESTIMENTO IMOBILIÁRIO VOTORANTIM SHOPPING,,,,,,,,,,
2026-06-02,20:09:06,BMLT11,FUNDO DE INVESTIMENTOS  IMOBILIÁRIOS DE PERMUTA FINANCEIRA LOTE5 MEZANINO RESPONSABILIDADE  LIMITADA,,,,,,,,,,
2026-06-02,20:09:06,FIIC11,FUNDO DE INVESTIMENTOS IMOBILIÁRIO DO CAMPREV PARA SUSTENTABILIDADE PREVIDENCIÁRIA DO MUNICÍPIO,,,,,,,,,,
2026-06-02,20:09:06,BSLT11,FUNDO DE INVESTIMENTOS IMOBILIÁRIOS DE PERMUTA FINANCEIRA LOTE5 (SENIOR) RESPONSABILIDADE LIMITADA,,,,,,,,,,
2026-06-02,20:09:06,TCIN11,G5 CIDADE NOVA FUNDO DE INVESTIMENTO IMOBILIÁRIO,,,,,,,,,,
2026-06-02,20:09:06,GCDL11,GALAPAGOS DESENVOLVIMENTO LOGÍSTICO FUNDO DE INVESTIMENTO IMOBILIÁRIO RESPONSABILIDADE LIMITADA,,,,,,,,,,
2026-06-02,20:09:06,GSRF11,GALAPAGOS DESENVOLVIMENTO RESIDENCIAL FUNDO DE INVESTIMENTO IMOBILIÁRIO RESPONSABILIDADE LIMITADA,,,,,,,,,,
2026-06-02,20:09:06,GFDL11,GALAPAGOS FEEDER DESENVOLVIMENTO LOGÍSTICO FUNDO DE INVESTIMENTO IMOBILIÁRIO RESPONSABILIDADE LIMITA,,,,,,,,,,
2026-06-02,20:09:06,GLPF11,GALAPAGOS FEEDER LOGÍSTICO FUNDO DE INVESTIMENTO IMOBILIÁRIO RESPONSABILIDADE LIMITADA,,,,,,,,,,
2026-06-02,20:09:06,GLCR11,GALAPAGOS HEDGE FUND FUNDO DE INVESTIMENTO IMOBILIÁRIO RESPONSABILIDADE LIMITADA,,,,,,,,,,
2026-06-02,20:09:06,GCRI11,GALAPAGOS RECEBÍVEIS IMOBILIÁRIOS FUNDO DE INVESTIMENTO IMOBILIÁRIO RESPONSABILIDADE LIMITADA,,,,,,,,,,
2026-06-02,20:09:06,GCOI11,GALAPAGOS SPECIAL OPORTUNITIES FUNDO DE INVESTIMENTO IMOBILIÁRIO,,,,,,,,,,
2026-06-02,20:09:06,GZIT11,GAZIT MALLS FUNDO DE INVESTIMENTO IMOBILIÁRIO RESPONSABILIDADE LIMITADA,,,,,,,,,,
2026-06-02,20:09:06,FIGS11,GENERAL SHOPPING ATIVO E RENDA FUNDO DE INVESTIMENTO IMOBILIÁRIO DE RESPONSABILIDADE LIMITADA,,,,,,,,,,
2026-06-02,20:09:06,GSFI11,GENERAL SHOPPING E OUTLETS DO BRASIL FUNDO DE INVESTIMENTO IMOBILIÁRIO RESPONSABILIDADE LIMITADA,,,,,,,,,,
2026-06-02,20:09:06,VXXV11,GENESIS MULTIESTRATÉGIA FUNDO DE INVESTIMENTO IMOBILIÁRIO - FII -  RESPONSABILIDADE LIMITADA,,,,,,,,,,
2026-06-02,20:09:06,GLOG11,GENIAL LOGÍSTICA - FUNDO DE INVESTIMENTO IMOBILIÁRIO - RESPONSABILIDADE LIMITADA,,,,,,,,,,
2026-06-02,20:09:06,ABCP11,GRAND PLAZA SHOPPING FUNDO DE INVESTIMENTO IMOBILIÁRIO - RESPONSABILIDADE LIMITADA,,,,,,,,,,
2026-06-02,20:09:06,RCFA11,GRUPO RCFA FUNDO DE INVESTIMENTO IMOBILIARIO,,,,,,,,,,
2026-06-02,20:09:06,GAME11,GUARDIAN MULTIESTRATÉGIA IMOBILIÁRIA I FII DE RESPONSABILIDADE LIMITADA,,,,,,,,,,
2026-06-02,20:09:06,GARE11,GUARDIAN REAL ESTATE FUNDO DE INVESTIMENTO IMOBILIÁRIO DE RESPONSABILIDADE LIMITADA,,,,,,,,,,
2026-06-02,20:09:06,HABT11,HABITAT RECEBÍVEIS PULVERIZADOS FUNDO DE INVESTIMENTO IMOBILIÁRIO RESPONSABILIDADE LIMITADA,,,,,,,,,,
2026-06-02,20:09:06,ATCR11,HAZ FUNDO DE INVESTIMENTO IMOBILIÁRIO,,,,,,,,,,
2026-06-02,20:09:06,HCTB11,HCO CURITIBA I FUNDO DE INVESTIMENTO IMOBILIÁRIO DE RESPONSABILIDADE LIMITADA,,,,,,,,,,
2026-06-02,20:09:06,AERO11,HCO OPPS AERO I FII DE RESPONSABILIDADE LIMITADA,,,,,,,,,,
2026-06-02,20:09:06,HCTR11,HECTARE CE FUNDO DE INVESTIMENTO IMOBILIÁRIO RESPONSABILIDADE LIMITADA,,,,,,,,,,
2026-06-02,20:09:06,HCST11,HECTARE DESENVOLVIMENTO STUDENT HOUSING - FUNDO DE INVESTIMENTO IMOBILIÁRIO RESPONSABILIDADE LIMITAD,,,,,,,,,,
2026-06-02,20:09:06,HCHG11,HECTARE RECEBÍVEIS HIGH GRADE FUNDO DE INVESTIMENTO IMOBILIÁRIO - FII - RESP LIMITADA,,,,,,,,,,
2026-06-02,20:09:06,HAAA11,HEDGE AAA FUNDO DE INVESTIMENTO IMOBILIÁRIO DE RESPONSABILIDADE LIMITADA,,,,,,,,,,
2026-06-02,20:09:06,ATSA11,HEDGE ATRIUM SHOPPING SANTO ANDRÉ FUNDO DE INVESTIMENTO IMOBILIÁRIO DE RESPONSABILIDADE LIMITADA,,,,,,,,,,
2026-06-02,20:09:06,HGBL11,HEDGE BRASIL LOGÍSTICO INDUSTRIAL FUNDO DE INVESTIMENTO IMOBILIÁRIO DE RESPONSABILIDADE LIMITADA,,,,,,,,,,
2026-06-02,20:09:06,HGBS11,HEDGE BRASIL SHOPPING FUNDO DE INVESTIMENTO IMOBILIÁRIO DE RESPONSABILIDADE LIMITADA,,,,,,,,,,
2026-06-02,20:09:06,HDEL11,HEDGE DESENVOLVIMENTO LOGÍSTICO FUNDO DE INVESTIMENTO IMOBILIÁRIO DE RESPONSABILIDADE LIMITADA,,,,,,,,,,
2026-06-02,20:09:06,FLRP11,HEDGE FLORIPA SHOPPING FUNDO DE INVESTIMENTO IMOBILIÁRIO DE RESPONSABILIDADE LIMITADA,,,,,,,,,,
2026-06-02,20:09:06,HJCT11,HEDGE JHSF CAPITAL PRIME OFFICES FUNDO DE INVESTIMENTO IMOBILIÁRIO DE RESPONSABILIDADE LIMITADA,,,,,,,,,,
2026-06-02,20:09:06,HLOG11,HEDGE LOGÍSTICA FUNDO DE INVESTIMENTO IMOBILIÁRIO DE RESPONSABILIDADE LIMITADA,,,,,,,,,,
2026-06-02,20:09:06,HOFC11,HEDGE OFFICE INCOME FUNDO DE INVESTIMENTO IMOBILIÁRIO DE RESPONSABILIDADE LIMITADA,,,,,,,,,,
2026-06-02,20:09:06,HDOF11,HEDGE PALADIN DESIGN OFFICES FUNDO DE INVESTIMENTO IMOBILIÁRIO DE RESPONSABILIDADE LIMITADA,,,,,,,,,,
2026-06-02,20:09:06,HRDF11,HEDGE REALTY DEVELOPMENT FUNDO DE INVESTIMENTO IMOBILIÁRIO DE RESPONSABILIDADE LIMITADA,,,,,,,,,,
2026-06-02,20:09:06,HREC11,HEDGE RECEBÍVEIS IMOBILIÁRIOS FUNDO DE INVESTIMENTO IMOBILIÁRIO DE RESPONSABILIDADE LIMITADA,,,,,,,,,,
2026-06-02,20:09:06,SEED11,HEDGE SEED FUNDO DE INVESTIMENTO IMOBILIARIO DE RESPONSABILIDADE LIMITADA,,,,,,,,,,
2026-06-02,20:09:06,HPDP11,HEDGE SHOPPING PARQUE DOM PEDRO FUNDO DE INVESTIMENTO IMOBILIÁRIO DE RESPONSABILIDADE LIMITADA,,,,,,,,,,
2026-06-02,20:09:06,STRY11,HEDGE STRATEGY FUNDO DE INVESTIMENTO IMOBILIÁRIO DE RESPONSABILIDADE LIMITADA,,,,,,,,,,
2026-06-02,20:09:06,HFOF11,HEDGE TOP FOFII 3 FUNDO DE INVESTIMENTO IMOBILIÁRIO DE RESPONSABILIDADE LIMITADA,,,,,,,,,,
2026-06-02,20:09:06,YEES11,HEDGE YEES HABITAÇÕES ECONÔMICAS FUNDO DE INVESTIMENTO IMOBILIÁRIO DE RESPONSABILIDADE LIMITADA,,,,,,,,,,
2026-06-02,20:09:06,HGIC11,HGI CRÉDITOS IMOBILIÁRIOS FUNDO DE INVESTIMENTO IMOBILIÁRIO RESPONSABILIDADE LIMITADA,,,,,,,,,,
2026-06-02,20:09:06,HIRE11,HIRE FUNDO DE INVESTIMENTO IMOBILIÁRIO RESPONSABILIDADE LIMITADA,,,,,,,,,,
2026-06-02,20:09:06,HILG11,HIRE LOG I - FUNDO DE INVESTIMENTO IMOBILIÁRIO,,,,,,,,,,
2026-06-02,20:09:06,HTMX11,HOTEL MAXINVEST FUNDO DE INVESTIMENTO IMOBILIÁRIO RESPONSABILIDADE LIMITADA,,,,,,,,,,
2026-06-02,20:09:06,HSAF11,HSI ATIVOS FINANCEIROS FUNDO DE INVESTIMENTO IMOBILIÁRIO DE RESP LIMITADA,,,,,,,,,,
2026-06-02,20:09:06,HSLG11,HSI LOGÍSTICA FUNDO DE INVESTIMENTO IMOBILIÁRIO DE RESP LIMITADA,,,,,,,,,,
2026-06-02,20:09:06,HSML11,HSI MALLS FUNDO DE INVESTIMENTO IMOBILIÁRIO DE RESPONSABILIDADE LIMITADA,,,,,,,,,,
2026-06-02,20:09:06,HUSI11,HUSI FUNDO DE INVESTIMENTO IMOBILIÁRIO,,,,,,,,,,
2026-06-02,20:09:06,IVCI11,ICATU VANGUARDA CRÉDITO IMOBILIÁRIO FUNDO DE INVESTIMENTO IMOBILIÁRIO - RESPONSABILIDADE LIMITADA,,,,,,,,,,
2026-06-02,20:09:06,GRUL11,ICATU VANGUARDA GRU  LOGÍSTICO FUNDO DE INVESTIMENTO IMOBILIÁRIO - RESPONSABILIDADE LIMITADA,,,,,,,,,,
2026-06-02,20:09:06,ICNE11,ÍCONE - FUNDO DE INVESTIMENTO IMOBILIÁRIO RESPONSABILIDADE LIMITADA,,,,,,,,,,
2026-06-02,20:09:06,IMMB11,IMMOBINVEST FUNDO DE INVESTIMENTO IMOBILIÁRIO RESPONSABILIDADE LIMITADA,,,,,,,,,,
2026-06-02,20:09:06,INDE11,INTER DESENVOLVIMENTO FUNDO DE INVESTIMENTO IMOBILIÁRIO RESPONSABILIDADE LIMITADA,,,,,,,,,,
2026-06-02,20:09:06,INLG11,INTER LOGÍSTICO FUNDO DE INVESTIMENTO IMOBILIÁRIO FII RESPONSABILIDADE LIMITADA,,,,,,,,,,
2026-06-02,20:09:06,INRD11,INTER RESIDENCE FUNDO DE INVESTIMENTO IMOBILIÁRIO FII RESPONSABILIDADE LIMITADA,,,,,,,,,,
2026-06-02,20:09:06,ITIP11,INTER TEVA ÍNDICE DE PAPEL FUNDO DE INVESTIMENTO IMOBILIÁRIO FII RESPONSABILIDADE LIMITADA,,,,,,,,,,
2026-06-02,20:09:06,ITIT11,INTER TEVA ÍNDICE DE TIJOLO FUNDO DE INVESTIMENTO IMOBILIÁRIO FII RESPONSABILIDADE LIMITADA,,,,,,,,,,
2026-06-02,20:09:06,IBBP11,INVISTA BRAZILIAN BUSINESS PARK FUNDO DE INVESTIMENTO IMOBILIÁRIO,,,,,,,,,,
2026-06-02,20:09:06,XPIN11,INVISTA INDUSTRIAL FUNDO DE INVESTIMENTO IMOBILIÁRIO,,,,,,,,,,
2026-06-02,20:09:06,IRIM11,IRIDIUM FUNDO DE INVESTIMENTO IMOBILIÁRIO RESPONSABILIDADE LIMITADA,,,,,,,,,,
2026-06-02,20:09:06,ICDI11,ITAÚ CRÉDITO IMOBILIÁRIO CDI FUNDO DE INVESTIMENTO IMOBILIÁRIO RESPONSABILIDADE LIMITADA,,,,,,,,,,
2026-06-02,20:09:06,ICRI11,ITAÚ CRÉDITO IMOBILIÁRIO IPCA FUNDO DE INVESTIMENTO IMOBILIÁRIO RESPONSABILIDADE LIMITADA,,,,,,,,,,
2026-06-02,20:09:06,ILOG11,ITAÚ RBR DESENVOLVIMENTO LOGÍSTICO - FUNDO DE INVESTIMENTO IMOBILIÁRIO RESPONSABILIDADE LIMITADA,,,,,,,,,,
2026-06-02,20:09:06,TMPS11,ITAÚ TEMPUS FUNDO DE INVESTIMENTO IMOBILIÁRIO RESPONSABILIDADE LIMITADA,,,,,,,,,,
2026-06-02,20:09:06,ITRI11,ITAÚ TOTAL RETURN FUNDO DE INVESTIMENTO IMOBILIÁRIO RESPONSABILIDADE LIMITADA,,,,,,,,,,
2026-06-02,20:09:06,JCDB11,JACARANDÁ 02 FUNDO DE INVESTIMENTO IMOBILIÁRIO RESPONSABILIDADE LIMITADA,,,,,,,,,,
2026-06-02,20:09:06,JCDA11,JACARANDÁ I FUNDO DE INVESTIMENTO IMOBILIÁRIO - RESPONSABILIDADE LIMITADA,,,,,,,,,,
2026-06-02,20:09:06,JASC11,JASC RENDA VAREJO ESSENCIAL FUNDO DE INVESTIMENTO IMOBILIÁRIO RESPONSABILIDADE LIMITADA,,,,,,,,,,
2026-06-02,20:09:06,VJFD11,JFDCAM - FUNDO DE INVESTIMENTO IMOBILIÁRIO - FII - RESPONSABILIDADE LIMITADA,,,,,,,,,,
2026-06-02,20:09:06,JFLL11,JFL LIVING FUNDO DE INVESTIMENTO IMOBILIÁRIO RESPONSABILIDADE LIMITADA,,,,,,,,,,
2026-06-02,20:09:06,JFLR11,JFL REAL ESTATE FUNDO DE INVESTIMENTO IMOBILIÁRIO,,,,,,,,,,
2026-06-02,20:09:06,JCCJ11,JHSF CAPITAL MALLS - FUNDO DE INVESTIMENTO IMOBILIÁRIO RESPONSABILIDADE LIMITADA,,,,,,,,,,
2026-06-02,20:09:06,JPPA11,JPP CAPITAL RECEBÍVEIS IMOBILIÁRIOS FUNDO DE INVESTIMENTO IMOBILIÁRIO DE  RESPONSABILIDADE LIMITADA,,,,,,,,,,
2026-06-02,20:09:06,JSAF11,JS ATIVOS FINANCEIROS FUNDO DE INVESTIMENTO IMOBILIÁRIO - RESPONSABILIDADE LIMITADA,,,,,,,,,,
2026-06-02,20:09:06,JSRE11,JS REAL ESTATE MULTIGESTÃO FUNDO DE INVESTIMENTO IMOBILIÁRIO - RESPONSABILIDADE LIMITADA,,,,,,,,,,
2026-06-02,20:09:06,JSCR11,JS RECEBÍVEIS IMOBILIÁRIOS FUNDO DE INVESTIMENTO IMOBILIÁRIO,,,,,,,,,,
2026-06-02,20:09:06,JTPR11,JT PREV FUNDO DE INVESTIMENTO IMOBILIÁRIO D. HAB,,,,,,,,,,
2026-06-02,20:09:06,BGS1,JUBARTE BGS LOGÍSTICA DE GRÃOS DESENVOLVIMENTO FII RESPONSABILIDADE LIMITADA,,,,,,,,,,
2026-06-02,20:09:06,KISU11,KILIMA FUNDO DE INVESTIMENTO EM COTAS DE FUNDOS IMOBILIÁRIOS SUNO 30 RESPONSABILIDADE LIMITADA,,,,,,,,,,
2026-06-02,20:09:06,KIVO11,KILIMA VOLKANO RECEBÍVEIS IMOBILIÁRIOS FUNDO DE INVESTIMENTO IMOBILIÁRIO - RESPONSABILIDADE LIMITADA,,,,,,,,,,
2026-06-02,20:09:06,KRES11,KINEA AQUISIÇÕES RESIDENCIAIS FUNDO DE INVESTIMENTO IMOBILIÁRIO - RESPONSABILIDADE LIMITADA,,,,,,,,,,
2026-06-02,20:09:06,KCRE11,KINEA CREDITAS FUNDO DE INVESTIMENTO IMOBILIÁRIO RESPONSABILIDADE LIMITADA,,,,,,,,,,
2026-06-02,20:09:06,KNGR11,KINEA DESENVOLVIMENTO GUARARÁ FUNDO DE INVESTIMENTO IMOBILIÁRIO RESPONSABILIDADE LIMITADA,,,,,,,,,,
2026-06-02,20:09:06,KGUJ11,KINEA DESENVOLVIMENTO GUARARÁ JARDINS FUNDO DE INVESTIMENTO IMOBILIÁRIO RESPONSABILIDADE LIMITADA,,,,,,,,,,
2026-06-02,20:09:06,KLOG11,KINEA DESENVOLVIMENTO LOGÍSTICO FUNDO DE INVESTIMENTO IMOBILIÁRIO RESPONSABILIDADE LIMITADA,,,,,,,,,,
2026-06-02,20:09:06,KDLG11,KINEA DESENVOLVIMENTO LOGÍSTICO II FUNDO DE INVESTIMENTO IMOBILIÁRIO RESPONSABILIDADE LIMITADA,,,,,,,,,,
2026-06-02,20:09:06,KFEN11,KINEA FÊNIX FUNDO DE INVESTIMENTO IMOBILIÁRIO - RESPONSABILIDADE LIMITADA,,,,,,,,,,
2026-06-02,20:09:06,KNHF11,KINEA HEDGE FUND FUNDO DE INVESTIMENTO IMOBILIÁRIO - RESPONSABILIDADE LIMITADA,,,,,,,,,,
2026-06-02,20:09:06,KNHY11,KINEA HIGH YIELD CRI FUNDO DE INVESTIMENTO IMOBILIÁRIO  RESPONSABILIDADE LIMITADA,,,,,,,,,,
2026-06-02,20:09:06,KNRE11,KINEA II REAL ESTATE EQUITY FUNDO DE INVESTIMENTO IMOBILIÁRIO RESPONSABILIDADE LIMITADA,,,,,,,,,,
2026-06-02,20:09:06,KNIP11,KINEA ÍNDICES DE PREÇOS FUNDO DE INVESTIMENTO IMOBILIÁRIO RESPONSABILIDADE LIMITADA,,,,,,,,,,
2026-06-02,20:09:06,KOIM11,KINEA OPORTUNIDADES IMOBILIÁRIAS FUNDO DE INVESTIMENTO IMOBILIÁRIO RESPONSABILIDADE LIMITADA,,,,,,,,,,
2026-06-02,20:09:06,KORE11,KINEA OPORTUNIDADES REAL ESTATE FUNDO DE INVESTIMENTO IMOBILIÁRIO - RESPONSABILIDADE LIMITADA,,,,,,,,,,
2026-06-02,20:09:06,KNPL11,KINEA PLATAFORMA RESIDENCIAL FUNDO DE INVESTIMENTO IMOBILIÁRIO RESPONSABILIDADE LIMITADA,,,,,,,,,,
2026-06-02,20:09:06,KNPR11,KINEA PREMIUM PROPERTIES FUNDO DE INVESTIMENTO IMOBILIÁRIO - RESPONSABILIDADE LIMITADA,,,,,,,,,,
2026-06-02,20:09:06,KPMR11,KINEA PRIME RESIDENCIAL I FUNDO DE INVESTIMENTO IMOBILIÁRIO DE RESPONSABILIDADE LIMITADA,,,,,,,,,,
2026-06-02,20:09:06,KPRP11,KINEA PRIME RESIDENCIAL I PVT FUNDO DE INVESTIMENTO IMOBILIÁRIO DE RESPONSABILIDADE LIMITADA,,,,,,,,,,
2026-06-02,20:09:06,KNRI11,KINEA RENDA IMOBILIÁRIA FUNDO DE INVESTIMENTO IMOBILIÁRIO RESPONSABILIDADE LIMITADA,,,,,,,,,,
2026-06-02,20:09:06,KNCR11,KINEA RENDIMENTOS IMOBILIÁRIOS FUNDO DE INVESTIMENTO IMOBILIÁRIO RESPONSABILIDADE LIMITADA,,,,,,,,,,
2026-06-02,20:09:06,KNSC11,KINEA SECURITIES FUNDO DE INVESTIMENTO IMOBILIÁRIO RESPONSABILIDADE LIMITADA,,,,,,,,,,
2026-06-02,20:09:06,KNUQ11,KINEA UNIQUE HY CDI FUNDO DE INVESTIMENTO IMOBILIÁRIO RESPONSABILIDADE LIMITADA,,,,,,,,,,
2026-06-02,20:09:06,LMAI11,LABINA MULTI ATIVOS IMOBILIÁRIOS - FUNDO DE INVESTIMENTO IMOBILIÁRIO RESPONSABILIDADE LIMITADA,,,,,,,,,,
2026-06-02,20:09:06,LPLP11,LAGO DA PEDRA - FUNDO DE INVESTIMENTO IMOBILIÁRIO,,,,,,,,,,
2026-06-02,20:09:06,SLDZ11,LAV SLDZ DESENVOLVIMENTO IMOBILIÁRIO FUNDO DE INVESTIMENTO IMOBILIÁRIO,,,,,,,,,,
2026-06-02,20:09:06,LRED11,LCP REAL ESTATE DEVELOPMENT FUNDO DE INVESTIMENTO IMOBILIÁRIO RESPONSABILIDADE LIMITADA,,,,,,,,,,
2026-06-02,20:09:06,LSOI11,LCP SPECIAL OPPORTUNITIES I FUNDO DE INVESTIMENTO IMOBILIÁRIO RESPONSABILIDADE LIMITADA,,,,,,,,,,
2026-06-02,20:09:06,LSII11,LCP SPECIAL OPPORTUNITIES II FUNDO DE INVESTIMENTO IMOBILIÁRIO RESPONSABILIDADE LIMITADA,,,,,,,,,,
2026-06-02,20:09:06,LSOP11,LCP SPECIAL OPPORTUNITIES III FUNDO DE INVESTIMENTO IMOBILIÁRIO RESPONSABILIDADE LIMITADA,,,,,,,,,,
2026-06-02,20:09:06,LRDI11,LEBLON REALTY DESENVOLVIMENTO I FUNDO DE INVESTIMENTO IMOBILIÁRIO RESPONSABILIDADE LIMITADA,,,,,,,,,,
2026-06-02,20:09:06,LASC11,LEGATUS FUNDO DE INVESTIMENTO IMOBILIÁRIO RESPONSABILIDADE LIMITADA,,,,,,,,,,
2026-06-02,20:09:06,LIFE11,LIFE CAPITAL PARTNERS FUNDO DE INVESTIMENTOS IMOBILIÁRIOS,,,,,,,,,,
2026-06-02,20:09:06,LOFT11,LOFT I FUNDO DE INVESTIMENTO IMOBILIÁRIO RESPONSABILIDADE LIMITADA,,,,,,,,,,
2026-06-02,20:09:06,MAGM11,MAG MULT FII RESPONSABILIDADE LIMITADA,,,,,,,,,,
2026-06-02,20:09:06,MAGM11,MAG MULTIESTRATÉGIA CLASSE DE INVESTIMENTO IMOBILIÁRIO RESPONSABILIDADE LIMITADA,,,,,,,,,,
2026-06-02,20:09:06,MANA11,MANATÍ CAPITAL HEDGE FUND FUNDO DE INVESTIMENTO IMOBILIÁRIO DE RESPONSABILIDADE LIMITADA,,,,,,,,,,
2026-06-02,20:09:06,MMVE11,MARESIAS FUNDO DE INVESTIMENTO IMOBILIÁRIO,,,,,,,,,,
2026-06-02,20:09:06,MCLO11,MAUÁ CAPITAL LOGÍSTICA FUNDO DE INVESTIMENTO IMOBILIÁRIO - RESPONSABILIDADE LIMITADA,,,,,,,,,,
2026-06-02,20:09:06,MCRE11,MAUÁ CAPITAL REAL ESTATE FUNDO DE INVESTIMENTO IMOBILIÁRIO RESPONSABILIDADE LIMITADA,,,,,,,,,,
2026-06-02,20:09:06,MXRF11,MAXI RENDA FUNDO DE INVESTIMENTO IMOBILIÁRIO - FII - RESPONSABILIDADE LIMITADA,,,,,,,,,,
2026-06-02,20:09:06,MCEM11,MÉRITO CEMITÉRIOS FII - FUNDO DE INVESTIMENTO IMOBILIÁRIO RESPONSABILIDADE LIMITADA,,,,,,,,,,
2026-06-02,20:09:06,MFII11,MERITO DESENVOLVIMENTO IMOBILIARIO I FII - FUNDO DE INVESTIMENTO IMOBILIARIO,,,,,,,,,,
2026-06-02,20:09:06,MIDW11,MIDWAY MALL FUNDO DE INVESTIMENTO IMOBILIÁRIO RESPONSABILIDADE LIMITADA,,,,,,,,,,
2026-06-02,20:09:06,MGRI11,MOGNO PROPERTIES FUNDO DE INVESTIMENTO IMOBILIÁRIO RESPONSABILIDADE LIMITADA,,,,,,,,,,
2026-06-02,20:09:06,MOSO11,MOSO FUNDO DE INVESTIMENTO IMOBILIÁRIO RESPONSABILIDADE LIMITADA,,,,,,,,,,
2026-06-02,20:09:06,SHOP11,MULTI SHOPPINGS FUNDO DE INVESTIMENTO IMOBILIÁRIO RESPONSABILIDADE LIMITADA,,,,,,,,,,
2026-06-02,20:09:06,MOFF11,MULTIOFFICES 2 - FUNDO DE INVESTIMENTO IMOBILIÁRIO - RESPONSABILIDADE LIMITADA,,,,,,,,,,
2026-06-02,20:09:06,NCRI11,NAVI CRÉDITO IMOBILIÁRIO FUNDO DE INVESTIMENTO IMOBILIÁRIO - RESPONSABILIDADE LIMITADA,,,,,,,,,,
2026-06-02,20:09:06,NAVT11,NAVI IMOBILIÁRIO TOTAL RETURN FUNDO DE INVESTIMENTO IMOBILIÁRIO RESPONSABILIDADE LIMITADA,,,,,,,,,,
2026-06-02,20:09:06,APTO11,NAVI RESIDENCIAL FUNDO DE INVESTIMENTO IMOBILIÁRIO - RESPONSABILIDADE  LIMITADA,,,,,,,,,,
2026-06-02,20:09:06,EAGL11,NEST EAGLE FUNDO DE INVESTIMENTO IMOBILIÁRIO DE RESPONSABILIDADE LIMITADA,,,,,,,,,,
2026-06-02,20:09:06,NEWL11,NEWPORT LOGÍSTICA FUNDO DE INVESTIMENTO IMOBILIÁRIO RESPONSABILIDADE LIMITADA,,,,,,,,,,
2026-06-02,20:09:06,NEWU11,NEWPORT RENDA URBANA FUNDO DE INVESTIMENTO IMOBILIÁRIO RESPONSABILIDADE LIMITADA,,,,,,,,,,
2026-06-02,20:09:06,NMKS11,NM KSM LOG FUNDO DE INVESTIMENTO IMOBILIÁRIO RESPONSABILIDADE LIMITADA,,,,,,,,,,
2026-06-02,20:09:06,NVIF11,NOVA I - FUNDO DE INVESTIMENTO IMOBILIÁRIO - RESPONSABILIDADE LIMITADA,,,,,,,,,,
2026-06-02,20:09:06,OCRE11,OCTO FUNDO DE INVESTIMENTO IMOBILIÁRIO RESPONSABILIDADE LIMITADA,,,,,,,,,,
2026-06-02,20:09:06,ONDA11,ONDA INVEST MULTIESTRATÉGIA FUNDO DE INVESTIMENTO IMOBILIÁRIO RESPONSABILIDADE LIMITADA,,,,,,,,,,
2026-06-02,20:09:06,ARRI11,OPEN K ATIVOS E RECEBIVEIS IMOBILIARIOS - FUNDO DE INVESTIMENTO IMOBILIARIO,,,,,,,,,,
2026-06-02,20:09:06,OBAL11,OPPORTUNITY BALASSIANO FUNDO DE INVESTIMENTO IMOBILIÁRIO -  RESPONSABILIDADE LIMITADA,,,,,,,,,,
2026-06-02,20:09:06,FTCE11,OPPORTUNITY FUNDO DE INVESTIMENTO IMOBILIÁRIO -  RESPONSABILIDADE LIMITADA,,,,,,,,,,
2026-06-02,20:09:06,OUJP11,OURINVEST JPP FUNDO DE INVESTIMENTO IMOBILIÁRIO DE  RESPONSABILIDADE LIMITADA,,,,,,,,,,
2026-06-02,20:09:06,OXRL11,OXIGÊNIO 2 FUNDO DE INVESTIMENTO IMOBILIÁRIO - RESPONSABILIDADE LIMITADA,,,,,,,,,,
2026-06-02,20:09:06,PNDL11,PANORAMA DESENVOLVIMENTO LOGÍSTICO - FUNDO DE INVESTIMENTO IMOBILIÁRIO - RESPONSABILIDADE LIMITADA,,,,,,,,,,
2026-06-02,20:09:06,PNLM11,PANORAMA LAST MILE SBC - FUNDO DE INVESTIMENTO IMOBILIÁRIO RESPONSABILIDADE LIMITADA,,,,,,,,,,
2026-06-02,20:09:06,PNPR11,PANORAMA PROPERTIES FUNDO DE INVESTIMENTO IMOBILIÁRIO,,,,,,,,,,
