data_captura,hora_captura,codigo_fundo,nome_fundo,cnpj,administrador,segmento,tipo,mandato,prazo_duracao,gestao,data_encerramento,cotistas,patrimonio_liquido
2026-06-01,23:36:51,SPAF11,SPA FUNDO DE INVESTIMENTO IMOBILIÁRIO - RESPONSABILIDADE LIMITADA,,,,,,,,,,
2026-06-01,23:36:51,LTMT11,SPECIALE BLUE REAL FUNDO DE INVESTIMENTO IMOBILIÁRIO DE RESPONSABILIDADE LIMITADA,,,,,,,,,,
2026-06-01,23:36:51,DVLP11,SPECIALE REAL ESTATE DEVELOPMENT FUNDO DE INVESTIMENTO IMOBILIÁRIO RESPONSABILIDADE LIMITADA,,,,,,,,,,
2026-06-01,23:36:51,DVLT11,SPECIALE REAL ESTATE DEVELOPMENT II FUNDO DE INVESTIMENTO  IMOBILIÁRIO DE RESPONSABILIDADE LIMITADA,,,,,,,,,,
2026-06-01,23:36:51,PMFO11,SPECIALE REAL ESTATE FUND OF FUNDS FUNDO DE INVESTIMENTO IMOBILIÁRIO DE RESPONSABILIDADE LIMITADA,,,,,,,,,,
2026-06-01,23:36:51,SPGM11,SPGM FUNDO DE INVESTIMENTO IMOBILIÁRIO,,,,,,,,,,
2026-06-01,23:36:51,SPG2,SPGM II FUNDO DE INVESTIMENTO IMOBILIÁRIO,,,,,,,,,,
2026-06-01,23:36:51,SPXM11,SPX REAL ESTATE DESENVOLVIMENTO DE GALPÕES LOGÍSTICOS FEEDER BRADESCO FII RESPONSABILIDADE LIMITADA,,,,,,,,,,
2026-06-01,23:36:51,SPXL11,SPX REAL ESTATE DESENVOLVIMENTO DE GALPÕES LOGÍSTICOS FEEDER INSTITUCIONAL FII RESP LIMITADA,,,,,,,,,,
2026-06-01,23:36:51,SPXG11,SPX REAL ESTATE DESENVOLVIMENTO DE GALPÕES LOGÍSTICOS FEEDER PRIVATE FII RESPONSABILIDADE LIMITADA,,,,,,,,,,
2026-06-01,23:36:51,SPXS11,SPX REAL ESTATE MULTIESTRATÉGIA FUNDO DE INVESTIMENTO IMOBILIÁRIO RESPONSABILIDADE LIMITADA,,,,,,,,,,
2026-06-01,23:36:51,SPXT11,SPX RENDA IMOBILIÁRIA III FUNDO DE INVESTIMENTO IMOBILIÁRIO RESPONSABILIDADE LIMITADA,,,,,,,,,,
2026-06-01,23:36:51,STRX11,STARX FUNDO DE INVESTIMENTO IMOBILIÁRIO FII RESPONSABILIDADE LIMITADA,,,,,,,,,,
2026-06-01,23:36:51,STYI11,STRIVO YIELD FUNDO DE INVESTIMENTO IMOBILIÁRIO RESPONSABILIDADE LIMITADA,,,,,,,,,,
2026-06-01,23:36:51,SURE11,SULAMÉRICA REAL ESTATE FUNDO DE INVESTIMENTO IMOBILIÁRIO DE RESPONSABILIDADE LIMITADA,,,,,,,,,,
2026-06-01,23:36:51,SNEL11,SUNO ENERGIAS LIMPAS FUNDO DE INVESTIMENTO IMOBILIÁRIO IS RESPONSABILIDADE LIMITADA,,,,,,,,,,
2026-06-01,23:36:51,SNFF11,SUNO FUNDO DE FUNDOS DE INVESTIMENTO IMOBILIÁRIO FUNDO DE INVESTIMENTO IMOBILIÁRIO RESPONSABILIDADE,,,,,,,,,,
2026-06-01,23:36:51,SNLG11,SUNO LOG FUNDO DE INVESTIMENTO IMOBILIÁRIO - RESPONSABILIDADE LIMITADA,,,,,,,,,,
2026-06-01,23:36:51,SNME11,SUNO MULTIESTRATÉGIA FUNDO DE INVESTIMENTO IMOBILIÁRIO RESPONSABILIDADE LIMITADA,,,,,,,,,,
2026-06-01,23:36:51,SNCI11,SUNO RECEBÍVEIS IMOBILIÁRIOS FUNDO DE INVESTIMENTO IMOBILIÁRIO RESPONSABILIDADE LIMITADA,,,,,,,,,,
2026-06-01,23:36:51,SPMO11,SUPREMO FUNDO DE INVESTIMENTO IMOBILIÁRIO,,,,,,,,,,
2026-06-01,23:36:51,TELD11,TELLUS DESENVOLVIMENTO LOGÍSTICO - FUNDO DE INVESTIMENTO IMOBILIÁRIO RESPONSABILIDADE LIMITADA,,,,,,,,,,
2026-06-01,23:36:51,TELM11,TELLUS MULTIESTRATÉGIA - FII FUNDO DE INVESTIMENTO IMOBILIÁRIO RESPONSABILIDADE LIMITADA,,,,,,,,,,
2026-06-01,23:36:51,TEPP11,TELLUS PROPERTIES - FUNDO DE INVESTIMENTO IMOBILIÁRIO - RESPONSABILIDADE LIMITADA,,,,,,,,,,
2026-06-01,23:36:51,TRBL11,TELLUS RIO BRAVO RENDA LOGÍSTICA FUNDO DE INVESTIMENTO IMOBILIÁRIO DE RESPONSABILIDADE LIMITADA,,,,,,,,,,
2026-06-01,23:36:51,NAUI11,TEN DESENVOLVIMENTO FUNDO DE INVESTIMENTO IMOBILIÁRIO RESPONSABILIDADE LIMITADA,,,,,,,,,,
2026-06-01,23:36:51,TRPL11,TERRAS PAULISTAS FUNDO DE  INVESTIMENTO IMOBILIÁRIO DE PERMUTAS RESPONSABILIDADE LIMITADA,,,,,,,,,,
2026-06-01,23:36:51,TVOI11,TIVIO OPPORTUNITIES IPCA - FUNDO DE INVESTIMENTO IMOBILIÁRIO - RESPONSABILIDADE LIMITADA,,,,,,,,,,
2026-06-01,23:36:51,TIOM11,TIVIO OPPORTUNITIES MASTER FUNDO DE INVESTIMENTO IMOBILIÁRIO - RESPONSABILIDADE LIMITADA,,,,,,,,,,
2026-06-01,23:36:51,TVRI11,TIVIO RENDA IMOBILIÁRIA FUNDO DE INVESTIMENTO IMOBILIÁRIO RESPONSABILIDADE LIMITADA,,,,,,,,,,
2026-06-01,23:36:51,VOTS11,TIVIO SECURITIES FUNDO DE INVESTIMENTO IMOBILIÁRIO RESPONSABILIDADE LIMITADA,,,,,,,,,,
2026-06-01,23:36:51,TJKB11,TJK RENDA IMOBILIÁRIA FUNDO DE INVESTIMENTO IMOBILIÁRIO - RESPONSABILIDADE LIMITADA,,,,,,,,,,
2026-06-01,23:36:51,TORD11,TORDESILHAS EI FUNDO DE INVESTIMENTO IMOBILIÁRIO RESPONSABILIDADE LIMITADA,,,,,,,,,,
2026-06-01,23:36:51,TSNC11,TRANSINC FUNDO DE INVESTIMENTO IMOBILIÁRIO RESPONSABILIDADE LIMITADA,,,,,,,,,,
2026-06-01,23:36:51,TCPF11,TREECORP REAL ESTATE FII - RESPONSABILIDADE LIMITADA,,,,,,,,,,
2026-06-01,23:36:51,TRXY11,TRX HEDGE FUND FUNDO DE INVESTIMENTO IMOBILIÁRIO - RESPONSABILIDADE LIMITADA,,,,,,,,,,
2026-06-01,23:36:51,TRXF11,TRX REAL ESTATE FUNDO DE INVESTIMENTO IMOBILIÁRIO RESPONSABILIDADE LIMITADA,,,,,,,,,,
2026-06-01,23:36:51,TRXB11,TRX REAL ESTATE II FUNDO DE INVESTIMENTO IMOBILIÁRIO - RESPONSABILIDADE LIMITADA,,,,,,,,,,
2026-06-01,23:36:51,MGHT11,TZDK FUNDO DE INVESTIMENTO IMOBILIÁRIORESPONSABILIDADE LIMITADA,,,,,,,,,,
2026-06-01,23:36:51,URHF11,URCA HEDGE FUND ESTRATÉGIA IMOBILIÁRIA FUNDO DE INVESTIMENTO IMOBILIÁRIO - RESPONSABILIDADE LIMITADA,,,,,,,,,,
2026-06-01,23:36:51,URPR11,URCA PRIME RENDA FUNDO DE INVESTIMENTO IMOBILIÁRIO - FII,,,,,,,,,,
2026-06-01,23:36:51,VVCO11,V2 EDIFÍCIOS CORPORATIVOS FUNDO DE INVESTIMENTO IMOBILIÁRIO RESPONSABILIDADE LIMITADA,,,,,,,,,,
2026-06-01,23:36:51,VVMR11,V2 MULTI RENDA FUNDO DE INVESTIMENTO IMOBILIÁRIO RESPONSABILIDADE LIMITADA,,,,,,,,,,
2026-06-01,23:36:51,VPPR11,V2 PRIME PROPERTIES FUNDO DE INVESTIMENTO IMOBILIÁRIO - FII - RESPONSABILIDADE LIMITADA,,,,,,,,,,
2026-06-01,23:36:51,VVDI11,V2 RECEBÍVEIS CDI FUNDO DE INVESTIMENTO IMOBILIÁRIO - RESPONSABILIDADE LIMITADA,,,,,,,,,,
2026-06-01,23:36:51,VVCR11,V2 RECEBÍVEIS IMOBILIÁRIOS FUNDO DE INVESTIMENTO IMOBILIÁRIO RESPONSABILIDADE LIMITADA,,,,,,,,,,
2026-06-01,23:36:51,VVRI11,V2 RENDA IMOBILIÁRIA FUNDO DE INVESTIMENTO IMOBILIÁRIO RESPONSABILIDADE LIMITADA,,,,,,,,,,
2026-06-01,23:36:51,VGRM11,VALORA CRI CDI FLUXO MENSAL MARÇO 26 FEEDER FUNDO DE INVESTIMENTO IMOBILIÁRIO RESPONSABILIDADE LIMIT,,,,,,,,,,
2026-06-01,23:36:51,VGIR11,VALORA CRI CDI FUNDO DE INVESTIMENTO IMOBILIÁRIO - FII RESPONSABILIDADE LIMITADA,,,,,,,,,,
2026-06-01,23:36:51,VGIP11,VALORA CRI ÍNDICE DE PREÇO FUNDO DE INVESTIMENTO IMOBILIÁRIO - FII RESPONSABILIDADE LIMITADA,,,,,,,,,,
2026-06-01,23:36:51,VGII11,VALORA CRI INFRA II FUNDO DE INVESTIMENTO IMOBILIÁRIO DE RESPONSABILIDADE LIMITADA,,,,,,,,,,
2026-06-01,23:36:51,VGHF11,VALORA HEDGE FUND FUNDO DE INVESTIMENTO IMOBILIÁRIO DE RESPONSABILIDADE LIMITADA,,,,,,,,,,
2026-06-01,23:36:51,VGRI11,VALORA RENDA IMOBILIÁRIA FUNDO DE  INVESTIMENTO IMOBILIÁRIO RESPONSABILIDADE LIMITADA,,,,,,,,,,
2026-06-01,23:36:51,BLMO11,VBI OFFICE FUND II - FUNDO DE INVESTIMENTO IMOBILIÁRIO - RESPONSABILIDADE  LIMITADA,,,,,,,,,,
2026-06-01,23:36:51,VCJR11,VECTIS JUROS REAL FUNDO DE INVESTIMENTO IMOBILIÁRIO RESPONSABILIDADE LIMITADA,,,,,,,,,,
2026-06-01,23:36:51,VLJS11,VECTOR QUELUZ LAJES CORPORATIVAS FUNDO DE INVESTIMENTO IMOBILIARIO,,,,,,,,,,
2026-06-01,23:36:51,VNSS11,VENUS 11 FUNDO DE INVESTIMENTO EM COTAS DE FUNDO DE INVESTIMENTO IMOBILIÁRIO RESPONSABILIDADE LIMITA,,,,,,,,,,
2026-06-01,23:36:51,SALI11,VÊNUS FUNDO DE INVESTIMENTO IMOBILIÁRIO RESPONSABILIDADE LIMITADA,,,,,,,,,,
2026-06-01,23:36:51,VCTH11,VERA CRUZ THREE FUNDO DE INVESTIMENTO IMOBILIÁRIO RESPONSABILIDADE LIMITADA,,,,,,,,,,
2026-06-01,23:36:51,VSLH11,VERSALHES RECEBÍVEIS IMOBILIÁRIOS FUNDO DE INVESTIMENTO IMOBILIÁRIO DE RESPONSABILIDADE LIMITADA,,,,,,,,,,
2026-06-01,23:36:51,VGRD11,VGR DESENVOLVIMENTO RESIDENCIAL FUNDO DE INVESTIMENTO IMOBILIÁRIO DE RESPONSABILIDADE LIMITADA,,,,,,,,,,
2026-06-01,23:36:51,FVPQ11,VIA PARQUE SHOPPING FUNDO DE INVESTIMENTO IMOBILIÁRIO DE RESPONSABILIDADE LIMITADA,,,,,,,,,,
2026-06-01,23:36:51,VIDS11,VIC DESENVOLVIMENTO - VINTAGE 20/21 FUNDO DE INVESTIMENTO IMOBILIÁRIO - RESPONSABILIDADE LIMITADA,,,,,,,,,,
2026-06-01,23:36:51,VDSV11,VIC DESENVOLVIMENTO VINTAGE 22/23 FUNDO DE INVESTIMENTO IMOBILIÁRIO,,,,,,,,,,
2026-06-01,23:36:51,VCRI11,VINCI CREDIT SECURITIES FUNDO DE INVESTIMENTO IMOBILIÁRIO - RESPONSABILIDADE LIMITADA,,,,,,,,,,
2026-06-01,23:36:51,VIUR11,VINCI IMÓVEIS URBANOS FUNDO DE INVESTIMENTO IMOBILIÁRIO - RESPONSABILIDADE  LIMITADA,,,,,,,,,,
2026-06-01,23:36:51,VILG11,VINCI LOGÍSTICA FUNDO DE INVESTIMENTO IMOBILIÁRIO - RESPONSABILIDADE LIMITADA,,,,,,,,,,
2026-06-01,23:36:51,VIMO11,VINCI MOZAK RESIDENCIAL II FUNDO DE INVESTIMENTO IMOBILIÁRIO - RESPONSABILIDADE LIMITADA,,,,,,,,,,
2026-06-01,23:36:51,VINO11,VINCI OFFICES FUNDO DE INVESTIMENTO IMOBILIÁRIO - RESPONSABILIDADE LIMITADA,,,,,,,,,,
2026-06-01,23:36:51,VIOL11,VINCI OPORTUNIDADES LOGÍSTICAS FII RESPONSABILIDADE LIMITADA,,,,,,,,,,
2026-06-01,23:36:51,VISC11,VINCI SHOPPING CENTERS FUNDO DE INVESTIMENTO IMOBILIÁRIO - RESPONSABILIDADE LIMITADA,,,,,,,,,,
2026-06-01,23:36:51,SPDE11,WHG FINVEST SP REALTY FUNDO DE INVESTIMENTO IMOBILIÁRIO - RESPONSABILIDADE LIMITADA,,,,,,,,,,
2026-06-01,23:36:51,WHGR11,WHG REAL ESTATE FUNDO DE INVESTIMENTO IMOBILIÁRIO - FII RESPONSABILIDADE LIMITADA,,,,,,,,,,
2026-06-01,23:36:51,XLPR11,XLPR FUNDO DE INVESTIMENTO IMOBILIÁRIO - FII - RESPONSABILIDADE LIMITADA,,,,,,,,,,
2026-06-01,23:36:51,XPCM11,XP CORPORATE MACAÉ FUNDO DE INVESTIMENTO IMOBILIÁRIO DE RESPONSABILIDADE LIMITADA,,,,,,,,,,
2026-06-01,23:36:51,XPCI11,XP CRÉDITO IMOBILIÁRIO - FUNDO DE INVESTIMENTO IMOBILIÁRIO,,,,,,,,,,
2026-06-01,23:36:51,XPLG11,XP LOG FUNDO DE INVESTIMENTO IMOBILIÁRIO RESPONSABILIDADE LIMITADA - FII,,,,,,,,,,
2026-06-01,23:36:51,XPML11,XP MALLS FUNDO DE INVESTIMENTO IMOBILIÁRIO FII,,,,,,,,,,
2026-06-01,23:36:51,XPSF11,XP SELECTION FUNDO DE FUNDOS DE INVESTIMENTO IMOBILIÁRIO - FII,,,,,,,,,,
2026-06-01,23:36:51,YUFI11,YUCA FUNDO DE INVESTIMENTO IMOBILIÁRIO RESPONSABILIDADE LIMITADA,,,,,,,,,,
2026-06-01,23:36:51,ZAGH11,ZAGROS MULTIESTRATÉGIA FUNDO DE INVESTIMENTO IMOBILIÁRIO RESPONSABILIDADE LIMITADA,,,,,,,,,,
2026-06-01,23:36:51,GGRC11,ZAGROS RENDA IMOBILIÁRIA FUNDO DE INVESTIMENTO IMOBILIÁRIO RESPONSABILIDADE LIMITADA,,,,,,,,,,
2026-06-01,23:36:51,ZAVC11,ZAVIT CRÉDITO IMOBILIÁRIO FUNDO DE INVESTIMENTO IMOBILIÁRIO - RESPONSABILIDADE LIMITADA,,,,,,,,,,
2026-06-01,23:36:51,ZAVI11,ZAVIT REAL ESTATE FUND - FUNDO DE INVESTIMENTO IMOBILIÁRIO - RESPONSABILIDADE LIMITADA,,,,,,,,,,
2026-06-01,23:36:51,ZIFI11,ZION CAPITAL FUNDO DE INVESTIMENTO IMOBILIÁRIO - FII RESPONSABILIDADE LIMITADA,,,,,,,,,,
2026-06-02,20:09:06,ADSH11,AD SHOPPING FUNDO DE INVESTIMENTO IMOBILIÁRIO RESPONSABILIDADE LIMITADA,,,,,,,,,,
2026-06-02,20:09:06,AFHI11,AF INVEST CRI FUNDO DE INVESTIMENTO IMOBILIÁRIO RECEBÍVEIS IMOBILIÁRIOS RESPONSABILIDADE LIMITADA,,,,,,,,,,
2026-06-02,20:09:06,AFHF11,AF INVEST REAL ESTATE MULTIESTRATÉGIA FUNDO DE INVESTIMENTO IMOBILIÁRIO - RESPONSABILIDADE LIMITADA,,,,,,,,,,
2026-06-02,20:09:06,ATWN11,AIRPORT TOWN FUNDO DE INVESTIMENTO IMOBILIARIO - FII,,,,,,,,,,
2026-06-02,20:09:06,AJFI11,AJ MALLS FUNDO DE INVESTIMENTO IMOBILIÁRIO RESPONSABILIDADE LIMITADA,,,,,,,,,,
2026-06-02,20:09:06,ALZC11,ALIANZA CRÉDITO IMOBILIÁRIO FUNDO DE INVESTIMENTO IMOBILIÁRIO RESPONSABILIDADE LIMITADA,,,,,,,,,,
2026-06-02,20:09:06,MTOF11,ALIANZA MULTIOFFICES - FUNDO DE INVESTIMENTO IMOBILIÁRIO - RESPONSABILIDADE LIMITADA,,,,,,,,,,
2026-06-02,20:09:06,ALZR11,ALIANZA TRUST RENDA IMOBILIÁRIA - FUNDO DE INVESTIMENTO IMOBILIÁRIO RESPONSABILIDADE LIMITADA,,,,,,,,,,
2026-06-02,20:09:06,AURB11,ALIANZA URBAN HUB RENDA FUNDO DE INVESTIMENTO IMOBILIÁRIO RESPONSABILIDADE LIMITADA,,,,,,,,,,
2026-06-02,20:09:06,APXM11,APEX MALLS FUNDO DE INVESTIMENTO IMOBILIÁRIO RESPONSABILIDADE LIMITADA,,,,,,,,,,
2026-06-02,20:09:06,APXU11,APEX URB FUNDO DE INVESTIMENTO IMOBILIÁRIO RESPONSABILIDADE LIMITADA,,,,,,,,,,
2026-06-02,20:09:06,AIEC11,ARCH EDIFÍCIOS CORPORATIVOS FUNDO DE INVESTIMENTO IMOBILIÁRIO - RESPONSABILIDADE LIMITADA,,,,,,,,,,
2026-06-02,20:09:06,AVUR11,ARCH VANGUARDA UNIDADES RESIDENCIAIS FUNDO DE INVESTIMENTO IMOBILIÁRIO RESPONSABILIDADE LIMITADA,,,,,,,,,,
2026-06-02,20:09:06,AROA11,AROEIRA 333 RENDA LOGÍSTICA FUNDO DE INVESTIMENTO IMOBILIÁRIO RESPONSABILIDADE LIMITADA,,,,,,,,,,
2026-06-02,20:09:06,EIRA11,AROEIRA FUNDO DE INVESTIMENTO IMOBILIÁRIO - RESPONSABILIDADE LIMITADA,,,,,,,,,,
2026-06-02,20:09:06,ARTE11,ÁRTEMIS FUNDO DE INVESTIMENTO IMOBILIÁRIO RESPONSABILIDADE LIMITADA,,,,,,,,,,
2026-06-02,20:09:06,ARXD11,ARX DOVER RECEBÍVEIS FUNDO DE INVESTIMENTO IMOBILIÁRIO DE RESPONSABILIDADE LIMITADA,,,,,,,,,,
2026-06-02,20:09:06,AZPE11,AZ QUEST PANORAMA CRÉDITO ESTRUTURADO FUNDO DE INVESTIMENTO IMOBILIÁRIO DE RESPONSABILIDADE LIMITADA,,,,,,,,,,
2026-06-02,20:09:06,AZPL11,AZ QUEST PANORAMA LOGÍSTICA FUNDO DE INVESTIMENTO IMOBILIÁRIO - RESPONSABILIDADE LIMITADA,,,,,,,,,,
2026-06-02,20:09:06,AZSG11,AZ SOLARGRID RENDA  SOLAR FUNDO DE INVESTIMENTO IMOBILIÁRIO RESPONSABILIDADE  LIMITADA,,,,,,,,,,
2026-06-02,20:09:06,CEBB11,BALTIMORE FUNDO DE INVESTIMENTO IMOBILIÁRIO DE RESPONSABILIDADE LIMITADA,,,,,,,,,,
2026-06-02,20:09:06,BCRI11,BANESTES RECEBÍVEIS  IMOBILIÁRIOS FUNDO DE INVESTIMENTO IMOBILIÁRIO - FII - RESPONSABILIDADE LIMITAD,,,,,,,,,,
2026-06-02,20:09:06,BNFS11,BANRISUL NOVAS FRONTEIRAS FUNDO DE INVESTIMENTO IMOBILIARIO - RESPONSABILIDADE LIMITADA,,,,,,,,,,
2026-06-02,20:09:06,BTML11,BARRA MALLS FUNDO DE INVESTIMENTO IMOBILIÁRIO,,,,,,,,,,
2026-06-02,20:09:06,BZEL11,BARZEL CD1 FUNDO DE INVESTIMENTO IMOBILIARIO RESPONSABILIDADE LIMITADA,,,,,,,,,,
2026-06-02,20:09:06,BPDR11,BASÍLICA PARTNERS GDR FUNDO DE INVESTIMENTO IMOBILIÁRIO FII RESPONSABILIDADE LIMITADA,,,,,,,,,,
2026-06-02,20:09:06,BPLC11,BASÍLICA PARTNERS LED CORPORATE FUNDO DE INVESTIMENTO IMOBILIÁRIO FII,,,,,,,,,,
2026-06-02,20:09:06,BPMW11,BASÍLICA PARTNERS MEDWELL FUNDO DE INVESTIMENTO IMOBILIÁRIO FII RESPONSABILIDADE LIMITADA,,,,,,,,,,
2026-06-02,20:09:06,BBFO11,BB FUNDO DE FUNDOS - FUNDO DE INVESTIMENTO IMOBILIÁRIO RESPONSABILIDADE LIMITADA,,,,,,,,,,
2026-06-02,20:09:06,BBIG11,BB PREMIUM MALLS FUNDO DE INVESTIMENTO IMOBILIÁRIO DE RESPONSABILIDADE LIMITADA,,,,,,,,,,
2026-06-02,20:09:06,BBRC11,BB RENDA CORPORATIVA FUNDO DE INVESTIMENTO IMOBILIÁRIO RESPONSABILIDADE LIMITADA,,,,,,,,,,
2026-06-02,20:09:06,BINR11,BE IN RIO FUNDO DE INVESTIMENTO IMOBILIÁRIO - RESPONSABILIDADE LIMITADA,,,,,,,,,,
2026-06-02,20:09:06,BFCC11,BFC FUNDO DE INVESTIMENTO IMOBILIÁRIO,,,,,,,,,,
2026-06-02,20:09:06,BGRB11,BGR B32 FUNDO DE INVESTIMENTO IMOBILIÁRIO,,,,,,,,,,
2026-06-02,20:09:06,BGRJ11,BGR CIDADE JARDIM FUNDO DE INVESTIMENTO IMOBILIÁRIO - RESPONSABILIDADE LIMITADA,,,,,,,,,,
2026-06-02,20:09:06,BLOG11,BLUECAP LOG FUNDO DE INVESTIMENTO IMOBILIÁRIO,,,,,,,,,,
2026-06-02,20:09:06,BLMG11,BLUEMACAW FUNDO DE INVESTIMENTO IMOBILIÁRIO RESPONSABILIDADE LIMITADA,,,,,,,,,,
2026-06-02,20:09:06,BMLC11,BM BRASCAN LAJES CORPORATIVAS FUNDO DE INVESTIMENTO IMOBILIÁRIO RESPONSABILIDADE LIMITADA,,,,,,,,,,
2026-06-02,20:09:06,BRSE11,BR7 SENADO FUNDO DE INVESTIMENTO IMOBILIÁRIO,,,,,,,,,,
2026-06-02,20:09:06,BCIA11,BRADESCO CARTEIRA IMOBILIÁRIA ATIVA - FUNDO DE FUNDOS DE INVESTIMENTO IMOBILIÁRIO - FII,,,,,,,,,,
2026-06-02,20:09:06,BVAR11,BRASIL VAREJO FUNDO DE INVESTIMENTO IMOBILIÁRIO RESPONSABILIDADE LIMITADA,,,,,,,,,,
2026-06-02,20:09:06,CARE11,BRAZILIAN GRAVEYARD AND DEATH CARE SERVICES FUNDO DE INVESTIMENTO IMOBILIÁRIO - FII RESP LIMITADA,,,,,,,,,,
2026-06-02,20:09:06,FATN11,BRC RENDA CORPORATIVA FUNDO DE INVESTIMENTO IMOBILIÁRIO - RESPONSABILIDADE LIMITADA,,,,,,,,,,
2026-06-02,20:09:06,RTEL11,BRC-II FUNDO DE INVESTIMENTO IMOBILIÁRIO - RESPONSABILIDADE LIMITADA,,,,,,,,,,
2026-06-02,20:09:06,BRCT11,BRC-III DESENVOLVIMENTO FUNDO DE INVESTIMENTO IMOBILIÁRIO - RESPONSABILIDADE LIMITADA,,,,,,,,,,
2026-06-02,20:09:06,BRCD11,BRESCO DESENVOLVIMENTO FUNDO DE INVESTIMENTO IMOBILIÁRIO RESPONSABILIDADE LIMITADA,,,,,,,,,,
2026-06-02,20:09:06,BRCO11,BRESCO LOGÍSTICA FUNDO DE INVESTIMENTO IMOBILIÁRIO RESPONSABILIDADE LIMITADA,,,,,,,,,,
2026-06-02,20:09:06,BICE11,BRIO CRÉDITO ESTRUTURADO - FUNDO DE INVESTIMENTO IMOBILIÁRIO - RESPONSABILIDADE LIMITADA,,,,,,,,,,
2026-06-02,20:09:06,BIME11,BRIO MULTIESTRATÉGIA - FUNDO DE INVESTIMENTO IMOBILIÁRIO RESPONSABILIDADE LIMITADA,,,,,,,,,,
2026-06-02,20:09:06,BRIM11,BRIO REAL ESTATE II - FUNDO DE INVESTIMENTO IMOBILIÁRIO - RESPONSABILIDADE LIMITADA,,,,,,,,,,
2026-06-02,20:09:06,BRIP11,BRIO REAL ESTATE III - FUNDO DE INVESTIMENTO IMOBILIÁRIO - RESPONSABILIDADE LIMITADA,,,,,,,,,,
2026-06-02,20:09:06,BIPD11,BRIO REAL ESTATE IV - FUNDO DE INVESTIMENTO IMOBILIÁRIO - RESPONSABILIDADE LIMITADA,,,,,,,,,,
2026-06-02,20:09:06,BIPE11,BRIO REAL ESTATE V - FUNDO DE INVESTIMENTO IMOBILIÁRIO - RESPONSABILIDADE LIMITADA,,,,,,,,,,
2026-06-02,20:09:06,MCMV11,BRM MINHA CASA MINHA VIDA III FUNDO DE INVESTIMENTO IMOBILIÁRIO RESPONSABILIDADE LIMITADA,,,,,,,,,,
2026-06-02,20:09:06,BROF11,BRPR CORPORATE OFFICES FUNDO DE INVESTIMENTO IMOBILIÁRIO RESPONSABILIDADE LIMITADA,,,,,,,,,,
2026-06-02,20:09:06,BETW11,BRPR E-TOWER FUNDO DE INVESTIMENTO IMOBILIÁRIO,,,,,,,,,,
2026-06-02,20:09:06,LLAO11,BS2 ALLINVESTMENTS FUNDO DE INVESTIMENTO IMOBILIÁRIO,,,,,,,,,,
2026-06-02,20:09:06,BTHR11,BTG HOSPITALIDADE RETORNO TOTAL FUNDO DE INVESTIMENTO IMOBILIÁRIO  RESPONSABILIDADE LIMITADA,,,,,,,,,,
2026-06-02,20:09:06,BTHI11,BTG HOTÉIS FUNDO DE INVESTIMENTO IMOBILIÁRIO RESPONSABILIDADE LIMITADA,,,,,,,,,,
2026-06-02,20:09:06,BRCR11,BTG PACTUAL CORPORATE OFFICE FUND - FUNDO DE INVESTIMENTO IMOBILIÁRIO RESPONSABILIDADE LIMITADA,,,,,,,,,,
2026-06-02,20:09:06,BTCI11,BTG PACTUAL CRÉDITO IMOBILIÁRIO - FUNDO DE CRI - FI IMOBILIÁRIO RESPONSABILIDADE LIMITADA,,,,,,,,,,
2026-06-02,20:09:06,BTLG11,BTG PACTUAL LOGÍSTICA FUNDO DE INVESTIMENTO IMOBILIÁRIO RESPONSABILIDADE LIMITADA,,,,,,,,,,
2026-06-02,20:09:06,BTHF11,BTG PACTUAL REAL ESTATE HEDGE FUND FII - FUNDO DE INVESTIMENTO IMOBILIÁRIO RESPONSABILIDADE LIMITADA,,,,,,,,,,
2026-06-02,20:09:06,HSRE11,BTG PACTUAL RENDA URBANA FUNDO DE INVESTIMENTO IMOBILIÁRIO RESPONSABILIDADE LIMITADA,,,,,,,,,,
2026-06-02,20:09:06,BPML11,BTG PACTUAL SHOPPINGS FUNDO DE INVESTIMENTO IMOBILIÁRIO RESPONSABILIDADE LIMITADA,,,,,,,,,,
2026-06-02,20:09:06,BTYU11,BTG PACTUAL YOU INC. DESENVOLVIMENTO IMOBILIÁRIO - FUNDO DE INVESTIMENTO IMOBILIÁRIO RESPONSABILIDAD,,,,,,,,,,
2026-06-02,20:09:06,BTWR11,BTOWERS FUNDO DE INVESTIMENTO IMOBILIÁRIO RESPONSABILIDADE LIMITADA,,,,,,,,,,
2026-06-02,20:09:06,BTSI11,BTSP II FUNDO DE INVESTIMENTO IMOBILIÁRIO FII RESPONSABILIDADE LIMITADA,,,,,,,,,,
2026-06-02,20:09:06,CXCO11,CAIXA IMÓVEIS CORPORATIVOS FUNDO DE INVESTIMENTO IMOBILIÁRIO - RESPONSABILIDADE LIMITADA,,,,,,,,,,
2026-06-02,20:09:06,CRFF11,CAIXA RIO BRAVO FUNDO DE FUNDOS DE INVESTIMENTO IMOBILIÁRIO II RESPONSABILIDADE LIMITADA,,,,,,,,,,
2026-06-02,20:09:06,CXRI11,CAIXA RIO BRAVO FUNDO DE FUNDOS DE INVESTIMENTO IMOBILIARIO RESPONSABILIDADE LIMITADA,,,,,,,,,,
2026-06-02,20:09:06,CCME11,CANUMA CAPITAL MULTIESTRATÉGIA FUNDO DE INVESTIMENTO IMOBILIÁRIO RESPONSABILIDADE LIMITADA,,,,,,,,,,
2026-06-02,20:09:06,CCVA11,CANUMA CAPITAL RENDA VAREJO FUNDO DE INVESTIMENTO IMOBILIÁRIO RESPONSABILIDADE LIMITADA,,,,,,,,,,
2026-06-02,20:09:06,KONG11,CAPITANIA ARTON JARDIM PAULISTANO FUNDO DE INVESTIMENTO IMOBILIÁRIO RESPONSABILIDADE LIMITADA,,,,,,,,,,
2026-06-02,20:09:06,CPUR11,CAPITÂNIA HBC RENDA URBANA FUNDO DE INVESTIMENTO IMOBILIÁRIO RESPONSABILIDADE  LIMITADA,,,,,,,,,,
2026-06-02,20:09:06,CPLG11,CAPITÂNIA LOGÍSTICA FUNDO DE INVESTIMENTO IMOBILIÁRIO - RESPONSABILIDADE LIMITADA,,,,,,,,,,
2026-06-02,20:09:06,CPOF11,CAPITÂNIA OFFICE FII - FUNDO DE INVESTIMENTO IMOBILIÁRIO,,,,,,,,,,
2026-06-02,20:09:06,CPTS11,CAPITÂNIA SECURITIES II FUNDO DE INVESTIMENTO IMOBILIÁRIO RESPONSABILIDADE LIMITADA,,,,,,,,,,
2026-06-02,20:09:06,CPSH11,CAPITÂNIA SHOPPINGS FUNDO DE INVESTIMENTO IMOBILIÁRIO - RESPONSABILIDADE LIMITADA,,,,,,,,,,
2026-06-02,20:09:06,CACR11,CARTESIA RECEBÍVEIS IMOBILIÁRIOS - FUNDO DE INVESTIMENTO IMOBILIÁRIO DE RESPONSABILIDADE LIMITADA,,,,,,,,,,
2026-06-02,20:09:06,CBOP11,CASTELLO BRANCO OFFICE PARK - FUNDO DE INVESTIMENTO IMOBILIÁRIO - RESPONSABILIDADE LIMITADA,,,,,,,,,,
2026-06-02,20:09:06,BLCA11,CATUAÍ VBI TRIPLE A FUNDO DE INVESTIMENTO IMOBILIÁRIO - RESPONSABILIDADE LIMITADA,,,,,,,,,,
2026-06-02,20:09:06,CVFL11,CATUAÍ VISTA FL FUNDO DE INVESTIMENTO IMOBILIÁRIO DE RESPONSABILIDADE LIMITADA,,,,,,,,,,
2026-06-02,20:09:06,CNES11,CENESP FUNDO DE INVESTIMENTO IMOBILIÁRIO RESPONSABILIDADE LIMITADA,,,,,,,,,,
2026-06-02,20:09:06,CDHY11,CENTRAL REAL ESTATE HIGH YIELD DEBT FUNDO DE INVESTIMENTO IMOBILIÁRIO RESPONSABILIDADE LIMITADA,,,,,,,,,,
2026-06-02,20:09:06,CTXT11,CENTRO TÊXTIL INTERNACIONAL FUNDO DE INVESTIMENTO IMOBILIÁRIO DE RESPONSABILIDADE LIMITADA,,,,,,,,,,
2026-06-02,20:09:06,CENU11,CENU - FUNDO DE INVESTIMENTO IMOBILIÁRIO RESPONSABILIDADE LIMITADA,,,,,,,,,,
2026-06-02,20:09:06,CFII11,CF3  FUNDO DE INVESTIMENTO IMOBILIÁRIO,,,,,,,,,,
2026-06-02,20:09:06,CFHF11,CF4 FUNDO DE INVESTIMENTO IMOBILIÁRIO DE RESPONSABILIDADE LIMITADA,,,,,,,,,,
2026-06-02,20:09:06,CJCT11,CIDADE JARDIM CONTINENTAL TOWER FUNDO DE INVESTIMENTO IMOBILIÁRIO DE RESPONSABILIDADE LIMITADA,,,,,,,,,,
2026-06-02,20:09:06,CLSM11,CITLOG SUL DE MINAS FUNDO DE INVESTIMENTO IMOBILIÁRIO DE RESPONSABILIDADE LIMITADA,,,,,,,,,,
2026-06-02,20:09:06,CIXM11,CIX MUIRAQUITAN FUNDO DE INVESTIMENTO IMOBILIÁRIO RESPONSABILIDADE LIMITADA,,,,,,,,,,
2026-06-02,20:09:06,CIXF11,CIX RETROFIT FUNDO DE INVESTIMENTO IMOBILIÁRIO RESPONSABILIDADE LIMITADA,,,,,,,,,,
2026-06-02,20:09:06,PDBM11,CLASSE A DE COTAS DO SINAL RJDI - BRASIL MALLS FUNDO DE INVESTIMENTO IMOBILIÁRIO RESP LIMITADA,,,,,,,,,,
2026-06-02,20:09:06,CLIN11,CLAVE ÍNDICES DE PREÇOS FUNDO DE INVESTIMENTO IMOBILIÁRIO RESPONSABILIDADE LIMITADA,,,,,,,,,,
2026-06-02,20:09:06,CSMC11,COSMIC FUNDO DE INVESTIMENTO IMOBILIÁRIO DE RESPONSABILIDADE LIMITADA,,,,,,,,,,
2026-06-02,20:09:06,RENV11,CPV ENERGIA FUNDO DE INVESTIMENTO IMOBILIÁRIO RESPONSABILIDADE LIMITADA,,,,,,,,,,
2026-06-02,20:09:06,IBCR11,CRI INTEGRAL BREI FUNDO DE INVESTIMENTO IMOBILIÁRIO RESPONSABILIDADE LIMITADA,,,,,,,,,,
2026-06-02,20:09:06,CVPR11,CVPAR FUNDO DE INVESTIMENTO IMOBILIÁRIO DE CRI RESPONSABILIDADE LIMITADA,,,,,,,,,,
2026-06-02,20:09:06,CYCR11,CYRELA CRÉDITO - FUNDO DE INVESTIMENTO IMOBILIÁRIO - RESPONSABILIDADE LIMITADA,,,,,,,,,,
2026-06-02,20:09:06,CYLD11,CYRELA DESENVOLVIMENTO LOGÍSTICO FUNDO DE INVESTIMENTO IMOBILIÁRIO RESPONSABILIDADE LIMITADA,,,,,,,,,,
2026-06-02,20:09:06,DAMA11,DAMA FUNDO DE INVESTIMENTO IMOBILIÁRIO RESPONSABILIDADE LIMITADA,,,,,,,,,,
2026-06-02,20:09:06,DAYM11,DAYCOVAL REAL ESTATE MULTIESTRATÉGIA FUNDO DE INVESTIMENTO IMOBILIÁRIO DE RESPONSABILIDADE LIMITADA,,,,,,,,,,
2026-06-02,20:09:06,ASRF11,DAYCOVAL RETROFITS I FUNDO DE INVESTIMENTO IMOBILIÁRIO RESPONSABILIDADE LIMITADA,,,,,,,,,,
2026-06-02,20:09:06,DLMT11,DEL MONTE AJAX FUNDO DE INVESTIMENTO IMOBILIÁRIO - FII DE RESPONSABILIDADE LIMITADA,,,,,,,,,,
2026-06-02,20:09:06,DPRO11,DEVANT PROPERTIES FUNDO DE INVESTIMENTO IMOBILIÁRIO DE RESPONSABILIDADE LIMITADA,,,,,,,,,,
2026-06-02,20:09:06,DEVA11,DEVANT RECEBÍVEIS IMOBILIÁRIOS FUNDO DE INVESTIMENTO IMOBILIÁRIO RESPONSABILIDADE LIMITADA,,,,,,,,,,
2026-06-02,20:09:06,DAMT11,DIAMANTE FUNDO DE INVESTIMENTO IMOBILIÁRIO RESPONSABILIDADE LIMITADA,,,,,,,,,,
2026-06-02,20:09:06,DOVL11,DOVEL FUNDO DE INVESTIMENTO IMOBILIÁRIO - RESPONSABILIDADE LIMITADA,,,,,,,,,,
2026-06-02,20:09:06,EDGE11,EDGE FUNDO DE INVESTIMENTO IMOBILIÁRIO DE RESPONSABILIDADE LIMITADA,,,,,,,,,,
2026-06-02,20:09:06,EMET11,EMET MULTIESTRATÉGIA FUNDO DE INVESTIMENTO I MOBILIÁRIO RESPONSABILIDADE LIMITADA,,,,,,,,,,
2026-06-02,20:09:06,EGYR11,ENERGY RESORT FUNDO DE INVESTIMENTO IMOBILIÁRIO,,,,,,,,,,
2026-06-02,20:09:06,EQIR11,EQI RECEBÍVEIS IMOBILIÁRIOS FUNDO DE INVESTIMENTO IMOBILIÁRIO RESPONSABILIDADE LIMITADA,,,,,,,,,,
2026-06-02,20:09:06,ERCR11,ESTOQUE RESIDENCIAL E COMERCIAL RIO DE JANEIRO FUNDO DE INVESTIMENTO IMOBILIÁRIO - RESP LIMITADA,,,,,,,,,,
2026-06-02,20:09:06,ERPA11,EUROPA 105  FUNDO DE INVESTIMENTO IMOBILIÁRIO - RESPONSABILIDADE LIMITADA,,,,,,,,,,
2026-06-02,20:09:06,KEVE11,EVEN II KINEA FUNDO DE INVESTIMENTO IMOBILIÁRIO RESPONSABILIDADE LIMITADA,,,,,,,,,,
2026-06-02,20:09:06,EXES11,EXES FUNDO DE INVESTIMENTO IMOBILIÁRIO RESPONSABILIDADE LIMITADA,,,,,,,,,,
2026-06-02,20:09:06,FLCR11,FARIA LIMA CAPITAL RECEBÍVEIS IMOBILIÁRIOS I - FUNDO DE INVESTIMENTO IMOBILIÁRIO RESPONSABILIDADE LI,,,,,,,,,,
2026-06-02,20:09:06,FTRR11,FATOR RECEBÍVEIS IMOBILIÁRIOS FUNDO DE INVESTIMENTO IMOBILIÁRIO DE RESPONSABILIDADE LIMITADA,,,,,,,,,,
2026-06-02,20:09:06,VRTA11,FATOR VERITA FUNDO DE INVESTIMENTO IMOBILIARIO,,,,,,,,,,
2026-06-02,20:09:06,VRTM11,FATOR VERITÀ MULTIESTRATÉGIA FUNDO DE INVESTIMENTO IMOBILIÁRIO,,,,,,,,,,
2026-06-02,20:09:06,FTRE11,FIGTREE RENDA EDUCACIONAL FUNDO DE INVESTIMENTO IMOBILIÁRIO,,,,,,,,,,
2026-06-02,20:09:06,FLMA11,FII CONTINENTAL SQUARE FARIA LIMA - RESPONSABILIDADE LIMITADA,,,,,,,,,,
2026-06-02,20:09:06,EGDB11,FII DE DESENVOLVIMENTO DE ESCRITÓRIOS BOUTIQUE RESPONSABILIDADE LIMITADA,,,,,,,,,,
2026-06-02,20:09:06,ELDO11,FII ELDORADO FUNDO DE INVESTIMENTO IMOBILIÁRIO - RESPONSABILIDADE LIMITADA,,,,,,,,,,
2026-06-02,20:09:06,EURO11,FII EUROPAR RESPONSABILIDADE LIMITADA,,,,,,,,,,
2026-06-02,20:09:06,HYPI11,FII HIRE PROPERTIES I - FUNDO DE INVESTIMENTO IMOBILIÁRIO,,,,,,,,,,
2026-06-02,20:09:06,HRES11,FII HIRE RESIDENCIAL I - FUNDO DE INVESTIMENTO IMOBILIÁRIO,,,,,,,,,,
2026-06-02,20:09:06,FIIB11,FII INDUSTRIAL DO BRASIL RESPONSABILIDADE LIMITADA,,,,,,,,,,
2026-06-02,20:09:06,FMOF11,FII MEMORIAL OFFICE RESPONSABILIDADE LIMITADA,,,,,,,,,,
2026-06-02,20:09:06,OPTM11,FII PATRIMONIAL IV,,,,,,,,,,
2026-06-02,20:09:06,FRBC11,FII RBC II FUNDO DE FUNDOS - RESPONSABILIDADE LIMITADA,,,,,,,,,,
2026-06-02,20:09:06,ALMI11,FII TORRE ALMIRANTE,,,,,,,,,,
2026-06-02,20:09:06,FLNR11,FLORIANO FUNDO DE INVESTIMENTO IMOBILIÁRIO,,,,,,,,,,
