data_captura,hora_captura,codigo_fundo,nome_fundo,cnpj,administrador,segmento,tipo,mandato,prazo_duracao,gestao,data_encerramento,cotistas,patrimonio_liquido
2026-06-01,23:36:51,ADSH11,AD SHOPPING FUNDO DE INVESTIMENTO IMOBILIÁRIO RESPONSABILIDADE LIMITADA,,,,,,,,,,
2026-06-01,23:36:51,AFHI11,AF INVEST CRI FUNDO DE INVESTIMENTO IMOBILIÁRIO RECEBÍVEIS IMOBILIÁRIOS RESPONSABILIDADE LIMITADA,,,,,,,,,,
2026-06-01,23:36:51,AFHF11,AF INVEST REAL ESTATE MULTIESTRATÉGIA FUNDO DE INVESTIMENTO IMOBILIÁRIO - RESPONSABILIDADE LIMITADA,,,,,,,,,,
2026-06-01,23:36:51,ATWN11,AIRPORT TOWN FUNDO DE INVESTIMENTO IMOBILIARIO - FII,,,,,,,,,,
2026-06-01,23:36:51,AJFI11,AJ MALLS FUNDO DE INVESTIMENTO IMOBILIÁRIO RESPONSABILIDADE LIMITADA,,,,,,,,,,
2026-06-01,23:36:51,ALZC11,ALIANZA CRÉDITO IMOBILIÁRIO FUNDO DE INVESTIMENTO IMOBILIÁRIO RESPONSABILIDADE LIMITADA,,,,,,,,,,
2026-06-01,23:36:51,MTOF11,ALIANZA MULTIOFFICES - FUNDO DE INVESTIMENTO IMOBILIÁRIO - RESPONSABILIDADE LIMITADA,,,,,,,,,,
2026-06-01,23:36:51,ALZR11,ALIANZA TRUST RENDA IMOBILIÁRIA - FUNDO DE INVESTIMENTO IMOBILIÁRIO RESPONSABILIDADE LIMITADA,,,,,,,,,,
2026-06-01,23:36:51,AURB11,ALIANZA URBAN HUB RENDA FUNDO DE INVESTIMENTO IMOBILIÁRIO RESPONSABILIDADE LIMITADA,,,,,,,,,,
2026-06-01,23:36:51,APXM11,APEX MALLS FUNDO DE INVESTIMENTO IMOBILIÁRIO RESPONSABILIDADE LIMITADA,,,,,,,,,,
2026-06-01,23:36:51,APXU11,APEX URB FUNDO DE INVESTIMENTO IMOBILIÁRIO RESPONSABILIDADE LIMITADA,,,,,,,,,,
2026-06-01,23:36:51,AIEC11,ARCH EDIFÍCIOS CORPORATIVOS FUNDO DE INVESTIMENTO IMOBILIÁRIO - RESPONSABILIDADE LIMITADA,,,,,,,,,,
2026-06-01,23:36:51,AVUR11,ARCH VANGUARDA UNIDADES RESIDENCIAIS FUNDO DE INVESTIMENTO IMOBILIÁRIO RESPONSABILIDADE LIMITADA,,,,,,,,,,
2026-06-01,23:36:51,AROA11,AROEIRA 333 RENDA LOGÍSTICA FUNDO DE INVESTIMENTO IMOBILIÁRIO RESPONSABILIDADE LIMITADA,,,,,,,,,,
2026-06-01,23:36:51,EIRA11,AROEIRA FUNDO DE INVESTIMENTO IMOBILIÁRIO - RESPONSABILIDADE LIMITADA,,,,,,,,,,
2026-06-01,23:36:51,ARTE11,ÁRTEMIS FUNDO DE INVESTIMENTO IMOBILIÁRIO RESPONSABILIDADE LIMITADA,,,,,,,,,,
2026-06-01,23:36:51,ARXD11,ARX DOVER RECEBÍVEIS FUNDO DE INVESTIMENTO IMOBILIÁRIO DE RESPONSABILIDADE LIMITADA,,,,,,,,,,
2026-06-01,23:36:51,AZPE11,AZ QUEST PANORAMA CRÉDITO ESTRUTURADO FUNDO DE INVESTIMENTO IMOBILIÁRIO DE RESPONSABILIDADE LIMITADA,,,,,,,,,,
2026-06-01,23:36:51,AZPL11,AZ QUEST PANORAMA LOGÍSTICA FUNDO DE INVESTIMENTO IMOBILIÁRIO - RESPONSABILIDADE LIMITADA,,,,,,,,,,
2026-06-01,23:36:51,AZSG11,AZ SOLARGRID RENDA  SOLAR FUNDO DE INVESTIMENTO IMOBILIÁRIO RESPONSABILIDADE  LIMITADA,,,,,,,,,,
2026-06-01,23:36:51,CEBB11,BALTIMORE FUNDO DE INVESTIMENTO IMOBILIÁRIO DE RESPONSABILIDADE LIMITADA,,,,,,,,,,
2026-06-01,23:36:51,BCRI11,BANESTES RECEBÍVEIS  IMOBILIÁRIOS FUNDO DE INVESTIMENTO IMOBILIÁRIO - FII - RESPONSABILIDADE LIMITAD,,,,,,,,,,
2026-06-01,23:36:51,BNFS11,BANRISUL NOVAS FRONTEIRAS FUNDO DE INVESTIMENTO IMOBILIARIO - RESPONSABILIDADE LIMITADA,,,,,,,,,,
2026-06-01,23:36:51,BTML11,BARRA MALLS FUNDO DE INVESTIMENTO IMOBILIÁRIO,,,,,,,,,,
2026-06-01,23:36:51,BZEL11,BARZEL CD1 FUNDO DE INVESTIMENTO IMOBILIARIO RESPONSABILIDADE LIMITADA,,,,,,,,,,
2026-06-01,23:36:51,BPDR11,BASÍLICA PARTNERS GDR FUNDO DE INVESTIMENTO IMOBILIÁRIO FII RESPONSABILIDADE LIMITADA,,,,,,,,,,
2026-06-01,23:36:51,BPLC11,BASÍLICA PARTNERS LED CORPORATE FUNDO DE INVESTIMENTO IMOBILIÁRIO FII,,,,,,,,,,
2026-06-01,23:36:51,BPMW11,BASÍLICA PARTNERS MEDWELL FUNDO DE INVESTIMENTO IMOBILIÁRIO FII RESPONSABILIDADE LIMITADA,,,,,,,,,,
2026-06-01,23:36:51,BBFO11,BB FUNDO DE FUNDOS - FUNDO DE INVESTIMENTO IMOBILIÁRIO RESPONSABILIDADE LIMITADA,,,,,,,,,,
2026-06-01,23:36:51,BBIG11,BB PREMIUM MALLS FUNDO DE INVESTIMENTO IMOBILIÁRIO DE RESPONSABILIDADE LIMITADA,,,,,,,,,,
2026-06-01,23:36:51,BBRC11,BB RENDA CORPORATIVA FUNDO DE INVESTIMENTO IMOBILIÁRIO RESPONSABILIDADE LIMITADA,,,,,,,,,,
2026-06-01,23:36:51,BINR11,BE IN RIO FUNDO DE INVESTIMENTO IMOBILIÁRIO - RESPONSABILIDADE LIMITADA,,,,,,,,,,
2026-06-01,23:36:51,BFCC11,BFC FUNDO DE INVESTIMENTO IMOBILIÁRIO,,,,,,,,,,
2026-06-01,23:36:51,BGRB11,BGR B32 FUNDO DE INVESTIMENTO IMOBILIÁRIO,,,,,,,,,,
2026-06-01,23:36:51,BGRJ11,BGR CIDADE JARDIM FUNDO DE INVESTIMENTO IMOBILIÁRIO - RESPONSABILIDADE LIMITADA,,,,,,,,,,
2026-06-01,23:36:51,BLOG11,BLUECAP LOG FUNDO DE INVESTIMENTO IMOBILIÁRIO,,,,,,,,,,
2026-06-01,23:36:51,BLMG11,BLUEMACAW FUNDO DE INVESTIMENTO IMOBILIÁRIO RESPONSABILIDADE LIMITADA,,,,,,,,,,
2026-06-01,23:36:51,BMLC11,BM BRASCAN LAJES CORPORATIVAS FUNDO DE INVESTIMENTO IMOBILIÁRIO RESPONSABILIDADE LIMITADA,,,,,,,,,,
2026-06-01,23:36:51,BRSE11,BR7 SENADO FUNDO DE INVESTIMENTO IMOBILIÁRIO,,,,,,,,,,
2026-06-01,23:36:51,BCIA11,BRADESCO CARTEIRA IMOBILIÁRIA ATIVA - FUNDO DE FUNDOS DE INVESTIMENTO IMOBILIÁRIO - FII,,,,,,,,,,
2026-06-01,23:36:51,BVAR11,BRASIL VAREJO FUNDO DE INVESTIMENTO IMOBILIÁRIO RESPONSABILIDADE LIMITADA,,,,,,,,,,
2026-06-01,23:36:51,CARE11,BRAZILIAN GRAVEYARD AND DEATH CARE SERVICES FUNDO DE INVESTIMENTO IMOBILIÁRIO - FII RESP LIMITADA,,,,,,,,,,
2026-06-01,23:36:51,FATN11,BRC RENDA CORPORATIVA FUNDO DE INVESTIMENTO IMOBILIÁRIO - RESPONSABILIDADE LIMITADA,,,,,,,,,,
2026-06-01,23:36:51,RTEL11,BRC-II FUNDO DE INVESTIMENTO IMOBILIÁRIO - RESPONSABILIDADE LIMITADA,,,,,,,,,,
2026-06-01,23:36:51,BRCT11,BRC-III DESENVOLVIMENTO FUNDO DE INVESTIMENTO IMOBILIÁRIO - RESPONSABILIDADE LIMITADA,,,,,,,,,,
2026-06-01,23:36:51,BRCD11,BRESCO DESENVOLVIMENTO FUNDO DE INVESTIMENTO IMOBILIÁRIO RESPONSABILIDADE LIMITADA,,,,,,,,,,
2026-06-01,23:36:51,BRCO11,BRESCO LOGÍSTICA FUNDO DE INVESTIMENTO IMOBILIÁRIO RESPONSABILIDADE LIMITADA,,,,,,,,,,
2026-06-01,23:36:51,BICE11,BRIO CRÉDITO ESTRUTURADO - FUNDO DE INVESTIMENTO IMOBILIÁRIO - RESPONSABILIDADE LIMITADA,,,,,,,,,,
2026-06-01,23:36:51,BIME11,BRIO MULTIESTRATÉGIA - FUNDO DE INVESTIMENTO IMOBILIÁRIO RESPONSABILIDADE LIMITADA,,,,,,,,,,
2026-06-01,23:36:51,BRIM11,BRIO REAL ESTATE II - FUNDO DE INVESTIMENTO IMOBILIÁRIO - RESPONSABILIDADE LIMITADA,,,,,,,,,,
2026-06-01,23:36:51,BRIP11,BRIO REAL ESTATE III - FUNDO DE INVESTIMENTO IMOBILIÁRIO - RESPONSABILIDADE LIMITADA,,,,,,,,,,
2026-06-01,23:36:51,BIPD11,BRIO REAL ESTATE IV - FUNDO DE INVESTIMENTO IMOBILIÁRIO - RESPONSABILIDADE LIMITADA,,,,,,,,,,
2026-06-01,23:36:51,BIPE11,BRIO REAL ESTATE V - FUNDO DE INVESTIMENTO IMOBILIÁRIO - RESPONSABILIDADE LIMITADA,,,,,,,,,,
2026-06-01,23:36:51,MCMV11,BRM MINHA CASA MINHA VIDA III FUNDO DE INVESTIMENTO IMOBILIÁRIO RESPONSABILIDADE LIMITADA,,,,,,,,,,
2026-06-01,23:36:51,BROF11,BRPR CORPORATE OFFICES FUNDO DE INVESTIMENTO IMOBILIÁRIO RESPONSABILIDADE LIMITADA,,,,,,,,,,
2026-06-01,23:36:51,BETW11,BRPR E-TOWER FUNDO DE INVESTIMENTO IMOBILIÁRIO,,,,,,,,,,
2026-06-01,23:36:51,LLAO11,BS2 ALLINVESTMENTS FUNDO DE INVESTIMENTO IMOBILIÁRIO,,,,,,,,,,
2026-06-01,23:36:51,BTHR11,BTG HOSPITALIDADE RETORNO TOTAL FUNDO DE INVESTIMENTO IMOBILIÁRIO  RESPONSABILIDADE LIMITADA,,,,,,,,,,
2026-06-01,23:36:51,BTHI11,BTG HOTÉIS FUNDO DE INVESTIMENTO IMOBILIÁRIO RESPONSABILIDADE LIMITADA,,,,,,,,,,
2026-06-01,23:36:51,BRCR11,BTG PACTUAL CORPORATE OFFICE FUND - FUNDO DE INVESTIMENTO IMOBILIÁRIO RESPONSABILIDADE LIMITADA,,,,,,,,,,
2026-06-01,23:36:51,BTCI11,BTG PACTUAL CRÉDITO IMOBILIÁRIO - FUNDO DE CRI - FI IMOBILIÁRIO RESPONSABILIDADE LIMITADA,,,,,,,,,,
2026-06-01,23:36:51,BTLG11,BTG PACTUAL LOGÍSTICA FUNDO DE INVESTIMENTO IMOBILIÁRIO RESPONSABILIDADE LIMITADA,,,,,,,,,,
2026-06-01,23:36:51,BTHF11,BTG PACTUAL REAL ESTATE HEDGE FUND FII - FUNDO DE INVESTIMENTO IMOBILIÁRIO RESPONSABILIDADE LIMITADA,,,,,,,,,,
2026-06-01,23:36:51,BPML11,BTG PACTUAL SHOPPINGS FUNDO DE INVESTIMENTO IMOBILIÁRIO RESPONSABILIDADE LIMITADA,,,,,,,,,,
2026-06-01,23:36:51,BTYU11,BTG PACTUAL YOU INC. DESENVOLVIMENTO IMOBILIÁRIO - FUNDO DE INVESTIMENTO IMOBILIÁRIO RESPONSABILIDAD,,,,,,,,,,
2026-06-01,23:36:51,BTWR11,BTOWERS FUNDO DE INVESTIMENTO IMOBILIÁRIO RESPONSABILIDADE LIMITADA,,,,,,,,,,
2026-06-01,23:36:51,BTSI11,BTSP II FUNDO DE INVESTIMENTO IMOBILIÁRIO FII RESPONSABILIDADE LIMITADA,,,,,,,,,,
2026-06-01,23:36:51,CXCO11,CAIXA IMÓVEIS CORPORATIVOS FUNDO DE INVESTIMENTO IMOBILIÁRIO - RESPONSABILIDADE LIMITADA,,,,,,,,,,
2026-06-01,23:36:51,CRFF11,CAIXA RIO BRAVO FUNDO DE FUNDOS DE INVESTIMENTO IMOBILIÁRIO II RESPONSABILIDADE LIMITADA,,,,,,,,,,
2026-06-01,23:36:51,CXRI11,CAIXA RIO BRAVO FUNDO DE FUNDOS DE INVESTIMENTO IMOBILIARIO RESPONSABILIDADE LIMITADA,,,,,,,,,,
2026-06-01,23:36:51,CCME11,CANUMA CAPITAL MULTIESTRATÉGIA FUNDO DE INVESTIMENTO IMOBILIÁRIO RESPONSABILIDADE LIMITADA,,,,,,,,,,
2026-06-01,23:36:51,CCVA11,CANUMA CAPITAL RENDA VAREJO FUNDO DE INVESTIMENTO IMOBILIÁRIO RESPONSABILIDADE LIMITADA,,,,,,,,,,
2026-06-01,23:36:51,KONG11,CAPITANIA ARTON JARDIM PAULISTANO FUNDO DE INVESTIMENTO IMOBILIÁRIO RESPONSABILIDADE LIMITADA,,,,,,,,,,
2026-06-01,23:36:51,CPUR11,CAPITÂNIA HBC RENDA URBANA FUNDO DE INVESTIMENTO IMOBILIÁRIO RESPONSABILIDADE  LIMITADA,,,,,,,,,,
2026-06-01,23:36:51,CPLG11,CAPITÂNIA LOGÍSTICA FUNDO DE INVESTIMENTO IMOBILIÁRIO - RESPONSABILIDADE LIMITADA,,,,,,,,,,
2026-06-01,23:36:51,CPOF11,CAPITÂNIA OFFICE FII - FUNDO DE INVESTIMENTO IMOBILIÁRIO,,,,,,,,,,
2026-06-01,23:36:51,CPTS11,CAPITÂNIA SECURITIES II FUNDO DE INVESTIMENTO IMOBILIÁRIO RESPONSABILIDADE LIMITADA,,,,,,,,,,
2026-06-01,23:36:51,CPSH11,CAPITÂNIA SHOPPINGS FUNDO DE INVESTIMENTO IMOBILIÁRIO - RESPONSABILIDADE LIMITADA,,,,,,,,,,
2026-06-01,23:36:51,CACR11,CARTESIA RECEBÍVEIS IMOBILIÁRIOS - FUNDO DE INVESTIMENTO IMOBILIÁRIO DE RESPONSABILIDADE LIMITADA,,,,,,,,,,
2026-06-01,23:36:51,CBOP11,CASTELLO BRANCO OFFICE PARK - FUNDO DE INVESTIMENTO IMOBILIÁRIO - RESPONSABILIDADE LIMITADA,,,,,,,,,,
2026-06-01,23:36:51,BLCA11,CATUAÍ VBI TRIPLE A FUNDO DE INVESTIMENTO IMOBILIÁRIO - RESPONSABILIDADE LIMITADA,,,,,,,,,,
2026-06-01,23:36:51,CVFL11,CATUAÍ VISTA FL FUNDO DE INVESTIMENTO IMOBILIÁRIO DE RESPONSABILIDADE LIMITADA,,,,,,,,,,
2026-06-01,23:36:51,CNES11,CENESP FUNDO DE INVESTIMENTO IMOBILIÁRIO RESPONSABILIDADE LIMITADA,,,,,,,,,,
2026-06-01,23:36:51,CDHY11,CENTRAL REAL ESTATE HIGH YIELD DEBT FUNDO DE INVESTIMENTO IMOBILIÁRIO RESPONSABILIDADE LIMITADA,,,,,,,,,,
2026-06-01,23:36:51,CTXT11,CENTRO TÊXTIL INTERNACIONAL FUNDO DE INVESTIMENTO IMOBILIÁRIO DE RESPONSABILIDADE LIMITADA,,,,,,,,,,
2026-06-01,23:36:51,CENU11,CENU - FUNDO DE INVESTIMENTO IMOBILIÁRIO RESPONSABILIDADE LIMITADA,,,,,,,,,,
2026-06-01,23:36:51,CFII11,CF3  FUNDO DE INVESTIMENTO IMOBILIÁRIO,,,,,,,,,,
2026-06-01,23:36:51,CFHF11,CF4 FUNDO DE INVESTIMENTO IMOBILIÁRIO DE RESPONSABILIDADE LIMITADA,,,,,,,,,,
2026-06-01,23:36:51,CJCT11,CIDADE JARDIM CONTINENTAL TOWER FUNDO DE INVESTIMENTO IMOBILIÁRIO DE RESPONSABILIDADE LIMITADA,,,,,,,,,,
2026-06-01,23:36:51,CLSM11,CITLOG SUL DE MINAS FUNDO DE INVESTIMENTO IMOBILIÁRIO DE RESPONSABILIDADE LIMITADA,,,,,,,,,,
2026-06-01,23:36:51,CIXM11,CIX MUIRAQUITAN FUNDO DE INVESTIMENTO IMOBILIÁRIO RESPONSABILIDADE LIMITADA,,,,,,,,,,
2026-06-01,23:36:51,CIXF11,CIX RETROFIT FUNDO DE INVESTIMENTO IMOBILIÁRIO RESPONSABILIDADE LIMITADA,,,,,,,,,,
2026-06-01,23:36:51,PDBM11,CLASSE A DE COTAS DO SINAL RJDI - BRASIL MALLS FUNDO DE INVESTIMENTO IMOBILIÁRIO RESP LIMITADA,,,,,,,,,,
2026-06-01,23:36:51,CLIN11,CLAVE ÍNDICES DE PREÇOS FUNDO DE INVESTIMENTO IMOBILIÁRIO RESPONSABILIDADE LIMITADA,,,,,,,,,,
2026-06-01,23:36:51,CSMC11,COSMIC FUNDO DE INVESTIMENTO IMOBILIÁRIO DE RESPONSABILIDADE LIMITADA,,,,,,,,,,
2026-06-01,23:36:51,RENV11,CPV ENERGIA FUNDO DE INVESTIMENTO IMOBILIÁRIO RESPONSABILIDADE LIMITADA,,,,,,,,,,
2026-06-01,23:36:51,IBCR11,CRI INTEGRAL BREI FUNDO DE INVESTIMENTO IMOBILIÁRIO RESPONSABILIDADE LIMITADA,,,,,,,,,,
2026-06-01,23:36:51,CVPR11,CVPAR FUNDO DE INVESTIMENTO IMOBILIÁRIO DE CRI RESPONSABILIDADE LIMITADA,,,,,,,,,,
2026-06-01,23:36:51,CYCR11,CYRELA CRÉDITO - FUNDO DE INVESTIMENTO IMOBILIÁRIO - RESPONSABILIDADE LIMITADA,,,,,,,,,,
2026-06-01,23:36:51,CYLD11,CYRELA DESENVOLVIMENTO LOGÍSTICO FUNDO DE INVESTIMENTO IMOBILIÁRIO RESPONSABILIDADE LIMITADA,,,,,,,,,,
2026-06-01,23:36:51,DAMA11,DAMA FUNDO DE INVESTIMENTO IMOBILIÁRIO RESPONSABILIDADE LIMITADA,,,,,,,,,,
2026-06-01,23:36:51,DAYM11,DAYCOVAL REAL ESTATE MULTIESTRATÉGIA FUNDO DE INVESTIMENTO IMOBILIÁRIO DE RESPONSABILIDADE LIMITADA,,,,,,,,,,
2026-06-01,23:36:51,ASRF11,DAYCOVAL RETROFITS I FUNDO DE INVESTIMENTO IMOBILIÁRIO RESPONSABILIDADE LIMITADA,,,,,,,,,,
2026-06-01,23:36:51,DLMT11,DEL MONTE AJAX FUNDO DE INVESTIMENTO IMOBILIÁRIO - FII DE RESPONSABILIDADE LIMITADA,,,,,,,,,,
2026-06-01,23:36:51,DPRO11,DEVANT PROPERTIES FUNDO DE INVESTIMENTO IMOBILIÁRIO DE RESPONSABILIDADE LIMITADA,,,,,,,,,,
2026-06-01,23:36:51,DEVA11,DEVANT RECEBÍVEIS IMOBILIÁRIOS FUNDO DE INVESTIMENTO IMOBILIÁRIO RESPONSABILIDADE LIMITADA,,,,,,,,,,
2026-06-01,23:36:51,DAMT11,DIAMANTE FUNDO DE INVESTIMENTO IMOBILIÁRIO RESPONSABILIDADE LIMITADA,,,,,,,,,,
2026-06-01,23:36:51,DOVL11,DOVEL FUNDO DE INVESTIMENTO IMOBILIÁRIO - RESPONSABILIDADE LIMITADA,,,,,,,,,,
2026-06-01,23:36:51,EDGE11,EDGE FUNDO DE INVESTIMENTO IMOBILIÁRIO DE RESPONSABILIDADE LIMITADA,,,,,,,,,,
2026-06-01,23:36:51,EMET11,EMET MULTIESTRATÉGIA FUNDO DE INVESTIMENTO I MOBILIÁRIO RESPONSABILIDADE LIMITADA,,,,,,,,,,
2026-06-01,23:36:51,EGYR11,ENERGY RESORT FUNDO DE INVESTIMENTO IMOBILIÁRIO,,,,,,,,,,
2026-06-01,23:36:51,EQIR11,EQI RECEBÍVEIS IMOBILIÁRIOS FUNDO DE INVESTIMENTO IMOBILIÁRIO RESPONSABILIDADE LIMITADA,,,,,,,,,,
2026-06-01,23:36:51,ERCR11,ESTOQUE RESIDENCIAL E COMERCIAL RIO DE JANEIRO FUNDO DE INVESTIMENTO IMOBILIÁRIO - RESP LIMITADA,,,,,,,,,,
2026-06-01,23:36:51,ERPA11,EUROPA 105  FUNDO DE INVESTIMENTO IMOBILIÁRIO - RESPONSABILIDADE LIMITADA,,,,,,,,,,
2026-06-01,23:36:51,KEVE11,EVEN II KINEA FUNDO DE INVESTIMENTO IMOBILIÁRIO RESPONSABILIDADE LIMITADA,,,,,,,,,,
2026-06-01,23:36:51,EXES11,EXES FUNDO DE INVESTIMENTO IMOBILIÁRIO RESPONSABILIDADE LIMITADA,,,,,,,,,,
2026-06-01,23:36:51,FLCR11,FARIA LIMA CAPITAL RECEBÍVEIS IMOBILIÁRIOS I - FUNDO DE INVESTIMENTO IMOBILIÁRIO RESPONSABILIDADE LI,,,,,,,,,,
2026-06-01,23:36:51,FTRR11,FATOR RECEBÍVEIS IMOBILIÁRIOS FUNDO DE INVESTIMENTO IMOBILIÁRIO DE RESPONSABILIDADE LIMITADA,,,,,,,,,,
2026-06-01,23:36:51,VRTA11,FATOR VERITA FUNDO DE INVESTIMENTO IMOBILIARIO,,,,,,,,,,
2026-06-01,23:36:51,VRTM11,FATOR VERITÀ MULTIESTRATÉGIA FUNDO DE INVESTIMENTO IMOBILIÁRIO,,,,,,,,,,
2026-06-01,23:36:51,FTRE11,FIGTREE RENDA EDUCACIONAL FUNDO DE INVESTIMENTO IMOBILIÁRIO,,,,,,,,,,
2026-06-01,23:36:51,FLMA11,FII CONTINENTAL SQUARE FARIA LIMA - RESPONSABILIDADE LIMITADA,,,,,,,,,,
2026-06-01,23:36:51,EGDB11,FII DE DESENVOLVIMENTO DE ESCRITÓRIOS BOUTIQUE RESPONSABILIDADE LIMITADA,,,,,,,,,,
2026-06-01,23:36:51,ELDO11,FII ELDORADO FUNDO DE INVESTIMENTO IMOBILIÁRIO - RESPONSABILIDADE LIMITADA,,,,,,,,,,
2026-06-01,23:36:51,EURO11,FII EUROPAR RESPONSABILIDADE LIMITADA,,,,,,,,,,
2026-06-01,23:36:51,HYPI11,FII HIRE PROPERTIES I - FUNDO DE INVESTIMENTO IMOBILIÁRIO,,,,,,,,,,
2026-06-01,23:36:51,HRES11,FII HIRE RESIDENCIAL I - FUNDO DE INVESTIMENTO IMOBILIÁRIO,,,,,,,,,,
2026-06-01,23:36:51,FIIB11,FII INDUSTRIAL DO BRASIL RESPONSABILIDADE LIMITADA,,,,,,,,,,
2026-06-01,23:36:51,FMOF11,FII MEMORIAL OFFICE RESPONSABILIDADE LIMITADA,,,,,,,,,,
2026-06-01,23:36:51,OPTM11,FII PATRIMONIAL IV,,,,,,,,,,
2026-06-01,23:36:51,FRBC11,FII RBC II FUNDO DE FUNDOS - RESPONSABILIDADE LIMITADA,,,,,,,,,,
2026-06-01,23:36:51,ALMI11,FII TORRE ALMIRANTE,,,,,,,,,,
2026-06-01,23:36:51,FLNR11,FLORIANO FUNDO DE INVESTIMENTO IMOBILIÁRIO,,,,,,,,,,
2026-06-01,23:36:51,HLMB11,FRAM CAPITAL HELMER MULTIATIVOS RENDA PREFERENCIAL FUNDO DE INVESTIMENTO IMOBILIÁRIO,,,,,,,,,,
2026-06-01,23:36:51,KFOF11,FUNDO DE FUNDOS DE INVESTIMENTO IMOBILIÁRIO KINEA FII RESPONSABILIDADE LIMITADA,,,,,,,,,,
2026-06-01,23:36:51,DVFF11,FUNDO DE INVESTIMENTO IMOBILIÁRIO - DEVANT FUNDO DE FUNDOS IMOBILIÁRIOS DE RESPONSABILIDADE LIMITADA,,,,,,,,,,
2026-06-01,23:36:51,ANCR11,FUNDO DE INVESTIMENTO IMOBILIÁRIO - FII ANCAR IC - RESPONSABILIDADE LIMITADA,,,,,,,,,,
2026-06-01,23:36:51,FAED11,FUNDO DE INVESTIMENTO IMOBILIÁRIO - FII ANHANGUERA EDUCACIONAL RESPONSABILIDADE LIMITADA,,,,,,,,,,
2026-06-01,23:36:51,FCFL11,FUNDO DE INVESTIMENTO IMOBILIÁRIO - FII CAMPUS FARIA LIMA RESPONSABILIDADE LIMITADA,,,,,,,,,,
2026-06-01,23:36:51,CEOC11,FUNDO DE INVESTIMENTO IMOBILIÁRIO - FII CEO CYRELA COMMERCIAL PROPERTIES RESPONSABILIDADE LIMITADA,,,,,,,,,,
2026-06-01,23:36:51,FAMB11,FUNDO DE INVESTIMENTO IMOBILIÁRIO - FII EDIFÍCIO ALMIRANTE BARROSO RESPONSABILIDADE LIMITADA,,,,,,,,,,
2026-06-01,23:36:51,EDGA11,FUNDO DE INVESTIMENTO IMOBILIÁRIO - FII EDIFÍCIO GALERIA RESPONSABILIADADE LIMITADA,,,,,,,,,,
2026-06-01,23:36:51,FYTO11,FUNDO DE INVESTIMENTO IMOBILIÁRIO - FII FYTO RECEBÍVEIS IMOBILIÁRIOS RESPONSABILIDADE LIMITADA,,,,,,,,,,
2026-06-01,23:36:51,HCRI11,FUNDO DE INVESTIMENTO IMOBILIÁRIO - FII HOSPITAL DA CRIANÇA RESPONSABILIDADE LIMITADA,,,,,,,,,,
2026-06-01,23:36:51,NSLU11,FUNDO DE INVESTIMENTO IMOBILIÁRIO - FII HOSPITAL NOSSA SENHORA DE LOURDES RESPONSABILIDADE LIMITADA,,,,,,,,,,
2026-06-01,23:36:51,MAXR11,FUNDO DE INVESTIMENTO IMOBILIÁRIO - FII MAX RETAIL RESPONSABILIDADE LIMITADA,,,,,,,,,,
2026-06-01,23:36:51,PQDP11,FUNDO DE INVESTIMENTO IMOBILIÁRIO - FII PARQUE DOM PEDRO SHOPPING CENTER RESPONSABILIDADE LIMITADA,,,,,,,,,,
2026-06-01,23:36:51,RBRI11,FUNDO DE INVESTIMENTO IMOBILIÁRIO - FII RBR DESENVOLVIMENTO III RESPONSABILIDADE LIMITADA,,,,,,,,,,
2026-06-01,23:36:51,RDIV11,FUNDO DE INVESTIMENTO IMOBILIÁRIO - FII RBR DESENVOLVIMENTO IV RESPONSABILIDADE LIMITADA,,,,,,,,,,
2026-06-01,23:36:51,RBRR11,FUNDO DE INVESTIMENTO IMOBILIARIO - FII RBR RENDIMENTO HIGH GRADE RESPONSABILIDADE LIMITADA,,,,,,,,,,
2026-06-01,23:36:51,RECR11,FUNDO DE INVESTIMENTO IMOBILIÁRIO - FII REC RECEBÍVEIS IMOBILIÁRIOS - RESPONSABILIDADE LIMITADA,,,,,,,,,,
2026-06-01,23:36:51,RECT11,FUNDO DE INVESTIMENTO IMOBILIÁRIO - FII REC RENDA IMOBILIÁRIA - RESPONSABILIDADE LIMITADA,,,,,,,,,,
2026-06-01,23:36:51,SHDP11,FUNDO DE INVESTIMENTO IMOBILIÁRIO - FII SHOPPING PARQUE D. PEDRO RESPONSABILIDADE LIMITADA,,,,,,,,,,
2026-06-01,23:36:51,TRNT11,FUNDO DE INVESTIMENTO IMOBILIÁRIO - FII TORRE NORTE,,,,,,,,,,
2026-06-01,23:36:51,APXR11,FUNDO DE INVESTIMENTO IMOBILIÁRIO APEX REALTY - FII,,,,,,,,,,
2026-06-01,23:36:51,BRHT11,FUNDO DE INVESTIMENTO IMOBILIÁRIO BR HOTÉIS,,,,,,,,,,
2026-06-01,23:36:51,BRCQ11,FUNDO DE INVESTIMENTO IMOBILIÁRIO BRC-IV DESENVOLVIMENTO RESPONSABILIDADE LIMITADA,,,,,,,,,,
2026-06-01,23:36:51,CXAG11,FUNDO DE INVESTIMENTO IMOBILIÁRIO CAIXA AGÊNCIAS - RESPONSABILIDADE LIMITADA,,,,,,,,,,
2026-06-01,23:36:51,CXCI11,FUNDO DE INVESTIMENTO IMOBILIÁRIO CAIXA CARTEIRA IMOBILIÁRIA RESPONSABILIDADE LIMITADA,,,,,,,,,,
2026-06-01,23:36:51,CXCE11,FUNDO DE INVESTIMENTO IMOBILIÁRIO CAIXA CEDAE RESPONSABILIDADE LIMITADA,,,,,,,,,,
2026-06-01,23:36:51,CXTL11,FUNDO DE INVESTIMENTO IMOBILIARIO CAIXA SEQ LOGISTICA RENDA RESPONSABILIDADE LIMITADA,,,,,,,,,,
2026-06-01,23:36:51,IDUA11,FUNDO DE INVESTIMENTO IMOBILIÁRIO DE UNIDADES AUTÔNOMAS IV,,,,,,,,,,
2026-06-01,23:36:51,LKDV11,FUNDO DE INVESTIMENTO IMOBILIÁRIO DEVELOPMENT V1 RESPONSABILIDADE LIMITADA,,,,,,,,,,
2026-06-01,23:36:51,EDFO11,FUNDO DE INVESTIMENTO IMOBILIÁRIO EDIFÍCIO OURINVEST - RESPONSABILIDADE LIMITADA,,,,,,,,,,
2026-06-01,23:36:51,NVHO11,FUNDO DE INVESTIMENTO IMOBILIÁRIO FII NOVO HORIZONTE - RESPONSABILIDADE LIMITADA,,,,,,,,,,
2026-06-01,23:36:51,GTWR11,FUNDO DE INVESTIMENTO IMOBILIÁRIO GREEN TOWERS RESPONSABILIDADE LIMITADA,,,,,,,,,,
2026-06-01,23:36:51,HBCR11,FUNDO DE INVESTIMENTO IMOBILIÁRIO HBC RENDA URBANA,,,,,,,,,,
2026-06-01,23:36:51,HUCG11,FUNDO DE INVESTIMENTO IMOBILIÁRIO HOSPITAL UNIMED CAMPINA GRANDE RESPONSABILIDADE LIMITADA,,,,,,,,,,
2026-06-01,23:36:51,HUSC11,FUNDO DE INVESTIMENTO IMOBILIARIO HOSPITAL UNIMED SUL CAPIXABA,,,,,,,,,,
2026-06-01,23:36:51,HOSI11,FUNDO DE INVESTIMENTO IMOBILIÁRIO HOUSI RESPONSABILIDADE LIMITADA,,,,,,,,,,
2026-06-01,23:36:51,FINF11,FUNDO DE INVESTIMENTO IMOBILIÁRIO INFRA REAL ESTATE - FII RESPONSABILIDADE LIMITADA,,,,,,,,,,
2026-06-01,23:36:51,BLUE11,FUNDO DE INVESTIMENTO IMOBILIÁRIO MACAM SHOPPING RESPONSABILIDADE LIMITADA,,,,,,,,,,
2026-06-01,23:36:51,MMPD11,FUNDO DE INVESTIMENTO IMOBILIÁRIO MAUÁ CAPITAL MPD DESENVOLVIMENTO RESIDENCIAL RESP LIMITADA,,,,,,,,,,
2026-06-01,23:36:51,MCCI11,FUNDO DE INVESTIMENTO IMOBILIÁRIO MAUÁ CAPITAL RECEBÍVEIS IMOBILIÁRIOS - FII RESPONSABILIDADE LIMITA,,,,,,,,,,
2026-06-01,23:36:51,WTSP11,FUNDO DE INVESTIMENTO IMOBILIÁRIO OURINVEST RE I - RESPONSABILIDADE LIMITADA,,,,,,,,,,
2026-06-01,23:36:51,PABY11,FUNDO DE INVESTIMENTO IMOBILIÁRIO PANAMBY,,,,,,,,,,
2026-06-01,23:36:51,RBRP11,FUNDO DE INVESTIMENTO IMOBILIÁRIO PATRIA PROPERTIES - FII RESPONSABILIDADE LIMITADA,,,,,,,,,,
2026-06-01,23:36:51,VTPA11,FUNDO DE INVESTIMENTO IMOBILIÁRIO PATRIMONIAL V RESPONSABILIDADE LIMITADA,,,,,,,,,,
2026-06-01,23:36:51,FPNG11,FUNDO DE INVESTIMENTO IMOBILIÁRIO PEDRA NEGRA RENDA IMOBILIÁRIA - RESPONSABILIDADE LIMITADA,,,,,,,,,,
2026-06-01,23:36:51,VTPL11,FUNDO DE INVESTIMENTO IMOBILIÁRIO PLUS RESPONSABILIDADE LIMITADA,,,,,,,,,,
2026-06-01,23:36:51,ESTQ11,FUNDO DE INVESTIMENTO IMOBILIARIO POLO ESTOQUE II RESPONSABILIDADE LIMITADA,,,,,,,,,,
2026-06-01,23:36:51,VPSI11,FUNDO DE INVESTIMENTO IMOBILIÁRIO POLO SHOPPING INDAIATUBA - RESPONSABILIDADE LIMITADA,,,,,,,,,,
2026-06-01,23:36:51,RBRY11,FUNDO DE INVESTIMENTO IMOBILIÁRIO RBR CRÉDITO IMOBILIÁRIO ESTRUTURADO RESPONSABILIDADE LIMITADA,,,,,,,,,,
2026-06-01,23:36:51,RELG11,FUNDO DE INVESTIMENTO IMOBILIÁRIO REC LOGÍSTICA - RESPONSABILIDADE  LIMITADA,,,,,,,,,,
2026-06-01,23:36:51,RLGX11,FUNDO DE INVESTIMENTO IMOBILIÁRIO REC LOGÍSTICA II - RESPONSABILIDADE LIMITADA,,,,,,,,,,
2026-06-01,23:36:51,RRES11,FUNDO DE INVESTIMENTO IMOBILIÁRIO RIVIERA RESIDENCIAL - RESPONSABILIDADE LIMITADA,,,,,,,,,,
2026-06-01,23:36:51,RZTR11,FUNDO DE INVESTIMENTO IMOBILIÁRIO RIZA TERRAX,,,,,,,,,,
2026-06-01,23:36:51,ROOF11,FUNDO DE INVESTIMENTO IMOBILIÁRIO ROOFTOP I RESPONSABILIDADE LIMITADA,,,,,,,,,,
2026-06-01,23:36:51,HOMS11,FUNDO DE INVESTIMENTO IMOBILIÁRIO ROOFTOP III RESPONSABILIDADE LIMITADA,,,,,,,,,,
2026-06-01,23:36:51,FISC11,FUNDO DE INVESTIMENTO IMOBILIÁRIO SC 401 - RESPONSABILIDADE LIMITADA,,,,,,,,,,
2026-06-01,23:36:51,SAIC11,FUNDO DE INVESTIMENTO IMOBILIARIO SIA CORPORATE RESPONSABILIDADE LIMITADA,,,,,,,,,,
2026-06-01,23:36:51,SMRE11,FUNDO DE INVESTIMENTO IMOBILIÁRIO SMART REAL ESTATE - FII RESPONSABILIDADE LIMITADA,,,,,,,,,,
2026-06-01,23:36:51,SOFF11,FUNDO DE INVESTIMENTO IMOBILIÁRIO SOFIA,,,,,,,,,,
2026-06-01,23:36:51,SPVJ11,FUNDO DE INVESTIMENTO IMOBILIÁRIO SUCCESPAR VAREJO RESPONSABILIDADE LIMITADA,,,,,,,,,,
2026-06-01,23:36:51,TGAR11,FUNDO DE INVESTIMENTO IMOBILIÁRIO TG ATIVO REAL,,,,,,,,,,
2026-06-01,23:36:51,TRCO11,FUNDO DE INVESTIMENTO IMOBILIÁRIO TORRE RIO CLARO OFFICES - RESPONSABILIDADE LIMITADA,,,,,,,,,,
2026-06-01,23:36:51,TRUE11,FUNDO DE INVESTIMENTO IMOBILIÁRIO TRUE MULTIESTRATÉGIA - RESPONSABILIDADE LIMITADA,,,,,,,,,,
2026-06-01,23:36:51,LVBI11,FUNDO DE INVESTIMENTO IMOBILIÁRIO VBI LOGÍSTICO - RESPONSABILIDADE LIMITADA,,,,,,,,,,
2026-06-01,23:36:51,PVBI11,FUNDO DE INVESTIMENTO IMOBILIÁRIO VBI PRIME PROPERTIES - RESPONSABILIDADE LIMITADA,,,,,,,,,,
2026-06-01,23:36:51,VERE11,FUNDO DE INVESTIMENTO IMOBILIÁRIO VEREDA - FII RESPONSABILIDADE LIMITADA,,,,,,,,,,
2026-06-01,23:36:51,FIVN11,FUNDO DE INVESTIMENTO IMOBILIÁRIO VIDA NOVA - FII - RESPONSABILIDADE LIMITADA,,,,,,,,,,
2026-06-01,23:36:51,VSHO11,FUNDO DE INVESTIMENTO IMOBILIÁRIO VOTORANTIM SHOPPING,,,,,,,,,,
2026-06-01,23:36:51,BMLT11,FUNDO DE INVESTIMENTOS  IMOBILIÁRIOS DE PERMUTA FINANCEIRA LOTE5 MEZANINO RESPONSABILIDADE  LIMITADA,,,,,,,,,,
2026-06-01,23:36:51,FIIC11,FUNDO DE INVESTIMENTOS IMOBILIÁRIO DO CAMPREV PARA SUSTENTABILIDADE PREVIDENCIÁRIA DO MUNICÍPIO,,,,,,,,,,
2026-06-01,23:36:51,BSLT11,FUNDO DE INVESTIMENTOS IMOBILIÁRIOS DE PERMUTA FINANCEIRA LOTE5 (SENIOR) RESPONSABILIDADE LIMITADA,,,,,,,,,,
2026-06-01,23:36:51,TCIN11,G5 CIDADE NOVA FUNDO DE INVESTIMENTO IMOBILIÁRIO,,,,,,,,,,
2026-06-01,23:36:51,GCDL11,GALAPAGOS DESENVOLVIMENTO LOGÍSTICO FUNDO DE INVESTIMENTO IMOBILIÁRIO RESPONSABILIDADE LIMITADA,,,,,,,,,,
2026-06-01,23:36:51,GSRF11,GALAPAGOS DESENVOLVIMENTO RESIDENCIAL FUNDO DE INVESTIMENTO IMOBILIÁRIO RESPONSABILIDADE LIMITADA,,,,,,,,,,
2026-06-01,23:36:51,GFDL11,GALAPAGOS FEEDER DESENVOLVIMENTO LOGÍSTICO FUNDO DE INVESTIMENTO IMOBILIÁRIO RESPONSABILIDADE LIMITA,,,,,,,,,,
2026-06-01,23:36:51,GLPF11,GALAPAGOS FEEDER LOGÍSTICO FUNDO DE INVESTIMENTO IMOBILIÁRIO RESPONSABILIDADE LIMITADA,,,,,,,,,,
2026-06-01,23:36:51,GLCR11,GALAPAGOS HEDGE FUND FUNDO DE INVESTIMENTO IMOBILIÁRIO RESPONSABILIDADE LIMITADA,,,,,,,,,,
2026-06-01,23:36:51,GCRI11,GALAPAGOS RECEBÍVEIS IMOBILIÁRIOS FUNDO DE INVESTIMENTO IMOBILIÁRIO RESPONSABILIDADE LIMITADA,,,,,,,,,,
2026-06-01,23:36:51,GCOI11,GALAPAGOS SPECIAL OPORTUNITIES FUNDO DE INVESTIMENTO IMOBILIÁRIO,,,,,,,,,,
2026-06-01,23:36:51,GZIT11,GAZIT MALLS FUNDO DE INVESTIMENTO IMOBILIÁRIO RESPONSABILIDADE LIMITADA,,,,,,,,,,
2026-06-01,23:36:51,FIGS11,GENERAL SHOPPING ATIVO E RENDA FUNDO DE INVESTIMENTO IMOBILIÁRIO DE RESPONSABILIDADE LIMITADA,,,,,,,,,,
2026-06-01,23:36:51,GSFI11,GENERAL SHOPPING E OUTLETS DO BRASIL FUNDO DE INVESTIMENTO IMOBILIÁRIO RESPONSABILIDADE LIMITADA,,,,,,,,,,
2026-06-01,23:36:51,VXXV11,GENESIS MULTIESTRATÉGIA FUNDO DE INVESTIMENTO IMOBILIÁRIO - FII -  RESPONSABILIDADE LIMITADA,,,,,,,,,,
2026-06-01,23:36:51,GLOG11,GENIAL LOGÍSTICA - FUNDO DE INVESTIMENTO IMOBILIÁRIO - RESPONSABILIDADE LIMITADA,,,,,,,,,,
2026-06-01,23:36:51,ABCP11,GRAND PLAZA SHOPPING FUNDO DE INVESTIMENTO IMOBILIÁRIO - RESPONSABILIDADE LIMITADA,,,,,,,,,,
2026-06-01,23:36:51,RCFA11,GRUPO RCFA FUNDO DE INVESTIMENTO IMOBILIARIO,,,,,,,,,,
