data_captura,hora_captura,codigo_fundo,nome_fundo,cnpj,administrador,segmento,tipo,mandato,prazo_duracao,gestao,data_encerramento,cotistas,patrimonio_liquido
2026-06-01,20:52:24,SPAF11,SPA FUNDO DE INVESTIMENTO IMOBILIÁRIO - RESPONSABILIDADE LIMITADA,,,,,,,,,,
2026-06-01,20:52:24,LTMT11,SPECIALE BLUE REAL FUNDO DE INVESTIMENTO IMOBILIÁRIO DE RESPONSABILIDADE LIMITADA,,,,,,,,,,
2026-06-01,20:52:24,DVLP11,SPECIALE REAL ESTATE DEVELOPMENT FUNDO DE INVESTIMENTO IMOBILIÁRIO RESPONSABILIDADE LIMITADA,,,,,,,,,,
2026-06-01,20:52:24,DVLT11,SPECIALE REAL ESTATE DEVELOPMENT II FUNDO DE INVESTIMENTO  IMOBILIÁRIO DE RESPONSABILIDADE LIMITADA,,,,,,,,,,
2026-06-01,20:52:24,PMFO11,SPECIALE REAL ESTATE FUND OF FUNDS FUNDO DE INVESTIMENTO IMOBILIÁRIO DE RESPONSABILIDADE LIMITADA,,,,,,,,,,
2026-06-01,20:52:24,SPGM11,SPGM FUNDO DE INVESTIMENTO IMOBILIÁRIO,,,,,,,,,,
2026-06-01,20:52:24,SPG2,SPGM II FUNDO DE INVESTIMENTO IMOBILIÁRIO,,,,,,,,,,
2026-06-01,20:52:24,SPXM11,SPX REAL ESTATE DESENVOLVIMENTO DE GALPÕES LOGÍSTICOS FEEDER BRADESCO FII RESPONSABILIDADE LIMITADA,,,,,,,,,,
2026-06-01,20:52:24,SPXL11,SPX REAL ESTATE DESENVOLVIMENTO DE GALPÕES LOGÍSTICOS FEEDER INSTITUCIONAL FII RESP LIMITADA,,,,,,,,,,
2026-06-01,20:52:24,SPXG11,SPX REAL ESTATE DESENVOLVIMENTO DE GALPÕES LOGÍSTICOS FEEDER PRIVATE FII RESPONSABILIDADE LIMITADA,,,,,,,,,,
2026-06-01,20:52:24,SPXS11,SPX REAL ESTATE MULTIESTRATÉGIA FUNDO DE INVESTIMENTO IMOBILIÁRIO RESPONSABILIDADE LIMITADA,,,,,,,,,,
2026-06-01,20:52:24,SPXT11,SPX RENDA IMOBILIÁRIA III FUNDO DE INVESTIMENTO IMOBILIÁRIO RESPONSABILIDADE LIMITADA,,,,,,,,,,
2026-06-01,20:52:24,STRX11,STARX FUNDO DE INVESTIMENTO IMOBILIÁRIO FII RESPONSABILIDADE LIMITADA,,,,,,,,,,
2026-06-01,20:52:24,STYI11,STRIVO YIELD FUNDO DE INVESTIMENTO IMOBILIÁRIO RESPONSABILIDADE LIMITADA,,,,,,,,,,
2026-06-01,20:52:24,SURE11,SULAMÉRICA REAL ESTATE FUNDO DE INVESTIMENTO IMOBILIÁRIO DE RESPONSABILIDADE LIMITADA,,,,,,,,,,
2026-06-01,20:52:24,SNEL11,SUNO ENERGIAS LIMPAS FUNDO DE INVESTIMENTO IMOBILIÁRIO IS RESPONSABILIDADE LIMITADA,,,,,,,,,,
2026-06-01,20:52:24,SNFF11,SUNO FUNDO DE FUNDOS DE INVESTIMENTO IMOBILIÁRIO FUNDO DE INVESTIMENTO IMOBILIÁRIO RESPONSABILIDADE,,,,,,,,,,
2026-06-01,20:52:24,SNLG11,SUNO LOG FUNDO DE INVESTIMENTO IMOBILIÁRIO - RESPONSABILIDADE LIMITADA,,,,,,,,,,
2026-06-01,20:52:24,SNME11,SUNO MULTIESTRATÉGIA FUNDO DE INVESTIMENTO IMOBILIÁRIO RESPONSABILIDADE LIMITADA,,,,,,,,,,
2026-06-01,20:52:24,SNCI11,SUNO RECEBÍVEIS IMOBILIÁRIOS FUNDO DE INVESTIMENTO IMOBILIÁRIO RESPONSABILIDADE LIMITADA,,,,,,,,,,
2026-06-01,20:52:24,SPMO11,SUPREMO FUNDO DE INVESTIMENTO IMOBILIÁRIO,,,,,,,,,,
2026-06-01,20:52:24,TELD11,TELLUS DESENVOLVIMENTO LOGÍSTICO - FUNDO DE INVESTIMENTO IMOBILIÁRIO RESPONSABILIDADE LIMITADA,,,,,,,,,,
2026-06-01,20:52:24,TELM11,TELLUS MULTIESTRATÉGIA - FII FUNDO DE INVESTIMENTO IMOBILIÁRIO RESPONSABILIDADE LIMITADA,,,,,,,,,,
2026-06-01,20:52:24,TEPP11,TELLUS PROPERTIES - FUNDO DE INVESTIMENTO IMOBILIÁRIO - RESPONSABILIDADE LIMITADA,,,,,,,,,,
2026-06-01,20:52:24,TRBL11,TELLUS RIO BRAVO RENDA LOGÍSTICA FUNDO DE INVESTIMENTO IMOBILIÁRIO DE RESPONSABILIDADE LIMITADA,,,,,,,,,,
2026-06-01,20:52:24,NAUI11,TEN DESENVOLVIMENTO FUNDO DE INVESTIMENTO IMOBILIÁRIO RESPONSABILIDADE LIMITADA,,,,,,,,,,
2026-06-01,20:52:24,TRPL11,TERRAS PAULISTAS FUNDO DE  INVESTIMENTO IMOBILIÁRIO DE PERMUTAS RESPONSABILIDADE LIMITADA,,,,,,,,,,
2026-06-01,20:52:24,TVOI11,TIVIO OPPORTUNITIES IPCA - FUNDO DE INVESTIMENTO IMOBILIÁRIO - RESPONSABILIDADE LIMITADA,,,,,,,,,,
2026-06-01,20:52:24,TIOM11,TIVIO OPPORTUNITIES MASTER FUNDO DE INVESTIMENTO IMOBILIÁRIO - RESPONSABILIDADE LIMITADA,,,,,,,,,,
2026-06-01,20:52:24,TVRI11,TIVIO RENDA IMOBILIÁRIA FUNDO DE INVESTIMENTO IMOBILIÁRIO RESPONSABILIDADE LIMITADA,,,,,,,,,,
2026-06-01,20:52:24,VOTS11,TIVIO SECURITIES FUNDO DE INVESTIMENTO IMOBILIÁRIO RESPONSABILIDADE LIMITADA,,,,,,,,,,
2026-06-01,20:52:24,TJKB11,TJK RENDA IMOBILIÁRIA FUNDO DE INVESTIMENTO IMOBILIÁRIO - RESPONSABILIDADE LIMITADA,,,,,,,,,,
2026-06-01,20:52:24,TORD11,TORDESILHAS EI FUNDO DE INVESTIMENTO IMOBILIÁRIO RESPONSABILIDADE LIMITADA,,,,,,,,,,
2026-06-01,20:52:24,TSNC11,TRANSINC FUNDO DE INVESTIMENTO IMOBILIÁRIO RESPONSABILIDADE LIMITADA,,,,,,,,,,
2026-06-01,20:52:24,TCPF11,TREECORP REAL ESTATE FII - RESPONSABILIDADE LIMITADA,,,,,,,,,,
2026-06-01,20:52:24,TRXY11,TRX HEDGE FUND FUNDO DE INVESTIMENTO IMOBILIÁRIO - RESPONSABILIDADE LIMITADA,,,,,,,,,,
2026-06-01,20:52:24,TRXF11,TRX REAL ESTATE FUNDO DE INVESTIMENTO IMOBILIÁRIO RESPONSABILIDADE LIMITADA,,,,,,,,,,
2026-06-01,20:52:24,TRXB11,TRX REAL ESTATE II FUNDO DE INVESTIMENTO IMOBILIÁRIO - RESPONSABILIDADE LIMITADA,,,,,,,,,,
2026-06-01,20:52:24,MGHT11,TZDK FUNDO DE INVESTIMENTO IMOBILIÁRIORESPONSABILIDADE LIMITADA,,,,,,,,,,
2026-06-01,20:52:24,URHF11,URCA HEDGE FUND ESTRATÉGIA IMOBILIÁRIA FUNDO DE INVESTIMENTO IMOBILIÁRIO - RESPONSABILIDADE LIMITADA,,,,,,,,,,
2026-06-01,20:52:24,URPR11,URCA PRIME RENDA FUNDO DE INVESTIMENTO IMOBILIÁRIO - FII,,,,,,,,,,
2026-06-01,20:52:24,VVCO11,V2 EDIFÍCIOS CORPORATIVOS FUNDO DE INVESTIMENTO IMOBILIÁRIO RESPONSABILIDADE LIMITADA,,,,,,,,,,
2026-06-01,20:52:24,VVMR11,V2 MULTI RENDA FUNDO DE INVESTIMENTO IMOBILIÁRIO RESPONSABILIDADE LIMITADA,,,,,,,,,,
2026-06-01,20:52:24,VPPR11,V2 PRIME PROPERTIES FUNDO DE INVESTIMENTO IMOBILIÁRIO - FII - RESPONSABILIDADE LIMITADA,,,,,,,,,,
2026-06-01,20:52:24,VVDI11,V2 RECEBÍVEIS CDI FUNDO DE INVESTIMENTO IMOBILIÁRIO - RESPONSABILIDADE LIMITADA,,,,,,,,,,
2026-06-01,20:52:24,VVCR11,V2 RECEBÍVEIS IMOBILIÁRIOS FUNDO DE INVESTIMENTO IMOBILIÁRIO RESPONSABILIDADE LIMITADA,,,,,,,,,,
2026-06-01,20:52:24,VVRI11,V2 RENDA IMOBILIÁRIA FUNDO DE INVESTIMENTO IMOBILIÁRIO RESPONSABILIDADE LIMITADA,,,,,,,,,,
2026-06-01,20:52:24,VGRM11,VALORA CRI CDI FLUXO MENSAL MARÇO 26 FEEDER FUNDO DE INVESTIMENTO IMOBILIÁRIO RESPONSABILIDADE LIMIT,,,,,,,,,,
2026-06-01,20:52:24,VGIR11,VALORA CRI CDI FUNDO DE INVESTIMENTO IMOBILIÁRIO - FII RESPONSABILIDADE LIMITADA,,,,,,,,,,
2026-06-01,20:52:24,VGIP11,VALORA CRI ÍNDICE DE PREÇO FUNDO DE INVESTIMENTO IMOBILIÁRIO - FII RESPONSABILIDADE LIMITADA,,,,,,,,,,
2026-06-01,20:52:24,VGII11,VALORA CRI INFRA II FUNDO DE INVESTIMENTO IMOBILIÁRIO DE RESPONSABILIDADE LIMITADA,,,,,,,,,,
2026-06-01,20:52:24,VGHF11,VALORA HEDGE FUND FUNDO DE INVESTIMENTO IMOBILIÁRIO DE RESPONSABILIDADE LIMITADA,,,,,,,,,,
2026-06-01,20:52:24,VGRI11,VALORA RENDA IMOBILIÁRIA FUNDO DE  INVESTIMENTO IMOBILIÁRIO RESPONSABILIDADE LIMITADA,,,,,,,,,,
2026-06-01,20:52:24,BLMO11,VBI OFFICE FUND II - FUNDO DE INVESTIMENTO IMOBILIÁRIO - RESPONSABILIDADE  LIMITADA,,,,,,,,,,
2026-06-01,20:52:24,VCJR11,VECTIS JUROS REAL FUNDO DE INVESTIMENTO IMOBILIÁRIO RESPONSABILIDADE LIMITADA,,,,,,,,,,
2026-06-01,20:52:24,VLJS11,VECTOR QUELUZ LAJES CORPORATIVAS FUNDO DE INVESTIMENTO IMOBILIARIO,,,,,,,,,,
2026-06-01,20:52:24,VNSS11,VENUS 11 FUNDO DE INVESTIMENTO EM COTAS DE FUNDO DE INVESTIMENTO IMOBILIÁRIO RESPONSABILIDADE LIMITA,,,,,,,,,,
2026-06-01,20:52:24,SALI11,VÊNUS FUNDO DE INVESTIMENTO IMOBILIÁRIO RESPONSABILIDADE LIMITADA,,,,,,,,,,
2026-06-01,20:52:24,VCTH11,VERA CRUZ THREE FUNDO DE INVESTIMENTO IMOBILIÁRIO RESPONSABILIDADE LIMITADA,,,,,,,,,,
2026-06-01,20:52:24,VSLH11,VERSALHES RECEBÍVEIS IMOBILIÁRIOS FUNDO DE INVESTIMENTO IMOBILIÁRIO DE RESPONSABILIDADE LIMITADA,,,,,,,,,,
2026-06-01,20:52:24,VGRD11,VGR DESENVOLVIMENTO RESIDENCIAL FUNDO DE INVESTIMENTO IMOBILIÁRIO DE RESPONSABILIDADE LIMITADA,,,,,,,,,,
2026-06-01,20:52:24,FVPQ11,VIA PARQUE SHOPPING FUNDO DE INVESTIMENTO IMOBILIÁRIO DE RESPONSABILIDADE LIMITADA,,,,,,,,,,
2026-06-01,20:52:24,VIDS11,VIC DESENVOLVIMENTO - VINTAGE 20/21 FUNDO DE INVESTIMENTO IMOBILIÁRIO - RESPONSABILIDADE LIMITADA,,,,,,,,,,
2026-06-01,20:52:24,VDSV11,VIC DESENVOLVIMENTO VINTAGE 22/23 FUNDO DE INVESTIMENTO IMOBILIÁRIO,,,,,,,,,,
2026-06-01,20:52:24,VCRI11,VINCI CREDIT SECURITIES FUNDO DE INVESTIMENTO IMOBILIÁRIO - RESPONSABILIDADE LIMITADA,,,,,,,,,,
2026-06-01,20:52:24,VIUR11,VINCI IMÓVEIS URBANOS FUNDO DE INVESTIMENTO IMOBILIÁRIO - RESPONSABILIDADE  LIMITADA,,,,,,,,,,
2026-06-01,20:52:24,VILG11,VINCI LOGÍSTICA FUNDO DE INVESTIMENTO IMOBILIÁRIO - RESPONSABILIDADE LIMITADA,,,,,,,,,,
2026-06-01,20:52:24,VIMO11,VINCI MOZAK RESIDENCIAL II FUNDO DE INVESTIMENTO IMOBILIÁRIO - RESPONSABILIDADE LIMITADA,,,,,,,,,,
2026-06-01,20:52:24,VINO11,VINCI OFFICES FUNDO DE INVESTIMENTO IMOBILIÁRIO - RESPONSABILIDADE LIMITADA,,,,,,,,,,
2026-06-01,20:52:24,VIOL11,VINCI OPORTUNIDADES LOGÍSTICAS FII RESPONSABILIDADE LIMITADA,,,,,,,,,,
2026-06-01,20:52:24,VISC11,VINCI SHOPPING CENTERS FUNDO DE INVESTIMENTO IMOBILIÁRIO - RESPONSABILIDADE LIMITADA,,,,,,,,,,
2026-06-01,20:52:24,SPDE11,WHG FINVEST SP REALTY FUNDO DE INVESTIMENTO IMOBILIÁRIO - RESPONSABILIDADE LIMITADA,,,,,,,,,,
2026-06-01,20:52:24,WHGR11,WHG REAL ESTATE FUNDO DE INVESTIMENTO IMOBILIÁRIO - FII RESPONSABILIDADE LIMITADA,,,,,,,,,,
2026-06-01,20:52:24,XLPR11,XLPR FUNDO DE INVESTIMENTO IMOBILIÁRIO - FII - RESPONSABILIDADE LIMITADA,,,,,,,,,,
2026-06-01,20:52:24,XPCM11,XP CORPORATE MACAÉ FUNDO DE INVESTIMENTO IMOBILIÁRIO DE RESPONSABILIDADE LIMITADA,,,,,,,,,,
2026-06-01,20:52:24,XPCI11,XP CRÉDITO IMOBILIÁRIO - FUNDO DE INVESTIMENTO IMOBILIÁRIO,,,,,,,,,,
2026-06-01,20:52:24,XPLG11,XP LOG FUNDO DE INVESTIMENTO IMOBILIÁRIO RESPONSABILIDADE LIMITADA - FII,,,,,,,,,,
2026-06-01,20:52:24,XPML11,XP MALLS FUNDO DE INVESTIMENTO IMOBILIÁRIO FII,,,,,,,,,,
2026-06-01,20:52:24,XPSF11,XP SELECTION FUNDO DE FUNDOS DE INVESTIMENTO IMOBILIÁRIO - FII,,,,,,,,,,
2026-06-01,20:52:24,YUFI11,YUCA FUNDO DE INVESTIMENTO IMOBILIÁRIO RESPONSABILIDADE LIMITADA,,,,,,,,,,
2026-06-01,20:52:24,ZAGH11,ZAGROS MULTIESTRATÉGIA FUNDO DE INVESTIMENTO IMOBILIÁRIO RESPONSABILIDADE LIMITADA,,,,,,,,,,
2026-06-01,20:52:24,GGRC11,ZAGROS RENDA IMOBILIÁRIA FUNDO DE INVESTIMENTO IMOBILIÁRIO RESPONSABILIDADE LIMITADA,,,,,,,,,,
2026-06-01,20:52:24,ZAVC11,ZAVIT CRÉDITO IMOBILIÁRIO FUNDO DE INVESTIMENTO IMOBILIÁRIO - RESPONSABILIDADE LIMITADA,,,,,,,,,,
2026-06-01,20:52:24,ZAVI11,ZAVIT REAL ESTATE FUND - FUNDO DE INVESTIMENTO IMOBILIÁRIO - RESPONSABILIDADE LIMITADA,,,,,,,,,,
2026-06-01,20:52:24,ZIFI11,ZION CAPITAL FUNDO DE INVESTIMENTO IMOBILIÁRIO - FII RESPONSABILIDADE LIMITADA,,,,,,,,,,
